code,content,date,listening,title,url
OFC,"NEW YORK, Dec. 28, 2017 /PRNewswire/ -- WallStEquities.com strives to bring the best free research to the investment community.  Today we are offering reports on OFC, LPT, HPP, and NYRT which can be accessed for free by signing up to www.wallstequities.com/registration. On Wednesday, December 27, 2017, 2017, US markets saw five out of nine sectors finishing the day in green, two in red, and two in neutral territory. Major US indices were also bullish at the close of yesterday's session. The NASDAQ Composite ended the day at 6,939.34, up 0.04%; the Dow Jones Industrial Average edged 0.11% higher, to finish at 24,774.30; and the S&P 500 closed at 2,682.62, up 0.08%. This Thursday morning, WallStEquities.com looks at the performance of these four REIT - Office stocks: Corporate Office Properties Trust OFC, -0.97% Liberty Property Trust LPT, -2.21% Hudson Pacific Properties Inc. HPP, -2.24% and New York REIT Inc. NYRT, -1.12% All you have to do is sign up today for this free limited time offer, click the link below. www.wallstequities.com/registration Corporate Office Properties Trust On Wednesday, shares in Columbia, Maryland-based Corporate Office Properties Trust recorded a trading volume of 429,736 shares. The stock ended the session 0.27% higher at $29.30. The stock is trading below its 50-day moving average by 5.85%. Moreover, shares of the Company, which specializes in acquiring, developing, owning, leasing and managing high quality office and data center properties, have a Relative Strength Index (RSI) of 34.52. On December 04 [th] , 2017, research firm Evercore ISI upgraded the Company's stock rating from 'In-line' to 'Outperform'. Get the full research report on OFC for free by clicking below at: www.wallstequities.com/registration/?symbol=OFC Liberty Property Trust Malvern, Pennsylvania-based Liberty Property Trust's stock closed the day 0.26% higher at $43.21 with a total trading volume of 376,872 shares. The Company's shares have advanced 10.03% over the last twelve months. The stock is trading above its 200-day moving average by 3.34%. Additionally, shares of the Company, which provides leasing, property management, development, acquisition, and other tenant-related services for a portfolio of industrial and office properties, have an RSI of 41.44.  On December 15 [th] , 2017, research firm JP Morgan downgraded the Company's stock rating from 'Neutral' to 'Underweight'. Free research on LPT can be accessed at: www.wallstequities.com/registration/?symbol=LPT Hudson Pacific Properties Shares in Los Angeles, California-based Hudson Pacific Properties Inc. recorded a trading volume of 556,599 shares. The stock ended yesterday's trading session 0.53% higher at $33.91. The Company's shares have advanced 2.76% over the previous three months. The stock is trading above its 200-day moving average by 0.44%. Furthermore, shares of the Company, which engages in acquiring, repositioning, developing and operating high-quality office and state-of-the-art media and entertainment properties in Northern and Southern California and the Pacific Northwest, have an RSI of 43.44. Sign up today for the free research report on HPP at: www.wallstequities.com/registration/?symbol=HPP New York REIT New York-based New York REIT Inc.'s stock finished Wednesday's session 0.51% higher at $3.95 with a total trading volume of 2.23 million shares. The stock is trading below its 50-day moving average by 20.59%. Additionally, shares of the Company, which focuses on acquiring commercial real estate, as well as acquiring properties or making other real estate investments that relate to office, retail, multi-family residential, industrial, and hotel property types located primarily in New York City, have an RSI of 13.40. Wall St. Equities' research coverage also includes the downloadable free report on NYRT at: www.wallstequities.com/registration/?symbol=NYRT Wall St. Equities : Wall St. Equities (WSE) produces regular sponsored and non-sponsored reports, articles, stock market blogs, and popular investment newsletters covering equities listed on NYSE and NASDAQ and micro-cap stocks. WSE has two distinct and independent departments. One department produces non-sponsored analyst certified content generally in the form of press releases, articles and reports covering equities listed on NYSE and NASDAQ and the other produces sponsored content (in most cases not reviewed by a registered analyst), which typically consists of compensated investment newsletters, articles and reports covering listed stocks and micro-caps. Such sponsored content is outside the scope of procedures detailed below.  WSE has not been compensated; directly or indirectly; for producing or publishing this document.  PRESS RELEASE PROCEDURES: The non-sponsored content contained herein has been prepared by a writer (the ""Author"") and is fact checked and reviewed by a third-party research service company (the ""Reviewer"") represented by a credentialed financial analyst [for further information on analyst credentials, please email info@wallstequities.com. Rohit Tuli, a CFA® charterholder (the ""Sponsor""), provides necessary guidance in preparing the document templates. The Reviewer has reviewed and revised the content, as necessary, based on publicly available information which is believed to be reliable. Content is researched, written and reviewed on a reasonable-effort basis. The Reviewer has not performed any independent investigations or forensic audits to validate the information herein. The Reviewer has only independently reviewed the information provided by the Author according to the procedures outlined by WSE. WSE is not entitled to veto or interfere in the application of such procedures by the third-party research service company to the articles, documents or reports, as the case may be. Unless otherwise noted, any content outside of this document has no association with the Author or the Reviewer in any way.   NO WARRANTY WSE, the Author, and the Reviewer are not responsible for any error which may be occasioned at the time of printing of this document or any error, mistake or shortcoming. No liability is accepted whatsoever for any direct, indirect or consequential loss arising from the use of this document. WSE, the Author, and the Reviewer expressly disclaim any fiduciary responsibility or liability for any consequences, financial or otherwise arising from any reliance placed on the information in this document. Additionally, WSE, the Author, and the Reviewer do not (1) guarantee the accuracy, timeliness, completeness or correct sequencing of the information, or (2) warrant any results from use of the information. The included information is subject to change without notice.  NOT AN OFFERING This document is not intended as an offering, recommendation, or a solicitation of an offer to buy or sell the securities mentioned or discussed, and is to be used for informational purposes only. Please read all associated disclosures and disclaimers in full before investing. Neither WSE nor any party affiliated with us is a registered investment adviser or broker-dealer with any agency or in any jurisdiction whatsoever. To download our report(s), read our disclosures, or for more information, visit https://wallstequities.com/legal-disclaimer/ CONTACT For any questions, inquiries, or comments reach out to us directly. If you're a company, we are covering and wish to no longer feature on our coverage list contact us via email and/or phone between 09:30 EDT to 16:00 EDT from Monday to Friday at:Email: info@wallstequities.com Phone number: +21-32-044-483 Office Address: 1 Scotts Road #24-10, Shaw Center Singapore 228 CFA® and Chartered Financial Analyst® are registered trademarks owned by CFA Institute. View original content:http://www.prnewswire.com/news-releases/pre-market-technical-scan-on-reit-office-equities----corporate-office-properties-trust-liberty-property-trust-hudson-pacific-properties-and-new-york-reit-300575718.html SOURCE Wall St. Equities Copyright (C) 2017 PR Newswire. All rights reserved From MarketWatch How to Run a Better Meeting: Advice From Extremely Successful People More Coverage Damn the torpedoes — what could take the S&P 500 to 3,000 BlackRock fund manager sees this as the market’s ‘sweet spot’ Stephen Hawking’s final Reddit post is going viral over its ominous warning about robots","Dec 28, 2017 7:05 a.m. ET",N/A,"Pre-Market Technical Scan on REIT-Office Equities -- Corporate Office Properties Trust, Liberty Property Trust, Hudson Pacific Properties, and New York REIT",https://www.marketwatch.com/story/pre-market-technical-scan-on-reit-office-equities----corporate-office-properties-trust-liberty-property-trust-hudson-pacific-properties-and-new-york-reit-2017-12-28
OFC,"COLUMBIA, Md., Nov 09, 2017 (BUSINESS WIRE) -- Corporate Office Properties Trust (“COPT” or the “Company”) OFC announced today that its Board of Trustees declared the Company’s 80 [th] consecutive Common Share of beneficial interest quarterly dividend. The fourth quarter 2017 dividend of $0.275 per share represents an annualized amount of $1.10 per share, and is payable on January 16, 2018 to shareholders of record on December 29, 2017. Company Information COPT is an office REIT that owns, manages, develops and selectively acquires office and data center properties in locations that support the United States Government and its contractors, most of whom are engaged in national security, defense and information technology (“IT”) related activities servicing priority missions (“Defense/IT Locations”). The Company also owns a portfolio of office properties located in select urban/urban-like submarkets within its regional footprint with durable Class-A office fundamentals and characteristics (“Regional Office Properties”). As of September 30, 2017, the Company derived 87% of core portfolio annualized revenue from Defense/IT Locations and 13% from its Regional Office Properties. As of September 30, 2017 and including six buildings owned through an unconsolidated joint venture, COPT’s core portfolio of 153 office properties encompassed 16.7 million square feet and was 95.1% leased. As of the same date, the Company also owned one wholesale data center with a critical load of 19.25 megawatts. Forward-Looking Information This press release may contain “forward-looking” statements, as defined in Section 27A of the Securities Act of 1933 and Section 21E of the Securities Exchange Act of 1934, that are based on the Company’s current expectations, estimates and projections about future events and financial trends affecting the Company. Forward-looking statements can be identified by the use of words such as “may,” “will,” “should,” “could,” “believe,” “anticipate,” “expect,” “estimate,” “plan” or other comparable terminology. Forward-looking statements are inherently subject to risks and uncertainties, many of which the Company cannot predict with accuracy and some of which the Company might not even anticipate. Accordingly, the Company can give no assurance that these expectations, estimates and projections will be achieved. Future events and actual results may differ materially from those discussed in the forward-looking statements. Important factors that may affect these expectations, estimates, and projections include, but are not limited to: general economic and business conditions, which will, among other things, affect office property and data center demand and rents, tenant creditworthiness, interest rates, financing availability and property values; adverse changes in the real estate markets including, among other things, increased competition with other companies; governmental actions and initiatives, including risks associated with the impact of a prolonged government shutdown or budgetary reductions or impasses, such as a reduction in rental revenues, non-renewal of leases, and/or a curtailment of demand for additional space by the Company's strategic customers; the Company’s ability to borrow on favorable terms; risks of real estate acquisition and development activities, including, among other things, risks that development projects may not be completed on schedule, that tenants may not take occupancy or pay rent or that development or operating costs may be greater than anticipated; risks of investing through joint venture structures, including risks that the Company’s joint venture partners may not fulfill their financial obligations as investors or may take actions that are inconsistent with the Company’s objectives; changes in the Company’s plans for properties or views of market economic conditions or failure to obtain development rights, either of which could result in recognition of significant impairment losses; the Company’s ability to satisfy and operate effectively under Federal income tax rules relating to real estate investment trusts and partnerships; the Company's ability to achieve projected results; the dilutive effects of issuing additional common shares; and environmental requirements. The Company undertakes no obligation to update or supplement any forward-looking statements. For further information, please refer to the Company’s filings with the Securities and Exchange Commission, particularly the section entitled “Risk Factors” in Item 1A of the Company’s Annual Report on Form 10-K for the year ended December 31, 2016. View source version on businesswire.com: http://www.businesswire.com/news/home/20171109006458/en/ SOURCE: Corporate Office Properties Trust Corporate Office Properties Trust IR Contacts: Stephanie Krewson-Kelly, 443-285-5453 stephanie.kelly@copt.com or Michelle Layne, 443-285-5452 michelle.layne@copt.com Copyright Business Wire 2017","Nov 9, 2017 4:16 p.m. ET",N/A,"COPT Declares 80th 
      Consecutive Common Dividend",https://www.marketwatch.com/story/copt-declares-80th-consecutive-common-dividend-2017-11-09
OFC,"NEW YORK, Nov. 9, 2017 /PRNewswire/ -- If you want a Stock Review on OFC, HPP, LPT, or NYRT then come over to http://dailystocktracker.com/register/ and sign up for your free customized report. On Wednesday, November 08, 2017, the NASDAQ Composite ended the trading session at 6,789.12, up 0.32%; the Dow Jones Industrial Average edged 0.03% higher, to finish at 23,563.36; and the S&P 500 closed at 2,594.38, slightly advancing 0.14%. US markets saw five out of nine sectors finishing the day in green, three in red, and one in neutral territory. This Thursday, DailyStockTracker.com has initiated reports coverage on the following REIT - Office equities: Corporate Office Properties Trust OFC, -1.01% Hudson Pacific Properties Inc. HPP, -2.20% Liberty Property Trust LPT, -2.16% and New York REIT Inc. NYRT, -1.12% Take a look at the free research reports issued today on DailyStockTracker.com for these stocks by signing up at: http://dailystocktracker.com/register/ Corporate Office Properties Trust Columbia, Maryland-based Corporate Office Properties Trust's stock finished Wednesday's session 0.28% lower at $32.29 with a total trading volume of 1.15 million shares, which was above its three months average volume of 708.98 thousand shares. The Company's shares have advanced 24.24% over the past twelve months. The stock is trading below its 50-day moving average by 1.29%. Additionally, shares of the Company, which invests in real estate markets of US, have a Relative Strength Index (RSI) of 48.09. On October 27 [th] , 2017, research firm Evercore ISI upgraded the Company's stock rating from 'Underperform' to 'In-line'. Sign up and read the free research report on OFC at: http://dailystocktracker.com/registration/?symbol=OFC Hudson Pacific Properties On Wednesday, shares in Los Angeles, California-based Hudson Pacific Properties Inc. recorded a trading volume of 761,931 shares. The stock ended the session 0.60% higher at $35.03. The Company's shares have advanced 8.96% in the previous three months. The stock is trading above its 50-day and 200-day moving averages by 5.76% and 3.50%, respectively. Moreover, shares of the Company, which engages in acquiring, repositioning, developing and operating high-quality office and state-of-the-art media and entertainment properties in Northern and Southern California and the Pacific Northwest, have an RSI of 76.95. The complimentary research report on HPP can be downloaded at: http://dailystocktracker.com/registration/?symbol=HPP Liberty Property Trust Malvern, Pennsylvania-based Liberty Property Trust's shares closed the day 0.74% higher at $44.75. The stock recorded a trading volume of 681,110 shares. The Company's shares have gained 10.00% over the previous three months, 12.07% over the last twelve months, and 13.29% since the start of the year. The stock is trading above its 50-day and 200-day moving averages by 5.75% and 9.42%, respectively. Additionally, shares of the Company, which through its subsidiary, it provides leasing, property management, development, acquisition, and other tenant-related services for a portfolio of industrial and office properties, have an RSI of 75.28. On October 25 [th] , 2017, research firm Sandler O'Neill upgraded the Company's stock rating from 'Sell' to 'Hold'. Register for free on DailyStockTracker.com and access the latest report on LPT at: http://dailystocktracker.com/registration/?symbol=LPT New York REIT Shares in New York REIT Inc. finished 0.27% higher at $7.32. The stock recorded a trading volume of 2.81 million shares, which was above its three months average volume of 2.39 million shares. The stock is trading below its 50-day moving average by 6.24%. Furthermore, shares of New York REIT, which focuses on acquiring commercial real estate, as well as acquiring properties or making other real estate investments that relate to office, retail, multi-family residential, industrial, and hotel property types located primarily in New York City, have an RSI of 22.28. Get free access to your research report on NYRT at: http://dailystocktracker.com/registration/?symbol=NYRT Daily Stock Tracker: Daily Stock Tracker (DST) produces regular sponsored and non-sponsored reports, articles, stock market blogs, and popular investment newsletters covering equities listed on NYSE and NASDAQ and micro-cap stocks. DST has two distinct and independent departments. One department produces non-sponsored analyst certified content generally in the form of press releases, articles and reports covering equities listed on NYSE and NASDAQ and the other produces sponsored content (in most cases not reviewed by a registered analyst), which typically consists of compensated investment newsletters, articles and reports covering listed stocks and micro-caps. Such sponsored content is outside the scope of procedures detailed below.  DST has not been compensated; directly or indirectly; for producing or publishing this document.  PRESS RELEASE PROCEDURES: The non-sponsored content contained herein has been prepared by a writer (the ""Author"") and is fact checked and reviewed by a third party research service company (the ""Reviewer"") represented by a credentialed financial analyst [for further information on analyst credentials, please email contact@dailystocktracker.com. Rohit Tuli, a CFA® charterholder (the ""Sponsor""), provides necessary guidance in preparing the document templates. The Reviewer has reviewed and revised the content, as necessary, based on publicly available information which is believed to be reliable. Content is researched, written and reviewed on a reasonable-effort basis. The Reviewer has not performed any independent investigations or forensic audits to validate the information herein. The Reviewer has only independently reviewed the information provided by the Author according to the procedures outlined by DST. DST is not entitled to veto or interfere in the application of such procedures by the third-party research service company to the articles, documents or reports, as the case may be. Unless otherwise noted, any content outside of this document has no association with the Author or the Reviewer in any way.   NO WARRANTY DST, the Author, and the Reviewer are not responsible for any error which may be occasioned at the time of printing of this document or any error, mistake or shortcoming. No liability is accepted whatsoever for any direct, indirect or consequential loss arising from the use of this document. DST, the Author, and the Reviewer expressly disclaim any fiduciary responsibility or liability for any consequences, financial or otherwise arising from any reliance placed on the information in this document. Additionally, DST, the Author, and the Reviewer do not (1) guarantee the accuracy, timeliness, completeness or correct sequencing of the information, or (2) warrant any results from use of the information. The included information is subject to change without notice.  NOT AN OFFERING This document is not intended as an offering, recommendation, or a solicitation of an offer to buy or sell the securities mentioned or discussed, and is to be used for informational purposes only. Please read all associated disclosures and disclaimers in full before investing. Neither DST nor any party affiliated with us is a registered investment adviser or broker-dealer with any agency or in any jurisdiction whatsoever. To download our report(s), read our disclosures, or for more information, visit http://dailystocktracker.com/disclaimer/ CONTACTFor any questions, inquiries, or comments reach out to us directly. If you're a company we are covering and wish to no longer feature on our coverage list contact us via email and/or phone between 09:30 EDT to 16:00 EDT from Monday to Friday at:Email: contact@dailystocktracker.com  Phone number: (207)331-3313Office Address: 377 Rivonia Boulevard, Rivonia, South Africa CFA® and Chartered Financial Analyst® are registered trademarks owned by CFA Institute. View original content:http://www.prnewswire.com/news-releases/stocks-under-scanner-in-the-reit-space----corporate-office-properties-trust-hudson-pacific-properties-liberty-property-trust-and-new-york-reit-300552787.html SOURCE dailystocktracker.com Copyright (C) 2017 PR Newswire. All rights reserved From MarketWatch What Picking Up an Apple Tells You About the Future of Robotics More Coverage Stephen Hawking’s final Reddit post is going viral over its ominous warning about robots What America’s gun fanatics won’t tell you 2 sexy ways to get paid to save","Nov 9, 2017 6:50 a.m. ET",N/A,"Stocks Under Scanner in the REIT Space -- Corporate Office Properties Trust, Hudson Pacific Properties, Liberty Property Trust, and New York REIT",https://www.marketwatch.com/story/stocks-under-scanner-in-the-reit-space----corporate-office-properties-trust-hudson-pacific-properties-liberty-property-trust-and-new-york-reit-2017-11-09
