code,content,date,listening,title,url
ABIL,"TEL AVIV, Israel, Mar 21, 2018 (GLOBE NEWSWIRE via COMTEX) -- Ability Inc. ABIL, -0.91% ABIWF (tase:ABIL) (the ""Company""), a provider of innovative tactical communications intelligence solutions, today announced a 1-for-10 consolidation of its ordinary shares. Beginning on the open of trading on Friday, March 23, 2018, the Company's ordinary shares will trade on a post-consolidated basis on the Nasdaq Capital Market under the Company's existing trading symbol, ""ABIL."" Beginning on the open of trading on Sunday, March 25, 2018, the Company's ordinary shares will trade on a post-consolidated basis on the Tel Aviv Stock Exchange (TASE) under the Company's existing trading symbol, ""ABIL."" The new CUSIP number for the Company's ordinary shares following the consolidation will be G8789K124. In addition, pursuant to their terms, a proportionate adjustment will be made to the per share exercise price and number of shares issuable under the Company's warrants that are currently quoted on the OTC Pink. At market open on March 23, 2018, these warrants will trade on a post-consolidation basis under the trading symbol ""ABIWFD"" for 20 business days, after which time the ""D"" will be removed and the warrants will resume trading under the ticker symbol ""ABIWF"". The new CUSIP number for these warrants following the consolidation will be G8789K132. As previously reported, the Company currently has until April 9, 2018 to regain compliance with the Nasdaq Stock Market's minimum bid price requirement, and, to regain compliance, the Company's ordinary shares must have a minimum bid price per share of at least $1.00 for 10 consecutive business days. The principal reason for the consolidation is to increase the per share trading price of the Company's ordinary share in order to help ensure a share price high enough to satisfy the $1.00 per share minimum bid price requirement. However, there can be no assurance that the consolidation will have the desired effect of sufficiently raising the bid price of the Company's ordinary shares for the required period. The consolidation was previously approved by the Company's shareholders at the Company's annual general meeting held on December 27, 2017. At the effective time of the consolidation on the OTC Pink, Nasdaq and the TASE, every ten ordinary shares of the Company will be combined into one ordinary share of the Company. No fractional shares will be issued as a result of the consolidation and instead, all fractional shares will be rounded to the next whole number of shares. When the consolidation takes effect, shareholders holding ordinary shares in book-entry form or through a brokerage account will have their shares automatically adjusted to reflect the consolidation on the effective date. For those shareholders holding physical share certificates, the Company's transfer agent, Continental Stock Transfer & Trust Company Inc., will send a letter of transmittal providing instructions for the exchange of shares. Additional information about the consolidation can be found in the Company's proxy statement filed with the Securities and Exchange Commission on December 7, 2017, a copy of which is available at www.sec.gov. About Ability Inc. Ability Inc. is the sole owner of Ability Computer & Software Industries Ltd. (""Ability"") and Ability Security Systems Ltd. Headquartered in Tel Aviv, Israel, Ability was founded in 1994. Ability provides advanced interception, geolocation and cyber intelligence tools used by security and intelligence agencies, military forces, law enforcement and homeland security agencies worldwide. Ability has sold to governments and government agencies in over 50 countries. Ability offers a broad range of lawful interception, decryption, cyber and geolocation solutions for cellular and satellite communication, including ULIN, or Ultimate Interceptor, which to our knowledge, is the first-to-market SaaS strategic interception system with voice and geolocation capabilities without geographic limitation. State-of-the-art technology underpins Ability's scalable offerings, which can be tactical-and-portable, or strategic-and-fixed, depending on its customers' needs. Additional information regarding Ability may be found at http://www.interceptors.com. Caution Regarding Forward-Looking Statements This press release contains ""forward-looking statements."" Words such as ""may,"" ""should,"" ""could,"" ""would,"" ""predicts,"" ""potential,"" ""continue,"" ""expects,"" ""anticipates,"" ""future,"" ""intends,"" ""plans,"" ""believes,"" ""estimates,"" and similar expressions, as well as statements in future tense, often signify forward-looking statements. Forward-looking statements should not be read as a guarantee of future performance or results and may not be accurate indications of when such performance or results will be achieved. Forward-looking statements are based on information that the Company has when those statements are made or management's good faith belief as of that time with respect to future events, and are subject to risks and uncertainties that could cause actual performance or results to differ materially from those expressed in or suggested by the forward-looking statements. The Company assumes no obligation to publicly update or revise its forward-looking statements as a result of new information, future events or otherwise. Investor Relations Contacts: MS-IR LLC Miri Segal Tel: 917-607-8654 msegal@ms-ir.com Copyright (C) 2018 GlobeNewswire, Inc. All rights reserved. From MarketWatch Why It Feels Like Facebook Is Listening Through Your Mic More Coverage Why every investor should be terrified by the slide in Home Depot stock Stephen Hawking’s final Reddit post is going viral over its ominous warning about robots BlackRock fund manager sees this as the market’s ‘sweet spot’","Mar 21, 2018 5:04 p.m. ET",N/A,Ability Inc. Announces Share Consolidation,https://www.marketwatch.com/story/ability-inc-announces-share-consolidation-2018-03-21-17184430
ABIL,"TEL AVIV, Israel, Jan 17, 2018 (GLOBE NEWSWIRE via COMTEX) -- Ability Inc. ABIL, -0.91% (the ""Company""), a leading provider of innovative tactical communications intelligence solutions, today announced that it received notification from the Listing Qualifications Department of The Nasdaq Stock Market (the ""Staff"") that the Company is not in compliance with Nasdaq Listing Rule 5550(b)(1) due to the Company's failure to maintain a minimum of $2,500,000 in shareholders' equity (the ""Minimum Shareholders' Equity Requirement"") or any alternatives to such requirement. Nasdaq's notice has no immediate effect on the listing of the Company's ordinary shares on The Nasdaq Capital Market. Nasdaq has provided the Company with 45 days, or until February 26, 2018, to submit to Nasdaq a plan to regain compliance with the Minimum Shareholders' Equity Requirement. If Nasdaq accepts the Company's plan, Nasdaq may grant an extension of up to 180 calendar days from the date of the notice, or until July 11, 2018, to evidence compliance with the Minimum Shareholders' Equity Requirement. The Company intends to evaluate its courses of action and to timely submit a plan to Nasdaq to regain compliance with the Nasdaq Minimum Shareholders' Equity Requirement. However, there can be no assurance that the Company's plan will be accepted or that if it is, the Company will be able to regain compliance. About Ability Inc. Ability Inc. is the sole owner of Ability Computer & Software Industries Ltd. (""Ability"") and Ability Security Systems Ltd. Headquartered in Tel Aviv, Israel, Ability was founded in 1994. Ability provides advanced interception, geolocation and cyber intelligence tools used by security and intelligence agencies, military forces, law enforcement and homeland security agencies worldwide. Ability has sold to governments and government agencies in over 50 countries. Ability offers a broad range of lawful interception, decryption, cyber and geolocation solutions for cellular and satellite communication, including ULIN, or Ultimate Interceptor, which to our knowledge, is the first-to-market SaaS strategic interception system with voice and geolocation capabilities without geographic limitation. State-of-the-art technology underpins Ability's scalable offerings, which can be tactical-and-portable, or strategic-and-fixed, depending on its customers' needs. Additional information regarding Ability may be found at http://www.interceptors.com. Caution Regarding Forward-Looking Statements This press release contains ""forward-looking statements."" Words such as ""may,"" ""should,"" ""could,"" ""would,"" ""predicts,"" ""potential,"" ""continue,"" ""expects,"" ""anticipates,"" ""future,"" ""intends,"" ""plans,"" ""believes,"" ""estimates,"" and similar expressions, as well as statements in future tense, often signify forward-looking statements. Forward-looking statements should not be read as a guarantee of future performance or results and may not be accurate indications of when such performance or results will be achieved. Forward-looking statements are based on information that the Company has when those statements are made or management's good faith belief as of that time with respect to future events, and are subject to risks and uncertainties that could cause actual performance or results to differ materially from those expressed in or suggested by the forward-looking statements. The Company assumes no obligation to publicly update or revise its forward-looking statements as a result of new information, future events or otherwise. Investor Relations Contacts: MS-IR LLC Miri Segal Tel: 917-607-8654 msegal@ms-ir.com Copyright (C) 2018 GlobeNewswire, Inc. All rights reserved. From MarketWatch How Russian Trolls Collected Americans' Personal Information More Coverage S&P 500 logs longest losing streak of the year as trade-war jitters weigh What America’s gun fanatics won’t tell you Delta flight scare is a reminder never to put electronics in checked baggage","Jan 17, 2018 4:16 p.m. ET",N/A,Ability Inc. Announces Receipt of Nasdaq Letter,https://www.marketwatch.com/story/ability-inc-announces-receipt-of-nasdaq-letter-2018-01-17
ABIL,"NEW YORK, January 10, 2018 /PRNewswire via COMTEX/ -- NEW YORK, January 10, 2018 /PRNewswire/ -- According to a report published by Marketsandmarkets, the Internet of Things (IoT) market size is expected to grow from USD 170.57 billion in 2017 to USD 561.04 billion by 2022, at a compound annual growth rate of 26.9 percent. The report indicates that the increasing adoption of cloud platforms and the developments of advanced data analytics are some of the main factors that drive the internet of things market. North America is expected to dominate the market during the forecast period as the North American companies invest heavily in R&D. GTX Corp. GTXO, +3.45% Intermap Technologies Corporation ITMSF, +9.87% Gopher Protocol Inc. GOPH, +6.80% Ability, Inc. ABIL, -0.91% Inpixon INPX, -0.46% The report also point out that service will be the fastest growing segment in the market during the forecast period, ""the integration of new services and solutions into the company's contemporary functioning system or the infrastructure necessitates the company to be acquainted with comprehensive detailed insights about the services. Additionally, the organizations also need to have an in-depth knowledge about the benefits that the new service can offer to their customers and employees. This knowledge is provided through a specific set of channelized services offered by the IoT service providers, and sometimes the solution providers themselves."" GTX Corp. GTXO, +3.45% an Internet of Things (IoT) solutions provider in the personal location, wearable and wandering assistive technology business, recently announced, ""that it will be presenting its new Biometric Insoles and previewing some of its other new products scheduled for launch in 2018, including the children's GPS SmartSole®, GPS InvisaBelt designed for toddlers and the Armatrak GPS Rifle Tracker, at the annual Consumer Electronics Show (CES) in Las VegasJanuary 9-12. Executives from GTX and the Company's strategic partner, Veristride, will be scheduling one-on-one appointments throughout the week. For those interested in learning more about this ground breaking and cost savings technology can stop by Thursday, January 11 from 2:00 to 5:00 PM PST in hospitality suite 310 at the Las Vegas Westgate Tower. To schedule a meeting please send an email with CES Meeting in the subject line to info@gtxcorp.com . GTX Corp and Veristride began collaboration in August of 2017 to develop an easy to use, nonvisible, inductive charging, wearable gait solution to analyze movement and activity, using custom sensors at the foot and biomechanical analytics and algorithms to provide gait analysis and movement which is considered a key metric in fall risk detection and prevention for people 65 and older. Gait analysis can also help detect if there is a sudden adverse reaction to new or existing medication, an undetected stroke or even early onset of dementia - all of which for seniors is vital to their wellness, longevity and quality of life, while prevention and early detection can save millions of dollars in healthcare costs. Each year, 2.8 million older people are treated in emergency departments for fall injuries. Over 800,000 patients a year are hospitalized because of a fall injury, most often because of a head injury or hip fracture. Adjusted for inflation, the direct medical costs fall injuries are $31 billion annually.10 Hospital costs account for two-thirds of the total. Patrick Bertagna, GTX Corp CEO, commented, ""Despite preventive efforts, falling continues to be a major problem for seniors both at home and in community or assisted living facilities, not to mention the tremendous cost to the healthcare industry. By simply wearing a pair of biometric insoles, we will be able to monitor a person's activity and any change in balance which in many cases can tell us a lot about that person's overall well-being. Seniors need to stay as active as possible, but many times due to aging, fear, loss of motor skills or loss of memory, they become sedate, which leads to a decline in overall health. Our goal is to provide seniors with wearable technologies that empower them to stay active while not compromising their safety. Being able to prevent, delay or accurately predict falls, undetected strokes, affect from medicines and even early onset of dementia by wearing a smart non-intrusive footwear device can offer significant improvements in senior care and wellness along with substantial cost savings."" …Stacy Bamberg, Veristride CEO, added, ""We are excited to present and demonstrate our gait analytics technology at CES. The biometric insoles will address many important needs for the senior community and help remedy the physical, emotional and financial stresses due to falling. By providing constant symmetry information anytime and anywhere, without having to go to a doctor's office or see a physical therapist, will help drastically improve how people live their lives and the healthcare industry manages costs."" Intermap Technologies Corporation ITMSF, +9.87% is an industry leader in geospatial intelligence solutions. These geospatial solutions are used in a wide range of applications including, but not limited to, location-based information, risk assessment, geographic information systems, engineering, utilities, global positioning systems, oil and gas, renewable energy, hydrology, environmental planning, land management, wireless communications, transportation, advertising, and 3D visualization. On November 15, 2017, the company reported financial results for the third quarter ended September 30, 2017. For the third quarter of 2017, Intermap reported net income of $1.1 million, compared to a net loss of $2.0 million for the same period last year. Total revenue for the quarter increased 91% to $6.3 million, compared to $3.3 million last year.  Gopher Protocol Inc. (otcqb:GOPH) is a development-stage company which consider itself Native IoT creator, developing Internet of Things (IoT) and Artificial Intelligence enabled mobile technology. The Company has a portfolio of Intellectual Property that when commercialized will include smart microchips, mobile application software and supporting cloud software. On December 21, 2017, the company announced that its joint venture partner entered into an agreement with a developer/manufacturer to begin manufacturing prototypes of its proprietary pet tracking device. The Guardian Orb Pet Tracker is a derivative technology of Gopher's Guardian Patch tracking technology and is designed to provide its users with local tracking capability using a re-chargeable/replaceable battery source. Ability, Inc. ABIL, -0.91% provides advanced interception, geolocation and cyber intelligence tools used by security and intelligence agencies, military forces, law enforcement and homeland security agencies worldwide. Ability offers a broad range of lawful interception, decryption, cyber and geolocation solutions for cellular and satellite communication, including ULIN, or Ultimate Interception, the first-to-market SaaS strategic interception system with voice, text and geolocation capabilities without geographic limitation. State-of-the-art technology underpins Ability's scalable offerings, which can be tactical-and-portable, or strategic-and-fixed, depending on its customers' needs. Inpixon INPX, -0.46% is a leader in Indoor Positioning and Data Analytics. Inpixon sensors are designed to find all accessible cellular, Wi-Fi, and Bluetooth devices anonymously. Paired with a high performance, data analytics platform this technology delivers visibility, security, and business intelligence on any commercial or government premises world-wide. Inpixon's products, infrastructure solutions, and professional services group help customers take advantage of mobile, big data, analytics, and the Internet of Things (IoT) to uncover the untold stories of the indoors. Recently, the company announced that it will use blockchain to develop a global repository of device reputations to help enterprise security and retailers mitigate rogue-device risk proactively. For enterprise security, where the burgeoning use of the Internet of Things (IoT) is exposing businesses to unaccounted amounts of threat, the use of blockchain technologies in our IPA will assist to maintain and propagate device reputation, enforcing security policies and attaining compliance. Subscribe Now! Watch us report from NYSE https://www.youtube.com/FinancialBuzzMedia Follow us on Twitter for real time Financial News Updates: https://twitter.com/financialbuzz Follow and talk to us on Instagram: https://www.instagram.com/financialbuzz Facebook Like Us to receive live feeds: https://www.facebook.com/Financialbuzz/ About FinancialBuzz.com FinancialBuzz.com, a leading financial news informational web portal designed to provide the latest trends in Market News, Investing News, Personal Finance, Politics, Entertainment, in-depth broadcasts on Stock News, Market Analysis and Company Interviews. A pioneer in the financially driven digital space, video production and integration of social media, FinancialBuzz.com creates 100% unique original content. FinancialBuzz.com also provides financial news PR dissemination, branding, marketing and advertising for third parties for corporate news and original content through our unique media platform that includes Newswire Delivery, Digital Advertising, Social Media Relations, Video Production, Broadcasting, and Financial Publications. Please Note: FinancialBuzz.com is not a financial advisory or advisor, investment advisor or broker-dealer and do not undertake any activities that would require such registration. The information provided on http://www.FinancialBuzz.com (the 'Site') is either original financial news or paid advertisements provided [exclusively] by our affiliates (sponsored content), FinancialBuzz.com, a financial news media and marketing firm enters into media buys or service agreements with the companies which are the subject to the articles posted on the Site or other editorials for advertising such companies. We are not an independent news media provider and therefore do not represent or warrant that the information posted on the Site is accurate, unbiased or complete. FinancialBuzz.com receives fees for producing and presenting high quality and sophisticated content on FinancialBuzz.com along with other financial news PR media services. FinancialBuzz.com does not offer any personal opinions, recommendations or bias commentary as we purely incorporate public market information along with financial and corporate news. FinancialBuzz.com only aggregates or regurgitates financial or corporate news through our unique financial newswire and media platform. For gtx corp. financial news dissemination and PR services, FinancialBuzz.com has been compensated four thousand dollars by cambridge consultants. Our fees may be either a flat cash sum or negotiated number of securities of the companies featured on this editorial or site, or a combination thereof. The securities are commonly paid in segments, of which a portion is received upon engagement and the balance is paid on or near the conclusion of the engagement. FinancialBuzz.com will always disclose any compensation in securities or cash payments for financial news PR advertising. FinancialBuzz.com does not undertake to update any of the information on the editorial or Site or continue to post information about any companies the information contained herein is not intended to be used as the basis for investment decisions and should not be considered as investment advice or a recommendation. The information contained herein is not an offer or solicitation to buy, hold or sell any security. FinancialBuzz.com, members and affiliates are not responsible for any gains or losses that result from the opinions expressed on this editorial or Site, company profiles, quotations or in other materials or presentations that it publishes electronically or in print. Investors accept full responsibility for any and all of their investment decisions based on their own independent research and evaluation of their own investment goals, risk tolerance, and financial condition. FinancialBuzz.com. By accessing this editorial and website and any pages thereof, you agree to be bound by the Terms of Use and Privacy Policy, as may be amended from time to time. None of the content issued by FinancialBuzz.com constitutes a recommendation for any investor to purchase, hold or sell any particular security, pursue a particular investment strategy or that any security is suitable for any investor. This publication is provided by FinancialBuzz.com. Each investor is solely responsible for determining whether a particular security or investment strategy is suitable based on their objectives, other securities holdings, financial situation needs, and tax status. You agree to consult with your investment advisor, tax and legal consultant before making any investment decisions. We make no representations as to the completeness, accuracy or timeless of the material provided. All materials are subject to change without notice. Information is obtained from sources believed to be reliable, but its accuracy and completeness are not guaranteed. For our full disclaimer, disclosure and Terms of Use, please visit: http://www.financialbuzz.com For further information: info@financialbuzz.com +1-877-601-1879 Url: http://www.FinancialBuzz.com SOURCE FinancialBuzz.com Copyright (C) 2018 PR Newswire. All rights reserved From MarketWatch How Russian Trolls Collected Americans' Personal Information More Coverage Bloodbath for cryptocurrencies as Bitcoin sheds 10%, now down 40% year-to-date What America’s gun fanatics won’t tell you Home sellers now use spycams to gather intel on prospective buyers","Jan 10, 2018 9:00 a.m. ET",N/A,Developments in the Internet of Things Market,https://www.marketwatch.com/story/developments-in-the-internet-of-things-market-2018-01-10
