code,content,date,listening,title,url
ABIL,"TEL AVIV, Israel, Oct. 16, 2017 /PRNewswire/ -- Ability Inc. ABIL, -0.91% (the ""Company""), a leading provider of innovative tactical communications intelligence solutions, today announced that on October 11, 2017 it received notification from the Listing Qualifications Department of The Nasdaq Stock Market (the ""Staff"") that the Company is not in compliance with the minimum bid price requirement set forth in Nasdaq's Listing Rule 5550(a)(2). Nasdaq Listing Rule 5550(a)(2) requires listed securities to maintain a minimum bid price of $1.00 per share and Nasdaq Listing Rule 5810(c)(3)(A) provides that a failure to meet the minimum bid price requirement exists if the deficiency continues for a period of 30 consecutive business days. Based on the closing bid price of the Company's ordinary shares for the 30 consecutive business days ended October 10, 2017, the Company no longer meets the minimum bid price requirement. The deficiency notification does not result in the immediate delisting of the Company's ordinary shares from the Nasdaq Capital Market. In accordance with Nasdaq Listing Rule 5810(c)(3)(A), the Company has an initial grace period of 180 calendar days, or until April 9, 2018 (the ""Compliance Period""), to regain compliance with the minimum bid price requirement. If, at any time during the Compliance Period, the bid price for the Company's ordinary shares closes at $1.00 or more for a minimum of 10 consecutive business days, the Staff will provide notification to the Company that it complies with the minimum bid price requirement, unless the Staff exercises its discretion to extend this 10-day period requirement pursuant to Nasdaq Listing Rule 5810(c)(3)(F). If the Company does not regain compliance with the minimum bid price requirement during the Compliance Period, the Company may be afforded an additional 180 calendar day period to regain compliance. To qualify, the Company would be required to meet the continued listing requirement for market value of publicly held shares and all other initial listing standards for The Nasdaq Capital Market, except for the minimum bid price requirement. In addition, the Company would be required to notify Nasdaq of its intent to cure the minimum bid price deficiency. If the Company does not regain compliance with the minimum bid price requirement during the Compliance Period and is not eligible for an additional compliance period at that time, the Staff will provide notification to the Company that its ordinary shares may be delisted. The Company would then be entitled to appeal the Staff's determination to a Nasdaq Listing Qualifications Panel and request a hearing. There can be no assurance that, if the Company does appeal the delisting determination by the Staff to the Nasdaq Listing Qualifications Panel, such appeal would be successful. At present, the Company intends to monitor the closing bid price of its ordinary shares and may, if appropriate, consider available options to regain compliance with the minimum bid price requirement, which could include effecting a reverse stock split. However, there can be no assurance that the Company will be able to regain compliance with the minimum bid price requirement. About Ability Inc. Ability Inc. is the sole owner of Ability Computer & Software Industries Ltd. (""Ability"") and Ability Security Systems Ltd. Headquartered in Tel Aviv, Israel, Ability was founded in 1994. Ability provides advanced interception, geolocation and cyber intelligence tools used by security and intelligence agencies, military forces, law enforcement and homeland security agencies worldwide. Ability has sold to governments and government agencies in over 50 countries. Ability offers a broad range of lawful interception, decryption, cyber and geolocation solutions for cellular and satellite communication, including ULIN, or Ultimate Interceptor, which to our knowledge, is the first-to-market SaaS strategic interception system with voice and geolocation capabilities without geographic limitation. State-of-the-art technology underpins Ability's scalable offerings, which can be tactical-and-portable, or strategic-and-fixed, depending on its customers' needs. Additional information regarding Ability may be found at http://www.interceptors.com. Caution Regarding Forward-Looking Statements This press release contains ""forward-looking statements."" Words such as ""may,"" ""should,"" ""could,"" ""would,"" ""predicts,"" ""potential,"" ""continue,"" ""expects,"" ""anticipates,"" ""future,"" ""intends,"" ""plans,"" ""believes,"" ""estimates,"" and similar expressions, as well as statements in future tense, often signify forward-looking statements. Forward-looking statements should not be read as a guarantee of future performance or results and may not be accurate indications of when such performance or results will be achieved. Forward-looking statements are based on information that the Company has when those statements are made or management's good faith belief as of that time with respect to future events, and are subject to risks and uncertainties that could cause actual performance or results to differ materially from those expressed in or suggested by the forward-looking statements. The Company assumes no obligation to publicly update or revise its forward-looking statements as a result of new information, future events or otherwise. Investor Relations Contacts: MS-IR LLC Miri Segal Tel: 917-607-8654 msegal@ms-ir.com   View original content:http://www.prnewswire.com/news-releases/ability-inc-announces-receipt-of-nasdaq-letter-300536656.html SOURCE Ability Inc. Copyright (C) 2017 PR Newswire. All rights reserved From MarketWatch Can the Democrats Ride a Blue Wave to Midterm Election Wins? More Coverage Trump boasts about making up facts about trade deficit to Trudeau S&P 500 logs longest losing streak of the year as trade-war jitters weigh Bloodbath for cryptocurrencies as Bitcoin sheds 10%, now down 40% year-to-date","Oct 16, 2017 6:00 a.m. ET",N/A,Ability Inc. Announces Receipt of Nasdaq Letter,https://www.marketwatch.com/story/ability-inc-announces-receipt-of-nasdaq-letter-2017-10-16
ABIL,"NEW YORK, August 11, 2017 /PRNewswire via COMTEX/ -- NEW YORK, August 11, 2017 /PRNewswire/ -- If you want a Stock Review on VSAT, ABIL, IFON, or ATEN then come over to http://dailystocktracker.com/register/ and sign up for your free customized report today. In today's pre-market research, DailyStockTracker.com has issued research reports on ViaSat Inc. VSAT, -1.32% Ability Inc. ABIL, -0.91% InfoSonics Corp. IFON, -1.29% and A10 Networks Inc. ATEN, +1.93% The Communication Equipment industry includes manufacturers of communications equipment and products that include LANs, WANs, routers, telephones, switchboards, and exchanges. Register now and get full and free access to these DailyStockTracker.com research reports at: http://dailystocktracker.com/register/ ViaSat  On Thursday, shares in Carlsbad, California headquartered ViaSat Inc. recorded a trading volume of 1.08 million shares, which was above their three months average volume of 515,690 shares. The stock ended at $60.93, rising 0.71% from the last trading session. The Company's shares are trading below their 50-day moving average by 8.76%. Furthermore, shares of ViaSat, which provides broadband and communications products and services worldwide, have a Relative Strength Index (RSI) of 27.58.  On July 26 [th] , 2017, ViaSat announced that it was selected by Northrop Grumman Corporation as a key partner in the delivery of a next-generation satellite communications (SATCOM) network to the Australian Defence Force (ADF). Under a program known as Joint Project 2008 Phase 5B2, a large multiphase project to deploy an integrated wideband SATCOM system for the ADF, ViaSat will provide its proven ground stations and dual-band Wideband Global SATCOM satellite earth terminals. Access our complete research report on VSAT for free at: http://dailystocktracker.com/registration/?symbol=VSAT Ability  Tel Aviv, Israel headquartered Ability Inc.'s stock finished yesterday's session 4.80% higher at $0.69 with a total trading volume of 35,351 shares. The Company's shares are trading below their 50-day moving average by 30.99%. Shares of the Company, which provides interception, geolocation, and cyber intelligence tools for security and intelligence agencies, military forces, law enforcement agencies, and homeland security agencies worldwide, have an RSI of 34.00. The complimentary research report on ABIL can be downloaded at: http://dailystocktracker.com/registration/?symbol=ABIL InfoSonics  At the close of trading on Thursday, shares in San Diego, California headquartered InfoSonics Corp. saw a slight decline of 0.44%, ending the day at $0.39. The stock recorded a trading volume of 501,724 shares. The Company's shares have advanced 2.18% since the start of this year. The stock is trading 14.77% below its 50-day moving average. Moreover, shares of InfoSonics, which together with its subsidiaries, defines, sources, and sells wireless telecommunication products and accessories to wireless carriers, distributors, retailers, and OEMs primarily in Latin America, Asia/Pacific, Europe, Africa, and rest of the US, have an RSI of 39.95.  On July 26 [th] , 2017, InfoSonics (IFON) and Cooltech Holding Corp. announced that they have entered into a definitive merger agreement under which IFON will acquire Cooltech, an Apple licensed partner and reseller that operates as a vertically integrated company. Upon the closing of the merger transaction, the latter will become a wholly-owned subsidiary of IFON, in exchange for 62.5 million shares of IFON's common stock. Register for free on DailyStockTracker.com and get access to the latest report on IFON at: http://dailystocktracker.com/registration/?symbol=IFON A10 Networks  San Jose, California headquartered A10 Networks Inc.'s shares ended the day 5.56% lower at $6.29 with a total trading volume of 537,533 shares. The stock is trading 19.11% below its 50-day moving average. Shares of the Company, which provides software and hardware solutions in the US, Japan, and internationally, have an RSI of 31.51.   On July 14 [th] , 2017, research firm DA Davidson reiterated its 'Buy' rating on the Company's stock with a decrease of the target price from $16 a share to $9 a share. On July 27 [th] , 2017, A10 Networks broadened its Thunder Series™ portfolio of hardware appliances with solutions that help latency-sensitive financial institutions and enterprises overall. The portfolio additions include a solution that reduces latency and enhances security for high-frequency trading and financial environments, and two entry-level A10 Thunder Series Application Delivery Controllers for enterprise customers. Download your free research report on ATEN at: http://dailystocktracker.com/registration/?symbol=ATEN Daily Stock Tracker:  Daily Stock Tracker (DST) produces regular sponsored and non-sponsored reports, articles, stock market blogs, and popular investment newsletters covering equities listed on NYSE and NASDAQ and micro-cap stocks. DST has two distinct and independent departments. One department produces non-sponsored analyst certified content generally in the form of press releases, articles and reports covering equities listed on NYSE and NASDAQ and the other produces sponsored content (in most cases not reviewed by a registered analyst), which typically consists of compensated investment newsletters, articles and reports covering listed stocks and micro-caps. Such sponsored content is outside the scope of procedures detailed below.  DST has not been compensated; directly or indirectly; for producing or publishing this document.  PRESS RELEASE PROCEDURES: The non-sponsored content contained herein has been prepared by a writer (the ""Author"") and is fact checked and reviewed by a third party research service company (the ""Reviewer"") represented by a credentialed financial analyst [for further information on analyst credentials, please email contact@dailystocktracker.com. Rohit Tuli, a CFA® charterholder (the ""Sponsor""), provides necessary guidance in preparing the document templates. The Reviewer has reviewed and revised the content, as necessary, based on publicly available information which is believed to be reliable. Content is researched, written and reviewed on a reasonable-effort basis. The Reviewer has not performed any independent investigations or forensic audits to validate the information herein. The Reviewer has only independently reviewed the information provided by the Author according to the procedures outlined by DST. DST is not entitled to veto or interfere in the application of such procedures by the third-party research service company to the articles, documents or reports, as the case may be. Unless otherwise noted, any content outside of this document has no association with the Author or the Reviewer in any way.   NO WARRANTY  DST, the Author, and the Reviewer are not responsible for any error which may be occasioned at the time of printing of this document or any error, mistake or shortcoming. No liability is accepted whatsoever for any direct, indirect or consequential loss arising from the use of this document. DST, the Author, and the Reviewer expressly disclaim any fiduciary responsibility or liability for any consequences, financial or otherwise arising from any reliance placed on the information in this document. Additionally, DST, the Author, and the Reviewer do not (1) guarantee the accuracy, timeliness, completeness or correct sequencing of the information, or (2) warrant any results from use of the information. The included information is subject to change without notice.  NOT AN OFFERING  This document is not intended as an offering, recommendation, or a solicitation of an offer to buy or sell the securities mentioned or discussed, and is to be used for informational purposes only. Please read all associated disclosures and disclaimers in full before investing. Neither DST nor any party affiliated with us is a registered investment adviser or broker-dealer with any agency or in any jurisdiction whatsoever. To download our report(s), read our disclosures, or for more information, visit http://dailystocktracker.com/disclaimer/ CONTACT For any questions, inquiries, or comments reach out to us directly. If you're a company we are covering and wish to no longer feature on our coverage list contact us via email and/or phone between 09:30 EDT to 16:00 EDT from Monday to Friday at: Email: contact@dailystocktracker.com Phone number: (207)331-3313 Office Address: 377 Rivonia Boulevard, Rivonia, South Africa CFA® and Chartered Financial Analyst® are registered trademarks owned by CFA Institute. SOURCE Chelmsford Park SA Copyright (C) 2017 PR Newswire. All rights reserved From MarketWatch How Russian Trolls Collected Americans' Personal Information More Coverage Home sellers now use spycams to gather intel on prospective buyers My husband sold his grandmother’s house and paid off our mortgage — now his family is threatening to sue Why tax refunds have lost their sparkle","Aug 11, 2017 6:55 a.m. ET",N/A,"Daily Technical Summary Reports on Communication Equipment Stocks -- ViaSat, Ability, InfoSonics, and A10 Networks",https://www.marketwatch.com/story/daily-technical-summary-reports-on-communication-equipment-stocks----viasat-ability-infosonics-and-a10-networks-2017-08-11
ABIL,"NEW YORK, July 6, 2017 /PRNewswire via COMTEX/ -- NEW YORK, July 6, 2017 /PRNewswire/ -- If you want a Stock Review on ABIL, DRWI, IFON or HLIT then come over to http://dailystocktracker.com/register/ and sign up for your free customized report today. On Wednesday, July 05, 2017, US markets saw a mixed session as 4 sectors closed in green, 4 sectors finished in red, and 1 sector ended flat for the day. Major US indices were also mixed at the close of yesterday's session. The NASDAQ Composite ended the day at 6,150.86, up 0.67%; the Dow Jones Industrial Average edged 0.01% lower, to finish at 21,478.17; and the S&P 500 closed at 2,432.54, up 0.15%. This Thursday morning, DailyStockTracker.com looks at the performance of these four Communication Equipment stocks: Ability Inc. ABIL, -0.91% DragonWave Inc. DRWI, +0.00% InfoSonics Corp. IFON, -1.29% and Harmonic Inc. HLIT, -2.56% This morning's free research reports on the aforesaid equities can be accessed upon registration on DailyStockTracker.com at: http://dailystocktracker.com/register/ Ability  Tel Aviv, Israel headquartered Ability Inc.'s stock finished Wednesday's session 1.69% higher at $1.20. A total volume of 913,201 shares was traded, which was above their three months average volume of 501,080 shares. The Company's shares have skyrocketed 103.39% in the past month. The stock is trading above its 50-day moving average by 30.78%. Furthermore, shares of Ability, which provides interception, geolocation, and cyber intelligence tools for security and intelligence agencies, military forces, law enforcement agencies, and homeland security agencies worldwide, have a Relative Strength Index (RSI) of 53.52. Visit us today and download your complete report on ABIL for free at: http://dailystocktracker.com/registration/?symbol=ABIL DragonWave  Shares in Ottawa, Canada headquartered DragonWave Inc. ended at $0.83, up 3.99% from the last trading session. The stock recorded a trading volume of 79,186 shares. The Company's shares have gained 25.47% in the last one month. The stock is trading 11.03% below its 50-day moving average. Moreover, shares of DragonWave, which provides high-capacity packet microwave solutions that drive next-generation IP networks worldwide, have an RSI of 49.15. The complimentary research report on DRWI can be accessed at: http://dailystocktracker.com/registration/?symbol=DRWI InfoSonics  Shares in San Diego, California headquartered InfoSonics Corp. ended at $0.46, down 7.71% from the last trading session. The stock recorded a trading volume of 87,189 shares. The Company's shares have gained 8.36% in the last one month and 19.74% on an YTD basis. The stock is trading 6.31% below its 50-day moving average. Moreover, shares of InfoSonics, which together with its subsidiaries, defines, sources, and sells wireless telecommunication products and accessories to wireless carriers, distributors, retailers, and OEMs primarily in Latin America, Asia/Pacific, Europe, Africa, and rest of the US, have an RSI of 46.79. Register for free on DailyStockTracker.com and download the research report on IFON at: http://dailystocktracker.com/registration/?symbol=IFON Harmonic  On Wednesday, shares in San Jose, California headquartered Harmonic Inc. recorded a trading volume of 559,757 shares. The stock finished 0.95% lower at $5.20. The Company's shares have advanced 4.00% since the start of this year. The stock is trading below its 200-day moving average by 2.14%. Furthermore, shares of Harmonic, which designs, manufactures, and sells video infrastructure products and system solutions worldwide, have an RSI of 46.23. Get free access to your research report on HLIT at: http://dailystocktracker.com/registration/?symbol=HLIT Daily Stock Tracker:  Daily Stock Tracker (DST) produces regular sponsored and non-sponsored reports, articles, stock market blogs, and popular investment newsletters covering equities listed on NYSE and NASDAQ and micro-cap stocks. DST has two distinct and independent departments. One department produces non-sponsored analyst certified content generally in the form of press releases, articles and reports covering equities listed on NYSE and NASDAQ and the other produces sponsored content (in most cases not reviewed by a registered analyst), which typically consists of compensated investment newsletters, articles and reports covering listed stocks and micro-caps. Such sponsored content is outside the scope of procedures detailed below.  DST has not been compensated; directly or indirectly; for producing or publishing this document.  PRESS RELEASE PROCEDURES: The non-sponsored content contained herein has been prepared by a writer (the ""Author"") and is fact checked and reviewed by a third party research service company (the ""Reviewer"") represented by a credentialed financial analyst [for further information on analyst credentials, please email contact@dailystocktracker.com. Rohit Tuli, a CFA® charterholder (the ""Sponsor""), provides necessary guidance in preparing the document templates. The Reviewer has reviewed and revised the content, as necessary, based on publicly available information which is believed to be reliable. Content is researched, written and reviewed on a reasonable-effort basis. The Reviewer has not performed any independent investigations or forensic audits to validate the information herein. The Reviewer has only independently reviewed the information provided by the Author according to the procedures outlined by DST. DST is not entitled to veto or interfere in the application of such procedures by the third-party research service company to the articles, documents or reports, as the case may be. Unless otherwise noted, any content outside of this document has no association with the Author or the Reviewer in any way.   NO WARRANTY  DST, the Author, and the Reviewer are not responsible for any error which may be occasioned at the time of printing of this document or any error, mistake or shortcoming. No liability is accepted whatsoever for any direct, indirect or consequential loss arising from the use of this document. DST, the Author, and the Reviewer expressly disclaim any fiduciary responsibility or liability for any consequences, financial or otherwise arising from any reliance placed on the information in this document. Additionally, DST, the Author, and the Reviewer do not (1) guarantee the accuracy, timeliness, completeness or correct sequencing of the information, or (2) warrant any results from use of the information. The included information is subject to change without notice.  NOT AN OFFERING  This document is not intended as an offering, recommendation, or a solicitation of an offer to buy or sell the securities mentioned or discussed, and is to be used for informational purposes only. Please read all associated disclosures and disclaimers in full before investing. Neither DST nor any party affiliated with us is a registered investment adviser or broker-dealer with any agency or in any jurisdiction whatsoever. To download our report(s), read our disclosures, or for more information, visit http://dailystocktracker.com/disclaimer/ CONTACT For any questions, inquiries, or comments reach out to us directly. If you're a company we are covering and wish to no longer feature on our coverage list contact us via email and/or phone between 09:30 EDT to 16:00 EDT from Monday to Friday at: Email: contact@dailystocktracker.com Phone number: (207)331-3313 Office Address: 377 Rivonia Boulevard, Rivonia, South Africa CFA® and Chartered Financial Analyst® are registered trademarks owned by CFA Institute. SOURCE Chelmsford Park SA Copyright (C) 2017 PR Newswire. All rights reserved From MarketWatch How to Run a Better Meeting: Advice From Extremely Successful People More Coverage Three reasons the stock market’s fundamentals look solid Home sellers now use spycams to gather intel on prospective buyers What America’s gun fanatics won’t tell you","July 6, 2017 7:05 a.m. ET",N/A,"Communication Equipment Stocks on Investors' Radar -- Ability, DragonWave, InfoSonics, and Harmonic",https://www.marketwatch.com/story/communication-equipment-stocks-on-investors-radar----ability-dragonwave-infosonics-and-harmonic-2017-07-06
