code,content,date,listening,title,url
OEC,"LUXEMBOURG, Feb 01, 2018 (BUSINESS WIRE) -- Orion Engineered Carbons S.A. (""Orion"" or the ""Company"") OEC, -3.20% a worldwide supplier of specialty and high-performance Carbon Black, announced that the Company will release its fourth quarter 2017 results after the market closes on Thursday, February 22, 2018 to be followed by a conference call on Friday, February 23, 2018 at 8:30 a.m. (EST) The dial-in details for the live conference call are as follow: U.S. Toll Free:         1-877-407-4018 International: 1-201-689-8471 U.K. Toll Free: 0 800 756 3429 Germany Toll Free: 0 800 182 0040 Luxembourg Toll Free: 800 28 522 Luxembourg Local: 352 2786 0689 A replay of the conference call may be accessed by phone at the following numbers through March 02, 2018: U.S. Toll Free:         1-844-512-2921 U.S. Toll/International: 1-412-317-6671 Conference ID: 13674881 Additionally, a live and archived webcast of the conference call will be available on the investor relations section of the Company's website at: www.orioncarbons.com About Orion Engineered Carbons S.A. Orion is a worldwide supplier of Carbon Black. We produce a broad range of Carbon Blacks that include high-performance Specialty Gas Blacks, Furnace Blacks, Lamp Blacks, Thermal Blacks and other Carbon Blacks that tint, colorize and enhance the performance of polymers, plastics, paints and coatings, inks and toners, textile fibers, adhesives and sealants, tires, and mechanical rubber goods such as automotive belts and hoses. Orion runs 14 global production sites and four Applied Technology Centers. The group has approximately 1,441 employees worldwide. For more information please visit our website www.orioncarbons.com. Forward-Looking Statements This document contains certain forward-looking statements within the meaning of the U.S. Private Securities Litigation Reform Act of 1995. Forward-looking statements are statements of future expectations that are based on current expectations and assumptions and involve known and unknown risks and uncertainties that could cause actual results, performance or events to differ materially from those expressed or implied in these statements. You should not place undue reliance on forward-looking statements. Each forward-looking statement speaks only as of the date of the particular statement. New risk factors and uncertainties emerge from time to time and it is not possible to predict all risk factors and uncertainties, nor can we assess the extent to which any factor, or combination of factors, may cause actual results to differ materially from those contained in any forward-looking statements. We undertake no obligation to publicly update or revise any forward-looking statement as a result of new information, future events or other information, other than as required by applicable law. View source version on businesswire.com: http://www.businesswire.com/news/home/20180201005944/en/ SOURCE: Orion Engineered Carbons S.A.""> <Property FormalName=""PrimaryTwitterHandle"" Value=""@OECarbons Orion Engineered Carbons S.A. Investor Relations Diana Downey, +1 832-589-2285 Investor-Relations@orioncarbons.com Copyright Business Wire 2018 From MarketWatch Samsung Galaxy S9: Putting the Camera to the Test More Coverage Home sellers now use spycams to gather intel on prospective buyers 2 sexy ways to get paid to save BlackRock fund manager sees this as the market’s ‘sweet spot’","Feb 1, 2018 4:30 p.m. ET",N/A,"Orion Engineered Carbons Announces Fourth Quarter 2017 Earnings 
      Date and Conference Call",https://www.marketwatch.com/story/orion-engineered-carbons-announces-fourth-quarter-2017-earnings-date-and-conference-call-2018-02-01
OEC,"NEW YORK, Jan. 16, 2018 /PRNewswire/ -- WallStEquities.com strives to bring the best free research to the investment community.  Today we are offering reports on OEC, OLN, PPG, and VNTR which can be accessed for free by signing up to www.wallstequities.com/registration. Grand View Research published last June that the global Specialty Chemicals market size is projected to grow at a CAGR of 5.6% from 2017 to 2025. High demand for function-specific chemicals, owing to transitioning consumer and industrial product life cycles, has fostered industry growth in recent years. Pre-market today, WallStEquities.com reviews these four industry players: Orion Engineered Carbons S.A. OEC, -3.20% Olin Corp. OLN, -3.88% PPG Industries Inc. PPG, -3.87% and Venator Materials PLC VNTR, -3.65% All you have to do is sign up today for this free limited time offer by clicking the link below. www.wallstequities.com/registration Orion Engineered Carbons Last Friday, shares in Luxembourg headquartered Orion Engineered Carbons S.A. ended the session 0.92% lower at $27.00. The stock recorded a trading volume of 338,311 shares. The Company's shares have advanced 18.68% in the last month, 14.16% over the previous three months, and 35.34% over the past year. The stock is trading above its 50-day and 200-day moving averages by 11.37% and 25.33%, respectively. Furthermore, shares of the Company, which together with its subsidiaries, produces and sells carbon black products in Germany, the US, South Korea, Brazil, South Africa, the rest of Europe, and internationally, have a Relative Strength Index (RSI) of 73.57.   On December 26 [th] , 2017, Orion Engineered Carbons announced that on December 22 [nd] , 2017, a consent decree between Orion Engineered Carbons LLC (""Orion"") and the US Environmental Protection Agency (the ""EPA""), as well as the Louisiana Department of Environmental Quality, was lodged in the US District Court for the Western District of Louisiana. Once the consent decree is entered by the court, it will resolve the EPA's claims against Orion that were a part of the former's National Enforcement Initiative brought against all US carbon black producers. Get the full research report on OEC for free by clicking below at: www.wallstequities.com/registration/?symbol=OEC Olin Clayton, Missouri headquartered Olin Corp.'s stock finished 0.32% higher at $38.07 with a total trading volume of 1.45 million shares. The Company's shares have gained 11.02% in the last month, 7.21% in the previous three months, and 41.47% over the past year. The stock is trading above its 50-day and 200-day moving averages by 6.20% and 16.59%, respectively. Moreover, shares of Olin, which manufactures and distributes chemical products in the US and internationally, have an RSI of 64.12. On January 09 [th] , 2018, research firm Morgan Stanley initiated an 'Overweight' rating on the Company's stock, with a target price of $45 per share. Download our actionable research report on OLN at: www.wallstequities.com/registration/?symbol=OLN PPG Industries Shares in Pittsburgh, Pennsylvania headquartered PPG Industries Inc. closed the day 0.51% higher at $118.17. The stock recorded a trading volume of 1.47 million shares, which was above its three months average volume of 1.21 million shares. The Company's shares have gained 1.97% in the last month, 4.21% over the previous three months, and 21.99% over the past year. The stock is trading above its 50-day and 200-day moving averages by 1.72% and 7.18%, respectively. Moreover, shares of PPG Industries, which manufactures and distributes coatings, specialty materials, and glass products, have an RSI of 57.63.   On December 19 [th] , 2017, research firm Raymond James initiated an 'Outperform' rating on the Company's stock. On December 28 [th] , 2017, PPG Industries announced that it will issue its Q4 and full-year 2017 earnings release on January 18 [th] , 2018, before US stock markets open. The Company will hold a teleconference call that same day at 2:00 p.m. ET. Participating in that call are Michael H. McGarry, Chairman and CEO; Vincent J. Morales, Senior Vice President and CFO; and John Bruno, Director - investor relations. Register for your free report coverage on PPG at: www.wallstequities.com/registration/?symbol=PPG Venator Materials The Woodlands, Texas headquartered Venator Materials PLC's shares recorded a trading volume of 289,827 shares last Friday. The stock closed 0.13% lower at $23.91. The Company's shares have advanced 15.34% in the past month. The stock is trading 5.80% and 7.75% above its 50-day and 200-day moving averages, respectively. Additionally, shares of Venator Materials, which manufactures and markets chemical products worldwide, have an RSI of 64.35. Get the free research report on VNTR at: www.wallstequities.com/registration/?symbol=VNTR Wall St. Equities : Wall St. Equities (WSE) produces regular sponsored and non-sponsored reports, articles, stock market blogs, and popular investment newsletters covering equities listed on NYSE and NASDAQ and micro-cap stocks. WSE has two distinct and independent departments. One department produces non-sponsored analyst certified content generally in the form of press releases, articles and reports covering equities listed on NYSE and NASDAQ and the other produces sponsored content (in most cases not reviewed by a registered analyst), which typically consists of compensated investment newsletters, articles and reports covering listed stocks and micro-caps. Such sponsored content is outside the scope of procedures detailed below.  WSE has not been compensated; directly or indirectly; for producing or publishing this document.  PRESS RELEASE PROCEDURES: The non-sponsored content contained herein has been prepared by a writer (the ""Author"") and is fact checked and reviewed by a third-party research service company (the ""Reviewer"") represented by a credentialed financial analyst [for further information on analyst credentials, please email info@wallstequities.com. Rohit Tuli, a CFA® charterholder (the ""Sponsor""), provides necessary guidance in preparing the document templates. The Reviewer has reviewed and revised the content, as necessary, based on publicly available information which is believed to be reliable. Content is researched, written and reviewed on a reasonable-effort basis. The Reviewer has not performed any independent investigations or forensic audits to validate the information herein. The Reviewer has only independently reviewed the information provided by the Author according to the procedures outlined by WSE. WSE is not entitled to veto or interfere in the application of such procedures by the third-party research service company to the articles, documents or reports, as the case may be. Unless otherwise noted, any content outside of this document has no association with the Author or the Reviewer in any way.   NO WARRANTY WSE, the Author, and the Reviewer are not responsible for any error which may be occasioned at the time of printing of this document or any error, mistake or shortcoming. No liability is accepted whatsoever for any direct, indirect or consequential loss arising from the use of this document. WSE, the Author, and the Reviewer expressly disclaim any fiduciary responsibility or liability for any consequences, financial or otherwise arising from any reliance placed on the information in this document. Additionally, WSE, the Author, and the Reviewer do not (1) guarantee the accuracy, timeliness, completeness or correct sequencing of the information, or (2) warrant any results from use of the information. The included information is subject to change without notice.  NOT AN OFFERING This document is not intended as an offering, recommendation, or a solicitation of an offer to buy or sell the securities mentioned or discussed, and is to be used for informational purposes only. Please read all associated disclosures and disclaimers in full before investing. Neither WSE nor any party affiliated with us is a registered investment adviser or broker-dealer with any agency or in any jurisdiction whatsoever. To download our report(s), read our disclosures, or for more information, visit https://wallstequities.com/legal-disclaimer/ CONTACT For any questions, inquiries, or comments reach out to us directly. If you're a company, we are covering and wish to no longer feature on our coverage list contact us via email and/or phone between 09:30 EDT to 16:00 EDT from Monday to Friday at:Email: info@wallstequities.com   Phone number: +21-32-044-483 Office Address: 1 Scotts Road #24-10, Shaw Center Singapore 228 CFA® and Chartered Financial Analyst® are registered trademarks owned by CFA Institute. View original content:http://www.prnewswire.com/news-releases/this-mornings-research-reports-on-specialty-chemicals-stocks----orion-engineered-carbons-olin-ppg-industries-and-venator-materials-300582990.html SOURCE Wall St. Equities Copyright (C) 2018 PR Newswire. All rights reserved From MarketWatch Samsung Galaxy S9: Putting the Camera to the Test More Coverage Jobless claims drop 4,000 to 226,000 Why tax refunds have lost their sparkle This emerging-market ETF continues to blow away the competition","Jan 16, 2018 6:30 a.m. ET",N/A,"This Morning's Research Reports on Specialty Chemicals Stocks -- Orion Engineered Carbons, Olin, PPG Industries, and Venator Materials",https://www.marketwatch.com/story/this-mornings-research-reports-on-specialty-chemicals-stocks----orion-engineered-carbons-olin-ppg-industries-and-venator-materials-2018-01-16
OEC,"LUXEMBOURG, Dec 26, 2017 (BUSINESS WIRE) -- Orion Engineered Carbons S.A. OEC, -3.20% a worldwide supplier of specialty and high-performance carbon black, today announced that on December 22, 2017, a consent decree between Orion Engineered Carbons LLC (“Orion”) and the U.S. Environmental Protection Agency (the “EPA”), as well as the Louisiana Department of Environmental Quality, was lodged in the U.S. District Court for the Western District of Louisiana. Once the consent decree is entered by the court, it will resolve the EPA’s claims against Orion that were a part of the EPA’s National Enforcement Initiative brought against all U.S. carbon black producers. In this action EPA alleged certain violations of the U.S. Clean Air Act, in particular concerning past failures to obtain PSD and Title V permits and implement Best Available Control Technology (BACT). With Orion as one of the two remaining carbon black companies signing consent decrees, all five U.S. carbon black producers have settled with the U.S. government. Under its consent decree, Orion will further upgrade its pollution control technology in order to further reduce SO2, NOx and particulate matter (PM) emissions at its four U.S. carbon black manufacturing facilities in Ivanhoe (Louisiana), Belpre (Ohio), Borger (Texas), and Orange (Texas). Orion estimates that the capital expenditures for these upgrades, to be incurred over approximately six years, are $110-140 million. Orion also agreed to pay a civil penalty of $800,000 and to perform environmental mitigation projects totaling $550,000. The penalty and mitigation project costs are in line with the respective reserves already established by the company for this purpose. As previously disclosed, except for certain allegations by the EPA in 2016 relating to Orion’s facility in Orange, Texas, all claims made by the EPA relate to actions that occurred before Orion assumed control over its four U.S. carbon black manufacturing facilities. The facilities were acquired by Orion from a subsidiary of Evonik Industries AG in 2011. Orion’s agreement with Evonik in connection with the acquisition provides for a partial indemnity against various exposures, including, but not limited to, capital investments, fines and costs arising in connection with Clean Air Act violations that occurred prior to July 29, 2011. “We have worked hard to find a solution to this matter which has been a focus for our company since the beginning of Orion group. After several years of review and analysis, we believe this settlement provides the best outcome for all parties. We will be pleased to see this part of the story come to a close so that we can begin implementing the actions necessary to ensure a sustainable supply of U.S. produced carbon black for our customers,” said Orion’s CEO, Jack Clem. About Orion Engineered Carbons S.A. Orion is a worldwide supplier of Carbon Black. We produce a broad range of Carbon Blacks that include high-performance Specialty Gas Blacks, Furnace Blacks, Lamp Blacks, Thermal Blacks and other Carbon Blacks that tint, colorize and enhance the performance of polymers, plastics, paints and coatings, inks and toners, textile fibers, adhesives and sealants, tires, and mechanical rubber goods such as automotive belts and hoses. Orion runs 14 global production sites and four Applied Technology Centers. The group has approximately 1,457 employees worldwide. For more information please visit our website www.orioncarbons.com. Forward-Looking Statements This document contains certain forward-looking statements within the meaning of the U.S. Private Securities Litigation Reform Act of 1995. Forward-looking statements are statements of future expectations that are based on current expectations and assumptions and involve known and unknown risks and uncertainties that could cause actual results, performance or events to differ materially from those expressed or implied in these statements. You should not place undue reliance on forward-looking statements. Each forward-looking statement speaks only as of the date of the particular statement. New risk factors and uncertainties emerge from time to time and it is not possible to predict all risk factors and uncertainties, nor can we assess the extent to which any factor, or combination of factors, may cause actual results to differ materially from those contained in any forward-looking statements. We undertake no obligation to publicly update or revise any forward-looking statement as a result of new information, future events or other information, other than as required by applicable law. View source version on businesswire.com: http://www.businesswire.com/news/home/20171226005087/en/ SOURCE: Orion Engineered Carbons S.A.""> <Property FormalName=""PrimaryTwitterHandle"" Value=""@OECarbons Orion Engineered Carbons S.A. Investor Relations Diana Downey, +1 832-589-2285 Investor-Relations@orioncarbons.com Copyright Business Wire 2017 From MarketWatch How to Get a Job: Advice From Extremely Successful People More Coverage Delta flight scare is a reminder never to put electronics in checked baggage Why every investor should be terrified by the slide in Home Depot stock S&P 500 logs longest losing streak of the year as trade-war jitters weigh","Dec 26, 2017 7:30 a.m. ET",N/A,Orion Engineered Carbons Announces Signing of Consent Decree With EPA,https://www.marketwatch.com/story/orion-engineered-carbons-announces-signing-of-consent-decree-with-epa-2017-12-26
OEC,"LUXEMBOURG, Dec 20, 2017 (BUSINESS WIRE) -- Orion Engineered Carbons S.A. OEC, -3.20% a worldwide supplier of specialty and high-performance Carbon Black, today announced that Jack Clem, CEO and Charles Herlinger, CFO will be participating in the upcoming Eighteenth Annual CJS Securities ""New Ideas for the New Year"" Investor Conference, on Wednesday, January 10, 2018 in New York City, NY. Jack Clem, the Company’s Chief Executive Officer, who will present at the conference, will provide an overview of the company; discuss its competitive position and its strategies for growth. A copy of the company’s presentation will be available on the investor section of Orion’s website at http://investor.orioncarbons.com on the morning of the presentation. About Orion Engineered Carbons S.A. Orion is a worldwide supplier of Carbon Black. We produce a broad range of Carbon Blacks that include high-performance Specialty Gas Blacks, Furnace Blacks, Lamp Blacks, Thermal Blacks and other Carbon Blacks that tint, colorize and enhance the performance of polymers, plastics, paints and coatings, inks and toners, textile fibers, adhesives and sealants, tires, and mechanical rubber goods such as automotive belts and hoses. Orion runs 14 global production sites and four Applied Technology Centers. The group has approximately 1,457 employees worldwide. For more information please visit our website www.orioncarbons.com. View source version on businesswire.com: http://www.businesswire.com/news/home/20171220006022/en/ SOURCE: Orion Engineered Carbons S.A.""> <Property FormalName=""PrimaryTwitterHandle"" Value=""@OECarbons Orion Engineered Carbons S.A. Investor Relations Diana Downey, +1 832-589-2285 Investor-Relations@orioncarbons.com Copyright Business Wire 2017 From MarketWatch Uber for Bikes Could Save Your Commute More Coverage BlackRock fund manager sees this as the market’s ‘sweet spot’ Stephen Hawking’s final Reddit post is going viral over its ominous warning about robots Three reasons the stock market’s fundamentals look solid","Dec 20, 2017 4:30 p.m. ET",N/A,"Orion Engineered Carbons to Present at the Eighteenth Annual CJS 
      Securities ""New Ideas for the New Year"" Investor Conference",https://www.marketwatch.com/story/orion-engineered-carbons-to-present-at-the-eighteenth-annual-cjs-securities-new-ideas-for-the-new-year-investor-conference-2017-12-20
OEC,"LUXEMBOURG, Dec 12, 2017 (BUSINESS WIRE) -- Orion Engineered Carbons S.A. OEC, -3.20% a worldwide supplier of specialty and high-performance Carbon Black, today announced that its board of directors has declared an interim dividend of €0.168576* per common share equivalent to a total distribution of €10 million based on the number of common shares currently outstanding. The interim dividend will be paid on December 27, 2017. The record date for the interim dividend will be December 22, 2017. The interim dividend with respect to common shares held in book-entry form through the facilities of The Depository Trust Company will be paid entirely in U.S. Dollars, at the official U.S. Dollar/Euro exchange rate reported by the European Central Bank on December 20, 2017. No portion of the interim dividend with respect to any common shares held through The Depository Trust Company will be paid in Euro. Luxembourg withholding tax at a rate of 15% will be deducted from the interim dividend, subject to certain exemptions and reductions in certain circumstances. * The actual interim dividend per common share is €0.168576600212535. About Orion Engineered Carbons S.A. Orion is a worldwide supplier of Carbon Black. We produce a broad range of Carbon Blacks that include high-performance Specialty Gas Blacks, Furnace Blacks, Lamp Blacks, Thermal Blacks and other Carbon Blacks that tint, colorize and enhance the performance of polymers, plastics, paints and coatings, inks and toners, textile fibers, adhesives and sealants, tires, and mechanical rubber goods such as automotive belts and hoses. Orion runs 14 global production sites and four Applied Technology Centers. The group has approximately 1,457 employees worldwide. For more information please visit our website www.orioncarbons.com. View source version on businesswire.com: http://www.businesswire.com/news/home/20171212005962/en/ SOURCE: Orion Engineered Carbons S.A.""> <Property FormalName=""PrimaryTwitterHandle"" Value=""@OECarbons Orion Engineered Carbons S.A. Investor Relations Diana Downey, +1 832-589-2285 Investor-Relations@orioncarbons.com Copyright Business Wire 2017 From MarketWatch More Coverage Jobless claims drop 4,000 to 226,000 S&P 500 logs longest losing streak of the year as trade-war jitters weigh Stephen Hawking’s final Reddit post is going viral over its ominous warning about robots","Dec 12, 2017 4:30 p.m. ET",N/A,Orion Engineered Carbons Announces Interim Cash Dividend,https://www.marketwatch.com/story/orion-engineered-carbons-announces-interim-cash-dividend-2017-12-12
