code,content,date,listening,title,url
OFC,"Real estate investment trusts, or REITs, have outperformed the benchmark S&P 500 Index this year, as investors have sought out high yields at a time of historically low interest rates. But if you’re worried about spending too much for REITs, most of whose dividend payments are backed by rents or leases, there are still good values if income is your main objective. The S&P 500 REIT subsector trades for 19.6 times weighted aggregate consensus FFO estimates for the next 12 months, according to FactSet. (REITs are valued according to funds from operations, or FFO, rather than earnings per share. FFO is a non-GAAP measure calculated by adding depreciation and amortization back to earnings, while subtracting gains from the sale of real estate. It is considered the best way of measuring a REIT’s ability to pay dividends.) Looking at the 15-year chart, below, you can see they have reached forward price-to-FFO multiples exceeding 20 on many occasions since late 2008, while reaching a peak of 24.2 times forward FFO in February 2007, the height of the real estate market before the subprime crisis. FactSet So far this year, through Aug. 12, the S&P 500 REIT subsector has risen 9.8%, compared with 6.7% for the S&P 500. This time we have not included reinvested dividends, to make a more fair comparison of how well the subsector has performed relative to the index. REITs tend to pay higher dividends than most S&P 500 SPX, -2.91%  stocks because that is their objective. In fact, they are required to pay out 90% of their earnings to shareholders. Why buy now? So should you consider REITs now? Maybe, if you are investing for income, or if you have a strong belief that a particular REIT is positioned to perform well as its business grows, or both. Since the market values of income-producing securities generally move in the opposite direction of interest rates, there can be quite a bit of volatility over the next few years if the Federal Reserve raises interest rates consistently. The Fed has raised rates only once, in December 2015, since 2006. Even the fear of higher interest rates can drive prices lower. But if you need the income, and can tolerate volatility as interest rates fluctuate and headlines anticipate and exaggerate the market’s reaction, it’s not too late to make a purchase. Last week we published a list of S&P 500 dividend stocks, including REITs, with attractive dividend yields supported by FFO for the REITs and free cash flow for the others. A REIT list Credit Suisse’s equity research team covers 37 real estate investment trusts and rates 13 of them “outperform,” the equivalent of “buy.” Here they are, sorted alphabetically within each category, as defined by Credit Suisse in an Aug. 14 report: REIT Ticker Credit Suisse category Current dividend yield AvalonBay Communities Inc. AVB, -1.33% Residential 2.99% Retail Properties of America Inc. Class A RPAI, -0.51% Strip shopping centers 3.90% General Growth Properties Inc. GGP, -0.73% Regional mall 2.67% Simon Property Group Inc. SPG, -1.12% Regional mall 3.00% Taubman Centers Inc. TCO, -0.92% Regional mall 3.02% Boston Properties Inc. BXP, -1.87% Office 1.82% Brandywine Realty Trust BDN, -2.71% Office 3.63% Corporate Office Properties Trust OFC, -0.81% Office 3.78% Forest City Realty Trust Inc. Class A FCE.A, -2.42% Office 1.04% Vornado Realty Trust VNO, -0.58% Office 2.40% DiamondRock Hospitality Co. DRH, -1.34% Lodging 4.89% RLJ Lodging Trust RLJ, -0.98% Lodging 5.68% Sunstone Hotel Investors Inc. SHO, -1.97% Lodging 10.38% Sources: Credit Suisse, FactSet Not all those dividend yields are especially attractive. Still, Credit Suisse’s analysts expect the share prices to rise over the next 12 months: REIT Ticker Closing price - Aug. 12 Credit Suisse price target Implied 12-month price upside potential Credit Suisse’s expected 12-month total return AvalonBay Communities Inc. AVB, -1.33% $180.79 $192.00 6% 9% Retail Properties of America Inc. Class A RPAI, -0.51% $16.97 $18.50 9% 13% General Growth Properties Inc. GGP, -0.73% $29.95 $33.00 10% 13% Simon Property Group Inc. SPG, -1.12% $215.22 $234.00 9% 12% Taubman Centers Inc. TCO, -0.92% $78.71 $85.00 8% 11% Boston Properties Inc. BXP, -1.87% $142.82 $144.00 1% 3% Brandywine Realty Trust BDN, -2.71% $16.55 $17.50 6% 9% Corporate Office Properties Trust OFC, -0.81% $29.09 $31.00 7% 10% Forest City Realty Trust Inc. Class A FCE.A, -2.42% $23.10 $26.00 13% 13% Vornado Realty Trust VNO, -0.58% $105.14 $113.00 7% 10% DiamondRock Hospitality Co. DRH, -1.34% $10.23 $10.50 3% 7% RLJ Lodging Trust RLJ, -0.98% $23.22 $24.00 3% 9% Sunstone Hotel Investors Inc. SHO, -1.97% $13.59 $14.00 3% 11% Sources: Credit Suisse, FactSet As always, you need to do your own research before considering investments in the stocks listed here, or anywhere else, for that matter. The list might provide you with a good starting point for discussions with your broker or investment adviser about your objectives and risk tolerance. More from MarketWatch Samsung Galaxy S9: Putting the Camera to the Test More Coverage Damn the torpedoes — what could take the S&P 500 to 3,000 Home sellers now use spycams to gather intel on prospective buyers Why every investor should be terrified by the slide in Home Depot stock Related Topics Markets U.S. Stocks Mutual Funds Exchange Traded Funds","Aug 19, 2016 2:10 p.m. ET",3,S&P 500-beating REITs could return up to 13% in the next year,https://www.marketwatch.com/story/sp-500-beating-reits-could-return-up-to-13-in-the-next-year-2016-08-16
OFC,"Corporate Office Properties Trust OFC, -0.89% increased its stock offering to 7.5 million shares and said it priced at a 2.4% discount of Wednesday's closing price. The real-estate investment trust's shares slipped 0.8% to $25.17 premarket, above the offer price of $24.75. As of the close, the stock was up 19% so far this year. The company, which initially said Wednesday it would offer 6 million shares, said it expects to raise about $178.2 million to repay debt and for general corporate purposes. The REIT focuses on tenants in the U.S. government and defense information technology sectors and had roughly 72.2 million shares outstanding as of Oct. 9. In July, the company said it swung to a second-quarter profit as operating expenses shrank, masking weaker revenue. Subscribe to WSJ: http://online.wsj.com?mod=djnwires More from MarketWatch Why It Feels Like Facebook Is Listening Through Your Mic More Coverage Don’t ever do this with your credit card What America’s gun fanatics won’t tell you Trump boasts about making up facts about trade deficit to Trudeau","Oct 11, 2012 11:30 a.m. ET",1,Corporate Office prices offering at 2.4% discount,https://www.marketwatch.com/story/corporate-office-prices-offering-at-24-discount-2012-10-11
OFC,"WASHINGTON (MarketWatch) — Among the stocks that could see active trade in Thursday’s session are Ruby Tuesday Inc., Richardson Electronics Ltd. and API Technologies Corp. Safeway Inc. US:SWY  heads up the roster of companies on deck to post quarterly financial results Thursday. Cantel Medical Corp. US:CMN  , Oil-Dri Corp. of America ODC, -2.74%  , Zep Inc. US:ZEP  , Fastenal Co. FAST, -3.63%  , J.B. Hunt Transport Services Inc. JBHT, -2.02%  and Winnebago Industries Inc. WGO, -4.52%  also are due to report. Four initial public offerings are on Thursday’s agenda, the largest of which is for Realogy Holdings Corp. RLGY, -0.16% owner of Century 21, Coldwell Banker, ERA and Better Homes & Gardens Real Estate. Parsippany, N.J.-based Realogy’s IPO ranks among the biggest seen in the U.S. market for 2012 — 40 million shares priced at $27 each. Trading in Realogy shares will be on the New York Stock Exchange, under the symbol RLGY. Also on deck, Shutterstock Inc. SSTK, -2.43%  priced its IPO of 4.5 million common shares at $17 each; underwriters have a 30-day option to buy up to 675,000 additional shares. NYSE trading in Shutterstock’s shares will be under the symbol SSTK. Intercept Pharmaceuticals Inc. ICPT, -1.80%  and Kythera Biopharmaceuticals Inc. round out Thursday’s IPOs. The former priced 5 million shares for sale at $15 each, while the latter’s selling 4.4 million shares at $15 each. Their shares will debut Thursday on Nasdaq Stock Market, under the symbols ICPT and KYTH, respectively. Read more on Thursday’s roster of IPOs. Along with reporting results for the first quarter ended Sept. 4, Ruby Tuesday US:RT  projected that profit for fiscal 2013 will be in a range of 20 cents to 30 cents a share, including recognition of 4 cents a share for pension settlement expense involving departing Chief Executive Sandy Beall, founder of the Maryville, Tenn.-based operator of casual-dining restaurants, and for new CEO transition expenses. Same-restaurant sales increased 1.9% at company-owned properties in the latest quarter, reversing a recent pattern for Ruby Tuesday, as total revenue inched up 0.8%. For the year, same-restaurant sales are forecast to be flat to 2% higher. Ruby Tuesday’s first-quarter profit came to $2.6 million, or 4 cents a share, down from $3.1 million, or 5 cents, earned in the year-earlier period. Excluding CEO transition costs, earnings would have been 5 cents a share, a penny shy of the consensus of analysts polled by Thomson Reuters. Along with results for the first quarter ended Sept. 1, Richardson Electronics RELL, -1.26%  forecast sales for the current quarter will be modestly higher on a sequential basis. The company projected a top line of $36 million to $38 million for the second quarter of fiscal 2013, compared to $35.7 million in the latest quarter; sales were $41.5 million in the year-earlier first quarter. “Global economic conditions continued to weaken as we progressed through the first quarter, contributing to the decline in our overall sales volume,” said Edward Richardson, chairman, chief executive and president, in the Lafox, Ill.-based company’s earnings release. API Technologies US:ATNY  said it’s received “unsolicited interest” in acquiring one or more of the company’s business units. The board of Orlando-based API hired Jefferies & Co. to serve as financial adviser in evaluating a “full range of strategic alternatives,” the company said. The move came as API reported results for the third quarter ended Aug. 31, which showed the company posting a wider net loss of $27.7 million compared to the prior year as well as lower revenue of $68.4 million. On an adjusted basis, API’s quarterly earnings before interest, taxes, depreciation and amortization improved to $9.3 million from the prior year’s $8.1 million, the results showed. Also late Wednesday, PrivateBancorp Inc. US:PVTB  commenced an underwritten public offering of $75 million in common stock and plans a separate offering of $125 million in subordinated debt “in the near future,” the Chicago-based company said. Subject to Federal Reserve approval, net proceeds will go toward a full redemption of $243.8 million in preferred stock that PrivateBancorp issued to the Treasury Department under the Troubled Asset Relief Program, after which the company would seek to buy back the common stock warrant issued to the Treasury as part of its participation in TARP. Completion of the stock offering isn’t conditioned on completion of the anticipated subordinated debt offering, and vice versa, according to PrivateBancorp. Royal Gold Inc. RGLD, +1.58%  will put up for sale nearly 5.3 million common shares in an at-the-market public offering, the Denver-based company said. Net proceeds will be used for the acquisition of additional royalty or similar interests and for general corporate purposes, with the offering expected to close Oct. 15. Underwriters led by Goldman Sachs & Co. will have the option to buy up to 750,000 additional shares from Royal Gold. Corporate Office Properties Trust OFC, -0.93%  said it plans to sell 6 million newly issued common shares stock via a secondary public offering. The Columbia, Md.-based real estate investment trust will put net proceeds to use repaying credit-revolver balances and for general corporate purposes. Underwriters will have a 30-day option to buy up to 900,000 additional shares. Standard & Poor’s said Government Properties Income Trust GOV, -3.37% an office REIT based in Newton, Mass., will become part of the S&P SmallCap 600 after the close of trading on Oct. 15, taking the place of Brightpoint Inc. US:CELL  in the benchmark. Ingram Micro Inc. US:IM  is close to completing the acquisition of Brightpoint, necessitating the change. More from MarketWatch Why It Feels Like Facebook Is Listening Through Your Mic More Coverage Damn the torpedoes — what could take the S&P 500 to 3,000 Trump boasts about making up facts about trade deficit to Trudeau Why tax refunds have lost their sparkle Related Topics U.S. Stocks Markets Investing","Oct 11, 2012 6:44 a.m. ET",N/A,"Stocks to watch Thursday: Ruby Tuesday, Realogy",https://www.marketwatch.com/story/stocks-to-watch-thursday-ruby-tuesday-realogy-2012-10-11
OFC,"NEW YORK (MarketWatch) -- Bank of America Merrill Lynch on Wednesday upgraded Corporate Office Properties Trust OFC, -0.90% to neutral from underperform. The owner and developer of office buildings with a strategic focus on defense and information technology has made ""good progress on its balance sheet"" and has repositioned its portfolio, analyst James Feldman said.","Oct 10, 2012 7:44 a.m. ET",0,Corporate Office upped to neutral by Merrill,https://www.marketwatch.com/story/bofa-merrill-lynch-ups-corporate-office-to-neutral-2012-10-10
OFC,"Corporate Office Properties Trust OFC, -0.85% said it plans to sell an additional $312 million in assets over the next three years, expanding the size of a broad reallocation plan unveiled earlier this year to $572 million. The real-estate investment trust that focuses on tenants in the U.S. government and defense information technology sectors also revised its fourth-quarter guidance to reflect write-downs related to asset sales and derivatives losses. The charges will result in an overall per-share loss of $1.22 to $1.25. Corporate Office Properties also projected that a key measure of performance for REITs would turn negative. It now expects negative FFO of 27 cents to 30 cents. The company in October initially forecast per-share earnings of 10 cents to 13 cents and FFO of 54 cents to 57 cents. Corporate Office Properties, which has sold $76.7 million of properties since April, said the additional properties it plans to sell include assets in Colorado and Maryland. Earlier this week the company said it sold its holdings in the Rutherford Business Center in Maryland and the White Marsh Center for a combined $48.8 million. Shares closed Wednesday at $22.20 and were inactive premarket. The stock is down 36% this year. More from MarketWatch Why It Feels Like Facebook Is Listening Through Your Mic More Coverage Damn the torpedoes — what could take the S&P 500 to 3,000 Stephen Hawking’s final Reddit post is going viral over its ominous warning about robots Don’t ever do this with your credit card","Dec 22, 2011 7:03 a.m. ET",1,Corporate Office Properties widens asset-sale plan,https://www.marketwatch.com/story/corporate-office-properties-widens-asset-sale-plan-2011-12-22
OFC,"BOSTON (MarketWatch) -- A Citigroup analyst who covers real estate investment trusts rejiggered his ratings on several individual names Monday and said the economic backdrop could support current elevated valuations for the sector over the next year. ""At the same time, there remain clear long-term risks to the recovery following record stimulus that some feel has simply shifted the private credit bubble to the public,"" Michael Bilerman wrote about the outlook for REITs in 2010. The analyst said he sees the total return for REITs in 2010 as flat to 10% higher, with close to half of that from dividends. ""Stock selection will be key to driving excess returns, and our overweight and underweight positions have been selected to hedge against an uncertain environment,"" Bilerman said. REITs suffered through a dreadful 2008 as investors dumped commercial real estate when the credit crunch hit the economy. The SPDR Dow Jones REIT ETF RWR, -1.74% lost nearly 40% last year. The exchange-traded fund has recovered some of those losses and was up 23.5% for the year through Dec. 11. It trails the broader stock market slightly, and many investors are predicting more pain ahead for commercial real estate with rents and occupancies down during the recession. The sector's also facing huge amounts of debt that need to be rolled over in coming years as credit markets remain tight. Against this backdrop, Citi on Monday also offered its outlook for REIT subsectors such as retail, office and lodging companies. In retail, initial evidence that the U.S. consumer is showing ""faint signs of improvement"" is a positive sign, Bilerman said. ""We expect occupancy declines to plateau and deteriorating leasing spreads to stabilize, with retail REIT fundamentals likely bottoming in late 2010,"" he wrote. ""Following strong outperformance of the mall REITs in 2009, we now expect the shopping center REITs to outperform in 2010, though we are selective on names."" Meanwhile, in the office and industrial subsector, the analyst restated an underweight rating, citing ""high relative valuation, lagging fundamentals and our view that acquisition opportunities may take some time to play out."" Among the individual ratings changes, Citi upgraded to buy from sell six REITs: Codgell Spencer Inc. CSA, -1.99% Kilroy Realty Corp. KRC, -2.81% Kite Realty Group Trust KRG, -1.38% Public Storage Inc. PSA, -0.77% UDR Inc. UDR, -1.54% and Weingarten Realty Investors WRI, -0.61% It also lifted PS Business Parks Inc. PSB, -2.34% to hold from sell. As for downgrades, Citi lowered ratings on Highwoods Properties Inc. HIW, -2.03% Kimco Realty Corp. KIM, -0.78% and Corporate Office Properties Trust OFC, -0.81% to sell from hold. (This latter Kimco Realty is geared toward community shopping centers, while the former is engaged in office and industrial real estate in Southern California.) More from MarketWatch Can the Democrats Ride a Blue Wave to Midterm Election Wins? More Coverage Why every investor should be terrified by the slide in Home Depot stock Three reasons the stock market’s fundamentals look solid Damn the torpedoes — what could take the S&P 500 to 3,000","Dec 14, 2009 12:08 p.m. ET",2,Citi shuffles REIT ratings to position for 2010,https://www.marketwatch.com/story/citi-shuffles-reit-ratings-to-position-for-2010-2009-12-14
OFC,"LONDON (MarketWatch) -- Citigroup reshuffled its ratings on real estate investment trusts Monday, saying the sector enters 2010 with a backdrop that could support current elevated valuations, but that there remain clear long-term risks to the recovery. The broker said that in the residential, healthcare and self storage side of the industry it takes a more positive view on short-lease names and that in the retail side it expects occupancy declines to plateau and deteriorating leasing spreads to stabilize. In office leasing, Citi said it remains underweight based on high relative valuation, lagging fundamentals and its view that acquisition opportunities may take time to play out. The broker upgraded Codgell Spencer CSA, -1.99% Kilroy Realty KRC, -2.71% Kite Realty KRG, -1.34% Public Storage PSA, -0.77% UDR UDR, -1.49% and Weingarten Realty WRI, -0.57% to buy from hold and PS Business Parks PSB, -2.34% to hold from sell. It also downgraded Highwoods Properties HIW, -1.87% Kimco Realty KIM, -0.74% and Corporate Office Properties OFC, -0.81% to sell from hold.","Dec 14, 2009 8:42 a.m. ET",1,Citigroup reshuffles REIT ratings,https://www.marketwatch.com/story/citigroup-reshuffles-reit-ratings-2009-12-14
