code,content,date,listening,title,url
OFC,"SAN FRANCISCO (MarketWatch) -- Corporate Office Properties Trust OFC, -0.89% said after the closing bell on Thursday that it has raised its quarterly dividend 9.8% to 28 cents from 25.5 cents a share. The Columbia, Md.-based real estate investment trust said the dividend is payable Oct. 14 to shareholders of record as of Sept. 30.","Sept 15, 2005 6:16 p.m. ET",1,Corporate Office raises quarterly dividend 9.8% to 28c,https://www.marketwatch.com/story/corporate-office-raises-quarterly-dividend-98-to-28c
OFC,"SAN FRANCISCO (MarketWatch) -- Corporate Office Properties Trust OFC, -0.81% said Friday that Betsy Cohen, a member of the board of trustees for the past five years, has decided not to submit her name for re-election at the company's annual shareholder meeting in May. Cohen is chairman, CEO, and trustee of RAIT Investment Trust RAS, +8.42% and is also CEO of The Bancorp Inc. TBBK, -2.22% the Columbia, Md.-based firm said.","Feb 25, 2005 12:31 p.m. ET",1,Corporate Office's Cohen not to be re-elected to board,https://www.marketwatch.com/story/corporate-offices-cohen-not-to-be-re-elected-to-board
OFC,"LONDON (MarketWatch) -- Real estate investment trust Corporate Office Properties OFC, -0.89% said Clay W. Hamlin will retire as chief executive officer and become vice chairman, effective April 1. Randall M. Griffin will take over as both president and CEO.","Feb 25, 2005 8:13 a.m. ET",1,Corporate Office Properties CEO to retire April 1,https://www.marketwatch.com/story/corporate-office-properties-ceo-to-retire-april-1
OFC,"Corporate Office Properties Trust OFC, -0.89% said it's spending $71.2 million to buy 13200 Woodland Park Drive, a 404,665 square foot office building in Herndon, Va. The thirteen-story building is presently 100 percent leased by network services provider VeriSign VRSN, -2.73% The acquisition was funded by the recent sale of 5.29 million common shares of beneficial interest, which generated approximately $79.5 million in net proceeds to the real estate invetment trust. Corporate Office Properties fell 8 cents to $15.80 on Monday.","June 3, 2003 9:00 a.m. ET",1,Corporate Office Properties Trust acquires building,https://www.marketwatch.com/story/corporate-office-properties-trust-acquires-building
OFC,"(EDGAR Online via COMTEX) -- Item 2. Management's Discussion and Analysis of Financial Condition and Results of Operations Overview During the nine months ended September 30, 2017: we finished the period with occupancy of our portfolio of operating office properties at 93.4%, including six properties owned through an unconsolidated real estate joint venture; we placed into service an aggregate of 839,000 square feet in eight newly constructed or redeveloped properties that were 89% leased as of September 30, 2017; we sold ten operating properties totaling 639,000 square feet that were 89.4% occupied for $88.8 million and other land for $14.3 million. The net proceeds from these sales were used primarily to repay borrowings under our Revolving Credit Facility and to fund cash reserves; we repaid $200.0 million of the loan balance on a term loan scheduled to mature in 2020 using available cash; COPT redeemed all of the outstanding shares of its: Series K Preferred Shares effective January 21, 2017 at a price of $50.00 per share, or $26.6 million in the aggregate, plus accrued and unpaid dividends thereon through the date of redemption using available cash. Concurrently with this redemption, COPLP redeemed its Series K Preferred Units on the same terms; and Series L Preferred Shares effective June 27, 2017 at a price of $25.00 per share, or $172.5 million in the aggregate, plus accrued and unpaid dividends thereon through the date of redemption using borrowings from our Revolving Credit Facility. Concurrently with this redemption, COPLP redeemed its Series L Preferred Units on the same terms; and COPT issued 591,042 common shares at a weighted average price of $33.84 per share under its ATM stock offering program. Net proceeds from the shares issued totaled $19.7 million, which were used primarily to fund cash reserves. On October 27, 2017, we sold: 201 Technology Drive, an operating property totaling 103,000 square feet in Lebanon, Virginia (in our Data Center Shells sub-segment), for $29.2 million; and 11751 Meadowville Lane, an operating property totaling 193,000 square feet in Chester, Virginia (in our Data Center Shells sub-segment), for $44.3 million. We provided a financial guaranty to the buyer under which we would indemnify it for up to $20 million in losses it could incur related to a potential defined capital event occurring on the property by June 30, 2019. Accordingly, we will not recognize the sale of this property for accounting purposes, and will reflect the sale price of the property as a liability, until the guaranty expires. We do not expect to incur any losses under this financial guaranty. The net proceeds from these sales were used primarily to repay borrowings under our Revolving Credit Facility We discuss significant factors contributing to changes in our net income in the section below entitled ""Results of Operations."" The results of operations discussion is combined for COPT and COPLP because there are no material differences in the results of operations between the two reporting entities. In addition, the section below entitled ""Liquidity and Capital Resources"" includes discussions of, among other things: how we expect to generate cash for short and long-term capital needs; and our commitments and contingencies. You should refer to our consolidated financial statements and the notes thereto as you read this section. This section contains ""forward-looking"" statements, as defined in the Private Securities Litigation Act of 1995, that are based on our current expectations, estimates and projections about future events and financial trends affecting the financial condition and operations of our business. Forward-looking statements can be identified by the use of words such as ""may,"" ""will,"" ""should,"" ""could,"" ""believe,"" ""anticipate,"" ""expect,"" ""estimate,"" ""plan"" or other comparable terminology. Forward-looking statements are inherently subject to risks and uncertainties, many of which we cannot predict with accuracy and some of which we might not even anticipate. Although we believe that the expectations, estimates and projections reflected in such forward-looking statements are based on reasonable assumptions at the time made, we can give no assurance that these expectations, estimates and projections will be achieved. Future events and actual results may differ materially from those discussed in the forward-looking statements. Important factors that may affect these expectations, estimates and projections include, but are not limited to: general economic and business conditions, which will, among other things, affect office property and data center demand and rents, tenant creditworthiness, interest rates, financing availability and property values; adverse changes in the real estate markets, including, among other things, increased competition with other companies; governmental actions and initiatives, including risks associated with the impact of a prolonged government shutdown or budgetary reductions or impasses, such as a reduction in rental revenues, non-renewal of leases and/or a curtailment of demand for additional space by our strategic customers; our ability to borrow on favorable terms; risks of real estate acquisition and development activities, including, among other things, risks that development projects may not be completed on schedule, that tenants may not take occupancy or pay rent or that development or operating costs may be greater than anticipated; risks of investing through joint venture structures, including risks that our joint venture partners may not fulfill their financial obligations as investors or may take actions that are inconsistent with our objectives; changes in our plans for properties or views of market economic conditions or failure to obtain development rights, either of which could result in recognition of significant impairment losses; our ability to satisfy and operate effectively under Federal income tax rules relating to real estate investment trusts and partnerships; the dilutive effects of issuing additional common shares; our ability to achieve projected results; and environmental requirements. We undertake no obligation to update or supplement forward-looking statements. Occupancy and Leasing Office Properties The tables below set forth occupancy information pertaining to our portfolio of operating office properties, which included six properties owned through an unconsolidated real estate joint venture:  September 30, 2017 December 31, 2016 Occupancy rates at period end Total 93.4 % 92.1 % Defense/IT Locations: Fort Meade/BW Corridor 95.6 % 94.3 % Northern Virginia Defense/IT 88.7 % 85.0 % Lackland Air Force Base 100.0 % 100.0 % Navy Support Locations 82.5 % 72.7 % Redstone Arsenal 97.9 % 96.4 % Data Center Shells 100.0 % 100.0 % Total Defense/IT Locations 94.7 % 92.6 % Regional Office 92.4 % 95.2 % Other 29.4 % 52.9 % Average contractual annual rental rate per square foot at period end (1) $ 29.94 $ 30.16  (1) Includes estimated expense reimbursements. Amounts reported include the portion of properties owned through an unconsolidated real estate joint venture that was allocable to our ownership interest.  Rentable Occupied Square Feet Square Feet (in thousands) December 31, 2016 17,190 15,831 Square feet vacated - (316 ) Occupancy of previously vacated space in connection with new leases (1) - 412 Square feet constructed or redeveloped 839 866 Dispositions (639 ) (572 ) Square feet removed from operations for redevelopment (22 ) - Other changes 8 5 September 30, 2017 17,376 16,226  (1) Excludes occupancy of vacant square feet acquired or developed. During the nine months ended September 30, 2017, we completed 2.2 million square feet of leasing, including 482,000 of construction and redevelopment space, and renewed 82.4% of the square footage of our lease expirations (including the effect of early renewals). Occupancy of our Same Office Properties increased from 91.8% as of December 31, 2016 to 92.6% as of September 30, 2017. Wholesale Data Center Property Our 19.25 megawatt wholesale data center property had 16.9 megawatts leased as of September 30, 2017, a 2.0 megawatt increase relative to December 31, 2016. Results of Operations We evaluate the operating performance of our properties using NOI from real estate operations, our segment performance measure, which includes: real estate revenues and property operating expenses; and the net of revenues and property operating expenses of real estate operations owned through unconsolidated real estate joint ventures (""UJVs"") that is allocable to COPT's ownership interest (""UJV NOI allocable to COPT""). We view our NOI from real estate operations as comprising the following primary categories of operating properties: office properties continually owned and 100% operational throughout the current and prior year reporting periods, excluding properties held for sale. We define these as changes from ""Same Office Properties""; constructed or redeveloped office properties placed into service that were not 100% operational throughout the current and prior year reporting periods; our wholesale data center; properties held for sale as of September 30, 2017; and property dispositions. In addition to owning properties, we provide construction management and other services. The primary manner in which we evaluate the operating performance of our construction management and other service activities is through a measure we define as NOI from service operations, which is based on the net of the revenues and expenses from these activities. The revenues and expenses from these activities consist primarily of subcontracted costs that are reimbursed to us by customers along with a management fee. The operating margins from these activities are small relative to the revenue. We believe NOI from service operations is a useful measure in assessing both our level of activity and our profitability in conducting such operations. Since both of the measures discussed above exclude certain items includable in income before gain on sales of real estate, reliance on these measures has limitations; management compensates for these limitations by using the measures simply as supplemental measures that are considered alongside other GAAP and non-GAAP measures. A reconciliation of NOI from real estate operations and NOI from service operations to income before gain on sales of real estate reported on the consolidated statements of operations of COPT and subsidiaries is provided in Note 12 to our consolidated financial statements. Comparison of Statements of Operations for the Three Months Ended September 30, 2017 and 2016 For the Three Months Ended September 30, 2017 2016 Variance (in thousands) Revenues Revenues from real estate operations $ 127,231 $ 130,954 $ (3,723 ) Construction contract and other service revenues 29,786 11,149 18,637 Total revenues 157,017 142,103 14,914 Expenses Property operating expenses 46,368 49,952 (3,584 ) Depreciation and amortization associated with real estate operations 34,438 32,015 2,423 Construction contract and other service expenses 28,788 10,341 18,447 Impairment (recoveries) losses (161 ) 27,699 (27,860 ) General, administrative and leasing expenses 7,368 8,855 (1,487 ) Business development expenses and land carry costs 1,277 1,716 (439 ) Total operating expenses 118,078 130,578 (12,500 ) Operating income 38,939 11,525 27,414 Interest expense (19,615 ) (18,301 ) (1,314 ) Interest and other income 1,508 1,391 117 Loss on early extinguishment of debt - (59 ) 59 Equity in income of unconsolidated entities 719 594 125 Income tax (expense) benefit (57 ) 21 (78 ) Income (loss) before gain on sales of real estate 21,494 (4,829 ) 26,323 Gain on sales of real estate 1,188 34,101 (32,913 ) Net income $ 22,682 $ 29,272 $ (6,590 )  NOI from Real Estate Operations For the Three Months Ended September 30, 2017 2016 Variance (Dollars in thousands, except per square foot data) Revenues Same Office Properties revenues Rental revenue, excluding lease termination revenue $ 86,226 $ 84,889 $ 1,337 Lease termination revenue 860 389 471 Tenant recoveries and other real estate operations revenue 22,258 24,312 (2,054 ) Same Office Properties total revenues 109,344 109,590 (246 ) Constructed and redeveloped properties placed in service 6,969 2,094 4,875 Wholesale data center 7,398 6,809 589 Properties held for sale 2,723 2,700 23 Dispositions 538 9,506 (8,968 ) Other 259 255 4 127,231 130,954 (3,723 ) Property operating expenses Same Office Properties (40,981 ) (42,745 ) 1,764 Constructed and redeveloped properties placed in service (1,555 ) (513 ) (1,042 ) Wholesale data center (3,175 ) (3,317 ) 142 Properties held for sale (299 ) (283 ) (16 ) Dispositions (124 ) (2,743 ) 2,619 Other (234 ) (351 ) 117 (46,368 ) (49,952 ) 3,584 UJV NOI allocable to COPT 1,297 1,008 289 NOI from real estate operations Same Office Properties 68,363 66,845 1,518 Constructed and redeveloped properties placed in service 5,414 1,581 3,833 Wholesale data center 4,223 3,492 731 Properties held for sale 2,424 2,417 7 Dispositions 414 6,763 (6,349 ) Other 1,322 912 410 $ 82,160 $ 82,010 $ 150 Same Office Properties rent statistics Average occupancy rate 92.6 % 91.6 % 1.0 % Average straight-line rent per occupied square foot (1) $ 6.46 $ 6.43 $ 0.03  (1) Includes minimum base rents, net of abatements, and lease incentives on a straight-line basis for the three-month periods set forth above. Our Same Office Properties pool consisted of 135 office properties, comprising 82.9% of our total operating office square footage as of September 30, 2017 (84.7% excluding the effect of properties held for sale). This pool of properties included the following changes from the pool used for purposes of comparing 2016 and 2015 in our 2016 Annual Report on Form 10-K: the addition of four properties placed in service that were 100% operational on or before January 1, 2016 and three properties acquired in 2015; and the removal of two properties disposed, two properties reclassified to held for sale and one property reclassified as redevelopment in 2017. The decrease in tenant recoveries and other real estate operations revenue and property operating expenses from our Same Office Properties was due primarily to a decrease in operating expenses directly reimbursable from tenants. Our NOI from constructed and redeveloped properties placed in service included 14 properties placed in service in 2016 and 2017. NOI from Service Operations For the Three Months Ended September 30, 2017 2016 Variance (in thousands) Construction contract and other service revenues $ 29,786 $ 11,149 $ 18,637 Construction contract and other service expenses 28,788 10,341 18,447 NOI from service operations $ 998 $ 808 $ 190  Construction contract and other service revenue and expenses increased due primarily to a greater volume of construction activity in connection with several of our tenants. Construction contract activity is inherently subject to significant variability depending on the volume and nature of projects undertaken by us (primarily on behalf of tenants). Service operations are an ancillary component of our overall operations that typically contribute an insignificant amount of operating income relative to our real estate operations. Impairment (Recoveries) Losses The decrease in impairment losses was attributable primarily to the losses described below in our explanation for the nine-month period ended September 30, 2016. General, Administrative and Leasing Expenses General, administrative and leasing expenses decreased due primarily to our recognition in the prior period of $1.6 million in executive transition costs, representing mostly severance and termination benefits primarily in connection with executive departures. We recognized gain on sales of real estate of $1.2 million in the current period in connection with a land sale in White Marsh (discussed further in Note 4 to our consolidated financial statements). We recognized gain on sales of real estate in the prior period of $17.9 million on our sale of a 50% interest in six triple-net leased, single-tenant data center properties and $16.2 million in connection with other operating property dispositions. Comparison of Statements of Operations for the Nine Months Ended September 30, 2017 and 2016 For the Nine Months Ended September 30, 2017 2016 Variance (in thousands) Revenues Revenues from real estate operations $ 382,295 $ 397,965 $ (15,670 ) Construction contract and other service revenues 65,958 34,372 31,586 Total revenues 448,253 432,337 15,916 Expenses Property operating expenses 143,515 149,968 (6,453 ) Depreciation and amortization associated with real estate operations 100,290 99,790 500 Construction contract and other service expenses 63,589 32,513 31,076 Impairment losses 1,464 99,837 (98,373 ) General, administrative and leasing expenses 23,838 28,764 (4,926 ) Business development expenses and land carry costs 4,567 6,497 (1,930 ) Total operating expenses 337,263 417,369 (80,106 ) Operating income 110,990 14,968 96,022 Interest expense (57,772 ) (64,499 ) 6,727 Interest and other income 4,817 3,877 940 Loss on early extinguishment of debt (513 ) (37 ) (476 ) Equity in income of unconsolidated entities 2,162 614 1,548 Income tax (expense) benefit (145 ) 28 (173 ) Income (loss) before gain on sales of real estate 59,539 (45,049 ) 104,588 Gain on sales of real estate 5,438 34,101 (28,663 ) Net income (loss) $ 64,977 $ (10,948 ) $ 75,925  NOI from Real Estate Operations For the Nine Months Ended September 30, 2017 2016 Variance (Dollars in thousands, except per square foot data) Revenues Same Office Properties revenues Rental revenue, excluding lease termination revenue $ 259,141 $ 252,914 $ 6,227 Lease termination revenue 2,083 1,678 405 Tenant recoveries and other real estate operations revenue 69,995 70,509 (514 ) Same Office Properties total revenues 331,219 325,101 6,118 Constructed and redeveloped properties placed in service 15,357 4,780 10,577 Wholesale data center 21,201 20,106 1,095 Properties held for sale 8,182 8,211 (29 ) Dispositions 5,522 38,998 (33,476 ) Other 814 769 45 382,295 397,965 (15,670 ) Property operating expenses Same Office Properties (125,651 ) (125,872 ) 221 Constructed and redeveloped properties placed in service (4,206 ) (1,016 ) (3,190 ) Wholesale data center (10,041 ) (8,629 ) (1,412 ) Properties held for sale (918 ) (930 ) 12 Dispositions (1,695 ) (12,743 ) 11,048 Other (1,004 ) (778 ) (226 ) (143,515 ) (149,968 ) 6,453 UJV NOI allocable to COPT 3,889 1,008 2,881 NOI from real estate operations Same Office Properties 205,568 199,229 6,339 Constructed and redeveloped properties placed in service 11,151 3,764 7,387 Wholesale data center 11,160 11,477 (317 ) Properties held for sale 7,264 7,281 (17 ) Dispositions 3,827 26,255 (22,428 ) . . .  Oct 27, 2017 (c) 1995-2017 Cybernet Data Systems, Inc. All Rights Reserved From MarketWatch Can the Democrats Ride a Blue Wave to Midterm Election Wins? More Coverage What America’s gun fanatics won’t tell you My husband sold his grandmother’s house and paid off our mortgage — now his family is threatening to sue Bloodbath for cryptocurrencies as Bitcoin sheds 10%, now down 40% year-to-date","Oct 27, 2017 5:26 p.m. ET",N/A,10-Q: CORPORATE OFFICE PROPERTIES TRUST,https://www.marketwatch.com/story/10-q-corporate-office-properties-trust-2017-10-27
