code,content,date,listening,title,url
ACIW,"Chinese tourists will soon have an easier way of shopping in the U.S. Alipay announced this week it will be accepted by 35,000 additional merchants in the U.S. The Chinese mobile payment platform is an affiliate of mega-retailer Alibaba BABA, +2.59%  and owned by the financial services company Ant Financial. Those new merchants are in addition to the 4 million U.S. merchant locations that Alipay and First Data announced in May 2017. The expansion of Alipay, which already has over 600 million users, is possible through a partnership with Atlanta-based First Data FDC, +1.07% which facilitates the payments through its point-of-sale platforms. The reason for the integration? “Alipay aims to simplify every aspect of Chinese tourists’ travel in North America, enabling them to use Alipay for everything from ride-hailing and purchasing luxury goods, to making reservations at hotels and restaurants,” the company said in a statement. Currently, Alipay only works when linked with Chinese bank accounts. It works without the use of a credit card, making payments possible directly between bank accounts and retailers. Alipay isn’t the only company making shopping in the U.S. easier for those used to shopping in China. The payments company ACI Worldwide ACIW, +0.81%  on Wednesday announced a partnership with the Chinese company UnionPay International, which allows more UnionPay cards to be accepted at merchants worldwide. There are more than 7 billion UnionPay cards that have been issued worldwide. “If you’re a U.S. retailer, and you’re seeing the growth of Chinese tourism, there’s this opportunity to capture those tourist dollars coming into your store,” said Brendan Miller, a principal analyst at the research firm Forrester. Should antitrust laws be enforced against the tech giants' monopolies? Travel from China to the U.S. will likely only grow as more Chinese citizens increase their income, said Ryan Tuttle, a senior consumer finance analyst at the research firm Euromonitor International. They are a powerful economic force for U.S. retailers. Some 2.97 million Chinese tourists spent $33 billion in the U.S. in 2016, up 9% from the previous year, according to a U.S. Commerce Department report. That’s more than any other nationality, the report found. What’s more, Chinese nationals bought 32% of all luxury goods worldwide in 2017, according to the consulting firm Bain. Apparel, beauty and handbags make up the three biggest luxury categories consumers are buying worldwide, and shoes, jewelry and handbags are the three fastest-growing categories, it found. Making payments easier for Chinese tourists will likely be a priority for luxury brand retailers and duty-free shops at airports, as well as transportation services, Miller said. But Alipay probably won’t pick up too many new American users, even if Alipay could connect with U.S.-based bank accounts, Tuttle said. In the U.S., familiar mobile payment systems such as Apple Pay AAPL, +0.78%  and Samsung Pay 005930, -0.98%   still have relatively low adoption rates, so it’s “really unlikely” Alipay would start to take off among Americans, Tuttle said. “So much of whether a payment gets used is its ubiquity,” he said. “Nobody wants to be the one holding up the line at the store.” What’s more, American consumers might be less likely to trust a payment system so closely associated with an overseas company, at a time when there are growing concerns about access to data, he said. They already have shown some distrust of American companies like Amazon AMZN, +1.11% Facebook FB, +4.42%   and Google GOOG, +2.71%   having access to so much of their data. Facebook, in particular, is embroiled in a scandal involving the alleged data breach of 50 million accounts through a third party app. “With Facebook data news coming out this week, people are becoming more aware of who has their data,” Tuttle said. See also The shocking details you reveal about yourself when you ‘like’ things on Facebook Want to escape the snow storms? Try these discounted destinations The truth behind Airbnb listings SMARTASSET.COM","Mar 21, 2018 12:55 p.m. ET",1,This mobile payment app takes aim at America’s highest-spending tourists,https://www.marketwatch.com/story/this-mobile-payment-app-takes-aim-at-americas-highest-spending-tourists-2018-03-21
ACIW,"Germans have started saying “nein” to cash and are moving on to plastic. In many European countries, cash is falling out of vogue, and it’s happening most recently in the land of Oktoberfest, the Autobahn and Angela Merkel. For the first time last year, Germans used cash for less than half of their payments, in terms of total value of sales, according to a survey published Wednesday by Bundesbank, the central bank of Germany. The last time Bundesbank did the survey, in 2014, Germans made 53% of total sales purchases in cash. Why the shift? Card payments have increased, the bank found. Use of the “girocard,” a German debit card network, has increased about six percentage points since 2015 and now makes up 35% of payments in terms of sales purchases. Credit cards have risen slightly in popularity, but still only make up less than 5% of sales purchases in Germany. When it comes to frequency of payments rather than their value, cash still makes up the bulk of German purchases. About 74% of purchases in 2017 were made in banknotes and coins, a drop of just five percentage points since 2014. For small purchases, Germans still prefer cash. But Germany isn’t the only place the move away from cash is happening, according to an October 2017 study from Roubini ThoughtLab, a research firm based in New York, commissioned by the payments company Visa V, +2.25%  . The study examined the “digital maturity” of large cities across the world, in terms of how likely they are to support digital payments instead of cash. Visa obviously has a vested interest in the topic, and has ramped up efforts to get consumers to stop using paper money. “We’re focused on putting cash out of business,” said Visa’s Chief Executive Al Kelly, at the company’s investor day in June. The latest study divided cities into groups based on whether they were more cash-centric or digitally-centric. The rankings were based on surveys with consumers and businesses and data from sources including the World Bank and the Organization for Economic Co-operation and Development (OECD). The most “digitally mature” cities, according to the study authors, were those with a prevalence of mobile payments, online banking access, ATMs, the ability to receive government benefits digitally, and plenty of shoppers using of plastic debit and credit cards. They include Stockholm, Auckland, Canberra, Copenhagen, Helsinki, London, Ottawa, Sydney and Toronto. No American city is considered among the most “digitally mature.” Major U.S. cities including Austin, Chicago, New York, San Francisco and Washington D.C. were all in the second tier of cities, where people are still more likely to use cash. Why is cash still king in the U.S.? Usage of credit and debit cards has grown in the U.S., but many consumers still prefer cash. Although many U.S. cities have the infrastructure to support digital payments, many people have been slower to adopt them. Only about 20% of North American consumers make purchases with mobile payments regularly, according to an Accenture survey in 2015. In fact, the amount of cash in circulation in the U.S. continues to grow, according to the Federal Reserve. There are currently some 39.8 billion bank notes in circulation, up from 25.6 billion in 2005. Consumers made some 5.8 billion withdrawals from ATMs in 2015, the exact same amount as they did in 2012, but the average amount consumers withdraw during one transaction actually rose from 2012 to 2015, from $118 per transaction to $122, the Fed found. Part of the reason: Some Americans still do not have bank accounts. About 10 million families, or nearly 8% of the households in the U.S., don’t have any type of bank account at an insured institution, according to the Federal Deposit Insurance Corporation. And even for those who do have bank accounts, there may be little incentive to switch to digital payment options, Mark Ranta, the head of digital banking solutions at ACI Worldwide ACIW, +0.81%   previously told MarketWatch. “Changing ingrained habits is not something that is easily overcome,” he said. Many consumers don’t want all of their transactions to be traceable, he said. What investors - and everyone else - get wrong about innovation Why is cash less popular in cities overseas? Countries with smaller, more concentrated populations, such as Sweden and the U.K., often have an easier time making the switch to digital, Michelle Evans, the digital consumer manager at Euromonitor International, a market-research firm, previously told MarketWatch. The U.K. has traditionally been a global leader in payment technology. Researchers at Tufts University recently ranked countries by their readiness to go cashless, and the U.K. had one of the highest rankings, along with Sweden, Finland and Denmark. (Mastercard helped to fund the research; credit-card companies including Mastercard take a cut of transactions made on their cards, or through deals they make with institutions that issue the cards, including banks.) London was one of the first cities worldwide to install contactless technology — a terminal that can read a payment card without it having to be swiped — on its public-transportation system. Visa’s study found that the cities where cash is more commonly used were located in Latin America, Africa, the Middle East, Russia and India. In many of those cities, many people are also “unbanked,” and digital payments have not yet become popular. Payments companies including Visa benefit from the push toward a more cashless society and sometimes even offer businesses incentives to stop accepting cash. Visa in July announced it would give up to $10,000 to 50 U.S. restaurants and food vendors who stop accepting cash in favor of credit cards, debit cards and mobile payments. Adam Wand, the group lead of public policy at Visa said the company wants consumers to have choices when they pay, which may still include cash. See also After the Equifax breach, this is how many people have checked their credit The damaging, incalculable price of sexual harassment 200,000 people could see their credit scores rise because of this change SMARTASSET.COM","Feb 15, 2018 5:48 a.m. ET",9,Here’s the latest country where cash is losing its grip — Germany,https://www.marketwatch.com/story/cash-is-disappearing-from-these-cities-around-the-world-but-not-the-us-2017-10-12
ACIW,"There’s a pretty good chance the last time you paid for something, you did it with a debit card. Debit cards were the No. 1 payment method Americans used in 2016, the most recent year for which data was available, according to a report released this week by The Nilson Report, a company that analyzes the card and mobile payments industry. It analyzed data from the U.S. Bureau of Economic Analysis. Consumers made nearly 68 billion transactions on debit cards in 2016, The Nilson Report found, followed by cash with nearly 49 billion transactions and credit cards with about 34.6 billion transactions. Credit cards were third even though they receive a lot of headlines for their often generous rewards. They also have far more generous rules regarding liability and stolen cards than debit cards, most of which cap liability. As cash becomes less popular around the world, cards, including debit, credit, prepaid and electronic benefits transfer (EBT) made up nearly 61% of payment volume in 2016, The Nilson Report found. That will grow to more than 69% by 2021. In 2016, consumers for the first time spent more in terms of monetary value on credit and debit cards than they did in cash, according to the research firm Euromonitor International. Although the use of cards is growing, cash “continues to hold its own,” said David Robertson, the publisher of The Nilson Report. “Changing ingrained habits is not something that is easily overcome,” Mark Ranta, the head of digital banking solutions at ACI Worldwide ACIW, +0.81% told MarketWatch. Many consumers prefer cash because don’t want all their transactions to be traceable, he said. Everything we thought about millennials' money habits was wrong Some consumers use cash and debit cards to avoid debt. That can pay off for consumers, especially at a time when Americans owe more than $1 trillion in credit card debt, and they are expected to take on even more in 2018. However, those who use debit cards or cash can also miss out on a few benefits, including cashback rewards and, critically, the ability to improve their credit score and, thereby, pay less interest on loans they take out in the future. See also This is how much the 2017-2018 flu season could cost you It’s not your imagination, all those work trips are making you sick My brother told our mom it was a mistake to adopt me — then he put her in assisted care SMARTASSET.COM","Jan 10, 2018 9:09 a.m. ET",2,The latest evidence Americans prefer debit cards to credit cards,https://www.marketwatch.com/story/the-latest-evidence-americans-prefer-debit-cards-to-credit-cards-2018-01-10
ACIW,"Cash could become a relic of the past if credit-card companies have their way. Visa V, +2.25%   announced Wednesday that it will grant up to $10,000 to 50 restaurants and food vendors who stop accepting cash in favor of credit cards, debit cards and mobile payments. “We’re focused on putting cash out of business,” said Visa’s Chief Executive Al Kelly, at the company’s investor day in June. Some restaurants have already stopped accepting cash. The salad chain Sweetgreen announced in December 2016 it would gradually stop accepting cash at all of its locations in New York, California, Illinois, Pennsylvania, Maryland, Virginia and Washington, D.C. throughout 2017. In Boston, state laws require businesses to accept cash payments, so Sweetgreen’s locations there will accept it. But many consumers still resist the idea of a cashless world, whether it’s because of fears about “Big Brother” banks and governments tracking their spending, or because individuals want to keep their transactions under the table. Despite the rise of credit cards and payment apps, the amount of cash in circulation in the U.S. continues to grow, according to the Federal Reserve. There are currently some 39.8 billion bank notes in circulation, up from 25.6 billion in 2005. Banks have made it easier for people to access their cash. Consumers made some 5.8 billion withdrawals from ATMs in 2015, the exact same amount as they did in 2012, but the average amount consumers withdraw during one transaction actually rose from 2012 to 2015, from $118 per transaction to $122, the Fed found. What marriage-phobic millennials mean for the wedding-ring industry Some experts predict the love for cash may not last as they opt for credit-card and mobile payments. U.S. consumers spent some $2.1 trillion in cash transactions in 2016, but that’s forecasted fall to $1.9 trillion in 2021, according to the market-research firm Euromonitor International. Here are two pros (and two cons) of a cashless world: Using cash may help you avoid debt Going on an “all-cash spending diet” is a popular way for consumers to budget and over-spending, by putting a set amount of cash aside, sometimes in envelopes, for specific purposes such as food and entertainment. “Cash forces you to be physically involved in the repercussions of your transaction,” said Janessa Jackson, a 28-year-old who has tried a “cash diet.” “You hand the money over and you receive less back. Swiping does not hold you accountable in the moment.” Others still find it useful to use debit and credit cards, which allows them to keep a paper trail of where they may be overspending. There are also apps that track spending and can point out patterns, but they can’t do that analysis on cash spending. ...and cash may keep store prices down Credit-card companies typically charge merchants between 1% and 3% in processing fees for each transaction made on their cards. But it’s “a contentious point of debate” among the merchants, card issuers and networks whether those processing fees actually make products more expensive for consumers, said Kendrick Sands, a senior consumer finance analyst at Euromonitor International. Card networks recently have provided merchants with consumer-spending data that could make their businesses run more efficiently, therefore saving them some money, which can help keep costs down, he said. Keeping cash in circulation is expensive because governments and banks must pay to produce and store cash, and consumers sometimes lose dollar bills or have them stolen, said Mark Ranta, the head of digital payments at ACI Worldwide ACIW, +0.81%  , a payment systems company, who obviously has a vested interest in people going cashless. Most businesses already have credit-card fees factored into the price of their products, and they have for many years, said Matt Schulz, a senior industry analyst at the credit-cards website CreditCards.com. But credit cards are cleaner Do you know where your greenbacks have been? In May 2016, a store in Kentucky called Tobacco Road announced it would no longer accept cash that patrons pulled out of their bras or socks, stirring up Internet discussion about how disgusting it is to handle sweaty money. That wasn’t the first time people raised concerns about germy dollars. Cash is made of cotton and linen, materials that make it easy for bacteria to grow, according to a new report about $1 bills in New York City. Researchers from New York University found traces of cocaine, feces, acne agents and dog spit on those bills. Plastic carries less bacteria, they found. ...and cards come with rewards and guarantees In recent months, major banks and credit-card companies have competed to offer better rewards, marking what some have called a “golden age” of rewards points. Some of the most popular premium cards are Chase Sapphire Reserve credit card JPM, +1.82%   and American Express Platinum AXP, +1.16%  , both of which come with a large sign-up bonus. “It’s money in your pocket you wouldn’t otherwise have,” said Kimberly Palmer, a credit cards expert at the personal finance website NerdWallet. But only if you pay off your monthly statement on time: “The benefit comes as long as you can program yourself to make sure you either automate your payments or do it manually, but not letting it go,” she said. Many credit cards come with additional perks including customer service that will negotiate for incorrect charges, Ranta said. Some even come with price-matching, when cards will offer refunds to consumers if they find the same items they already paid for, at lower prices later. See also This is why you shouldn’t lie to a future employer about your salary Americans are in better financial shape by this critical measure CFPB announces rule that could help consumers sue financial firms for millions SMARTASSET.COM","July 17, 2017 5:19 p.m. ET",8,Credit card companies dream of a cashless world — what that would mean for you,https://www.marketwatch.com/story/what-living-in-a-cashless-world-would-mean-for-consumers-2017-07-13
ACIW,"Need to pay your friend, your coworker or your babysitter, but don’t have cash on you? There’s yet another app for that. Apple Inc. AAPL, +0.78%   announced Monday at its developer conference it would begin allowing peer-to-peer payments by sending a message through its iMessage app. It will let consumers pay one another without leaving their messaging thread. Apple will also offer a digital debit card called Apple Pay Cash, where users can store their money online. The service will become available at the same time as Apple’s new iOS 11 operating system this fall, according to Recode. Apple did not immediately respond to MarketWatch’s request for comment. Consumers can already send one another money through Facebook’s FB, +4.42%   Messenger app, which is probably the most similar peer-to-peer payments service currently available. There is also a myriad of apps that allow you to pay a friend for a dinner or movie ticket using a smartphone, but experts said Apple’s offering could make them more mainstream. Mobile peer-to-peer payments are projected to quadruple between 2016 and 2021, according to the research firm Forrester. Forrester sees digital payments, including in-app purchases, peer-to-peer payments and retail purchases, reaching $283 billion by 2021, up from an estimated $112 billion at the end of 2016, Barron’s Next reported in February. One of the largest and fastest-growing is PayPal’s PYPL, +1.08%   Venmo, which processed $6.8 billion in transactions in the first quarter of 2017 alone, a 114% increase since the first quarter of 2016. And like Apple’s new peer-to-peer system, Venmo is currently available within iMessage. It is also available as a separate app that consumers can use. They must link a credit card or bank account with the service to use it. It is free to use. Financial institutions are not standing idly by. Several banks have also been working together as part of an organization called Early Warning, and have developed a competitor called Zelle that allows consumers who use different banks to pay one another. Google also allows consumers to pay one another on Google Wallet. And Square Cash also allows peer-to-peer payments and is available already through iMessage. Don’t miss: Is my golfing buddy the cheapest guy in America? He asked me to Venmo him $1.50 The big difference between these and Apple Pay Cash: Apple’s service will be downloaded as part of the iOS upgrade, just like Photos or Maps. Apple’s new addition could make more consumers aware of the various ways they can use their phones to pay one another, “helping to raise the rising tide of peer to peer payments,” said Mark Ranta, the head of digital payments at ACI Worldwide ACIW, +0.81%  , a payment systems company. Consumers may also appreciate being able to stay within iMessage to complete their transaction, rather than having to visit a separate app, which often has its own password or other type of authentication, Ranta said. But there are a few obvious drawbacks to Apple’s service, said Brendan Miller, a principal analyst at Forrester. Only consumers who have Apple devices, which use iMessage, will be able to use it, he said. And not all of those who have those devices have even registered for Apple Pay. That might make it less desirable than a service like Venmo, which they can use regardless of which device they have. “Venmo is not going away anytime soon,” he said. Indeed, after Apple’s announcement, a spokesman for Venmo remained unfazed by Apple’s announcement. “We welcome any developments that help people move away from the awkwardness of cash,” he said. Apple shares have gained 33% in 2017, while the Dow Jones Industrial Average DJIA, +1.07%  has gained 7% and the S&P 500 SPX, +1.38%  has gained 9%. See also This is one reason why the rich will get richer The number of people with credit cards has hit levels not seen since before the Great Recession Metal credit cards: The latest American status symbol SMARTASSET.COM","June 6, 2017 9:11 a.m. ET",5,Apple gives consumers yet another option to make payments on their iPhones,https://www.marketwatch.com/story/can-apple-convince-customers-to-pay-each-other-on-their-iphones-2017-06-05
