code,content,date,listening,title,url
ACHN,"--Shares of two players developing hepatitis C treatments jump after news of peer being acquired --Bristol-Myers is paying a 163% premium to acquire Inhibitex --Analysts say significant interest remains for hepatitis C-focused biotech companies NEW YORK -(MarketWatch)- Shares of hepatitis C drug developers Idenix Pharmaceuticals Inc. IDIX and Achillion Pharmaceuticals Inc. ACHN, +0.00% jumped sharply after Bristol-Myers Squibb Co. BMY, +1.09% over the weekend agreed to pay a high premium to acquire another player in the category. Drug maker Bristol-Myers agreed to pay $26 a share, or about $2.5 billion, to acquire Inhibitex Inc. (INHX), paying a 163% premium to become a bigger player in the growing business of treating the potentially fatal virus. The bid came as companies race to develop, or acquire, more-effective drugs that can be taken for shorter periods with fewer side effects. The deal raised interest in other players developing hepatitis C treatments: Shares of Idenix jumped 35% to $9.51 in recent trading, and Achillion's stock rose 11% to $8.79. It was the highest level both stocks have traded at since 2007. Analysts say the news should bring significant merger-and-acquisition interest for remaining innovative hepatitis C-focused biotech companies, most notably Idenix and Achillion. Leerink Swann Research said that while Bristol-Myers's takeover of Inhibitex is less than the $11 billion valuation of Pharmasset Inc. VRUS which Gilead Sciences Inc. GILD, +0.82% agreed to acquire in November, ""it's still likely unprecedented for an early Phase II asset."" The firm said the Bristol-Myers deal leaves Idenix and Achillion as the only acquirable assets in their respective classes. Idenix's market capitalization is roughly $918 million, while Achillion's is $614 million. Idenix earlier Monday also disclosed positive interim data from a clinical trial of its lead hepatitis C drug candidate and said it is advancing its hepatitis C development pipeline. Idenix says more than an estimated 170 million people worldwide are chronically infected with hepatitis C. Under a development and commercialization agreement with Novartis AG (NVS, NOVN.VX) signed in May 2003, Idenix launched hepatitis B drug candidate telbivudine, which is sold on the market as Tyzeka/Sebivo. Idenix has three other treatments in the pipeline, as well as additional nucleotide inhibitors. Achillion--which has five hepatitis C treatments in development, including one compound in Phase 2--on Monday said the 12-week treatment of ACH-1625 was safe and well tolerated. The company said it now plans to research the Phase 2 treatment in combination with other oral antiviral agents for the treatment of all hepatitis C genotypes. Not all analysts were buying into the rally. Brean Murray Carret & Co. analyst Brian Skorney wrote in a note that Idenix's effort in the space ""will ultimately yield results that do not match what we have become accustomed to"" from others. Skorney affirmed his sell rating and $3 price target on the stock. More from MarketWatch How to Run a Better Meeting: Advice From Extremely Successful People More Coverage Home sellers now use spycams to gather intel on prospective buyers Bloodbath for cryptocurrencies as Bitcoin sheds 10%, now down 40% year-to-date Three reasons the stock market’s fundamentals look solid","Jan 9, 2012 1:34 p.m. ET",1,Hepatitis C drug developers up after Bristol deal,https://www.marketwatch.com/story/hepatitis-c-drug-developers-up-after-bristol-deal-2012-01-09
ACHN,"BOSTON (MarketWatch) -- Shares of hepatitis C drug-developers rallied early Monday in the wake of the news that Bristol-Myers Squibb BMY, +1.09% plans to buy Inhibitex Inc. inhx for $2.5 billion, or $26 a share. The deal, which was announced late Saturday, represents a roughly 160% premium over Inhibitex's closing price on Friday. Inhibitex has a hepatitis drug candidate, INX-189, in Phase II development. Bristol-Myers likewise has been developing treatments for the chronic liver disease. Shares of Inhibitex soared 140% in early trading. Meanwhile, Idenix Pharmaceuticals idix saw its shares shoot up 36% to $9.59 as Achillion Pharmaceuticals' ACHN, +0.00% stock jumped 13% to $8.92. Shares of Vertex Pharmaceuticals VRTX, +2.13% which recently won approval for its hepatitis C drug Incivek, were up 6%.","Jan 9, 2012 9:59 a.m. ET",1,Hepatitis C drug makers rally on Inhibitex deal,https://www.marketwatch.com/story/hepatitis-c-drug-makers-rally-on-inhibitex-deal-2012-01-09
ACHN,"BOSTON (MarketWatch) -- Shares of Achillion Pharmaceuticals ACHN, +0.00% soared 14% to $6.50 on Thursday, after analysts at Piper Jaffray initiated coverage of the stock with an overweight rating.","Sept 8, 2011 12:35 p.m. ET",1,Achillion soars on analyst rating,https://www.marketwatch.com/story/achillion-soars-on-analyst-rating-2011-09-08
ACHN,"WASHINGTON (MarketWatch) — Among the companies whose shares could see active trade in Tuesday’s session are Take-Two Interactive Software Inc., Kindred Healthcare Inc. and Limelight Networks Inc. On Tuesday’s earnings calendar are blue chip Walt Disney Co. DIS, +1.93% as well as Ralcorp Holdings Inc. RAH Fossil Inc. FOSL, +2.09%   and SunPower Corp. SPWRB SPWRA among others. Late Monday, Take-Two Interactive TTWO, +0.33%  reported first-quarter results showing the New York-based company swinging into the red. The company had a loss of $8.6 million, or 11 cents a share, for the three months ended June 30, a reversal from the prior year’s profit of $27.4 million, or 31 cents a share. Quarterly revenue fell to $334.4 million from $375.4 million. Excluding items, the company would have earned 2 cents a share for the latest quarter, less than the 10-cent consensus derived a survey of analysts by FactSet Research. Kindred Healthcare KND, +0.00% along with reporting second-quarter results late Monday, resumed its earnings outlook following the company’s recent RehabCare acquisition. On an adjusted basis, the Louisville, Ky.-based company sees earnings from continuing operations in a range of 25 cents to 30 cents a share for the third quarter, including 5 cents a share from a favorable tax adjustment, with full-year profit pegged in a range of $1.80 to $1.90 a share. Also, consolidated revenue is projected at $5.6 billion for 2011, rising to an estimated $6.4 billion for 2012, when management said it expects Kindred to generate earnings from continuing operations in a range of or $1.65 to $1.85 a share. Limelight Networks LLNW, +0.00%  reported second-quarter results that showed revenue about $2 million below management’s forecast. The company also forecast third-quarter revenue to be in the range of $51.7 million to $53.2 million for the third quarter, up from $50.5 million for the June quarter. Also late Monday, Achillion Pharmaceuticals Inc. ACHN, +0.00%  posted second-quarter results showing its loss widening to $11.7 million as expenses on research and development expenses climbed to $8.9 million, in connection with efforts to develop a trio of compounds intended as treatments for hepatitis C. Pall Corp. PLL, -6.21%  announced a change in the company’s executive suite. Larry Kingsley has been selected as president and CEO and will take a seat on Pall’s board effective Oct. 3. Kingsley, 48, is joining Pall from Idex Corp. IEX, +1.42% where he had served as chairman, president and chief executive. Lake Forest, Ill.-based Idex said Andrew Silvernail has been promoted to CEO. More from MarketWatch Uber for Bikes Could Save Your Commute More Coverage Why tax refunds have lost their sparkle Why every investor should be terrified by the slide in Home Depot stock Delta flight scare is a reminder never to put electronics in checked baggage Related Topics U.S. Stocks Markets Investing","Aug 9, 2011 6:24 a.m. ET",2,"Stocks to watch Tuesday: Take-Two, Kindred",https://www.marketwatch.com/story/stocks-to-watch-tuesday-take-two-kindred-2011-08-09
ACHN,"BOSTON (MarketWatch) -- Drug stocks were mixed Wednesday after the Federal Reserve announced it was keeping its lending rate at an all-time low and was ending a controversial bond-buying program dubbed QE2. The NYSE Arca Pharmaceutical Index DRG, +0.38%   was down nominally at 328 while the NYSE Arca Biotechnology Index BTK, +0.15%   rose 0.6% to 1,435. News Hub: Fed in No Hurry to Raise Interest Rates The Federal Open Market Committee said that while economic growth was lower than expected, it believes the economy will pick up steam later this year. The Fed voted to keep its key interest rate at between 0% and 0.25%, in addition to formally ending its $600 billion bond-buying program on June 30. Read more on Fed statement. Federal Reserve Chairman Ben Bernanke was to hold a news conference to discuss the Fed’s latest economic forecast beginning at 2:15 p.m. Eastern. Shares of Neuralstem Inc. CUR, +0.61%   gained for the second day, up almost 20% at $1.88. Late Monday, Neuralstem said it hopes to wrap up Phase 1a testing of its neurology drug NSI-189 by July and begin Phase 1b testing later this fall. No serious side effects have been observed in patients, the company added. Researchers believe that NSI-189 can stimulate the growth of new neurons in the hippocampus area of the brain, which could help treat such conditions as depression, Alzheimer’s and post-traumatic stress disorder. Shares of Fibrocell Science FCSC, +0.31%   were up 10% at $1.28. The biotech group announced it has won U.S. regulatory approval for its cellular therapy laViv for the treatment of smile lines. Shares of Botox-maker Allergan AGN, +1.59%   were down almost 1%. Achillion Pharmaceuticals ACHN, +0.00%   shares soared 20% to $7.21 after it priced a stock offering only slightly below Tuesday’s close of $6.01. Achillion plans to sell 9.6 million shares at $5.90 a share, which should net about $52.9 million. The transaction is expected to close on Monday. More from MarketWatch Damn the torpedoes — what could take the S&P 500 to 3,000 Why tax refunds have lost their sparkle Three reasons the stock market’s fundamentals look solid Related Topics Biotechnology U.S. Stocks Markets Health Care","June 22, 2011 2:02 p.m. ET",1,Drug stocks mixed after Fed statement,https://www.marketwatch.com/story/drug-stocks-mixed-after-fed-statement-2011-06-22
ACHN,"BOSTON (MarketWatch) -- Shares of Achillion Pharmaceuticals ACHN, +0.00% were up 11% at $6.65 early Wednesday after it priced a public stock offering modestly below Tuesday's closing price of $6.01. Achillion said that it plans to sell 9.6 million shares at $5.90 a share, which should net the company around $52.9 million. The transaction is expected to close on June 27.","June 22, 2011 10:15 a.m. ET",1,Achillion jumps 11% on stock offer pricing,https://www.marketwatch.com/story/achillion-jumps-11-on-stock-offer-pricing-2011-06-22
ACHN,"Achillion Pharmaceuticals Inc.'s ACHN, +0.00% bigger-sized stock sale of 9.6 million shares priced at a mere 1.8% discount to its Tuesday close, as the drug developer looks to raise funds to help bring its drug candidates to market. Shares were up 8.2% at $6.50 in recent premarket trading, compared with the $5.90 offer price. The stock through Tuesday's close has nearly tripled in the past year. Achillion, which focuses on treatments for hepatitis C and drug-resistant bacterial infections, on Tuesday had unveiled plans to sell at least 9 million shares. It plans to use the proceeds to continue clinical testing on some treatments, advance drug candidates into clinical trials and for other purposes. More from MarketWatch Can the Democrats Ride a Blue Wave to Midterm Election Wins? More Coverage Bloodbath for cryptocurrencies as Bitcoin sheds 10%, now down 40% year-to-date Delta flight scare is a reminder never to put electronics in checked baggage Home sellers now use spycams to gather intel on prospective buyers","June 22, 2011 8:56 a.m. ET",1,Achillion's share sale prices at 1.8% discount,https://www.marketwatch.com/story/achillions-share-sale-prices-at-18-discount-2011-06-22
ACHN,"BOSTON (MarketWatch) — Emergent BioSolutions Inc. grabbed the drug-sector spotlight Thursday, with shares rallying on news that the government intends to award the company a contract for its anthrax vaccine BioThrax. Shares of Emergent EBS, +1.27%   shot up almost 20% to $25.33. Emergent said that it has been informed that the U.S. government plans to buy 44.75 million doses of BioThrax over a five-year period. Emergent said it expects to finalize the contract during the third quarter. Shares of Cubist Pharmaceuticals Inc. CBST   rose 4% to $38.39. On Thursday, U.K.’s The Telegraph published a report citing unnamed sources that stated Shire PLC SHPGY   is considering a bid for Cubist. The Telegraph said that Anglo-Irish drug maker reportedly approached Cubist a month ago with an offer of $44.50 a share and that the two are now engaged in merger talks. AM Report: GOP Pushing Medicare Support Forward Shire announced last week it was buying Advanced BioHealing for $750 million. Shire made the announcement hours before Advanced BioHealing was scheduled to launch its initial public offering. Shares of Shire were virtually flat at $91.53. Shares of Arena Pharmaceuticals Inc. ARNA, -0.28%   leaped 10% after the company released a positive analysis of Phase III data for its diet drug lorcaserin. U.S. regulators declined to approve the drug in October, citing the need for more data. Achillion Pharmaceuticals Inc. ACHN, +0.00%   shares shot up 11%. Analysts at William Blair initiated coverage of the stock with an outperform rating. Shares of Akorn Inc. AKRX, -0.16%   fell for the second day, down 5%. The company priced its $100 million convertible senior note offering, which will carry an annual rate of 3.5%. The notes, which will mature in 2016, will be convertible into stock, cash or a combination of both, at an initial conversion rate of $8.76 a share. The transaction is expected to close on or about June 1. Meanwhile, the drug sector’s two key indexes slipped marginally. The NYSE Arca Pharmaceutical Index DRG, +0.38%   and the NYSE Arca Biotechnology Index BTK, +0.15%   were both down 0.2% at 333 and 1,453, respectively. More from MarketWatch My husband sold his grandmother’s house and paid off our mortgage — now his family is threatening to sue Why every investor should be terrified by the slide in Home Depot stock S&P 500 logs longest losing streak of the year as trade-war jitters weigh Related Topics Biotechnology U.S. Stocks Markets Health Care","May 26, 2011 1:27 p.m. ET",1,Drug stocks slip; Emergent rallies,https://www.marketwatch.com/story/drug-stocks-decline-arena-cubist-shine-2011-05-26
ACHN,"Premarket movers U.S. stock futures pared earlier gains in the wake of the latest ADP report on private-sector payrolls, which showed that 201,000 jobs were added in March. Read about the ADP payrolls report. | Read Indications for more U.S. market action. Global markets Japanese equities gained in Tokyo on the back of a weaker yen and news that production would soon resume at some plants that had been closed in the wake of the earthquake and tsunami. In Europe, stocks in Germany led regional advancers, with peripheral markets mostly held in check by sovereign-debt worries. Read the latest news on Asia Markets | Read more about Europe Markets. Breaking news Achillion Pharmaceuticals Inc. ACHN, +0.00%  reported positive results for its experimental treatment of chronic hepatitis C. Apollo Global Management LLC APO, +0.00%  will begin trading Wednesday after it priced its initial public offering late Tuesday at $19 a share, at the top of its expected range. Read about Apollo’s IPO. | Read a MarketWatch commentary on Apollo’s IPO. Cephalon Inc. CEPH  shares soared more than 30% in premarket trade. Late Tuesday, Valeant Pharmaceuticals International Inc. VRX, +2.91%  said it would bid $73 a share for the firm. See Hulbert Interactive: Sentiment toward Cephalon. Dana Holding Corp. DAN, +3.08%  named Roger Wood, 48, as its chief executive officer, effective April 18. PPG Industries Inc. PPG, +1.48%  said it is expecting a first-quarter profit of $1.30 to $1.35 a share, which would beat Wall Street forecasts. In India, a cricket semifinal between rivals India and Pakistan was a focus for cricket fans of both nations, but also served as an occasion to rekindle peace talks for the first time since the 2008 Mumbai attacks. See India-Pakistan cricket match. Visa Inc. V, +2.25%  and MasterCard Inc. MA, +2.82%  shares were both rising in preopen trade. Before the Bell is a daily emailed newsletter. You can subscribe here. More from MarketWatch How to Get a Job: Advice From Extremely Successful People More Coverage 2 sexy ways to get paid to save Home sellers now use spycams to gather intel on prospective buyers Delta flight scare is a reminder never to put electronics in checked baggage Related Topics U.S. Stocks Markets N.Y. Stock Exchange NASDAQ","Mar 30, 2011 9:16 a.m. ET",1,"ADP data, Apollo Global, Cephalon in focus",https://www.marketwatch.com/story/adp-data-apollo-global-cephalon-in-focus-2011-03-30
ACHN,"NEW YORK (MarketWatch) — U.S. stock futures lightly shaved gains Wednesday after Automatic Data Processing Inc. reported that private-sector companies added 201,000 jobs in March, while February’s job gains were revised downward. “While the rate of job additions is well below what one would hope for, there is clearly a pickup in job creation,” noted Dan Greenhaus, chief economic strategist at Miller Tabak & Co. The data came ahead of Friday’s closely watched nonfarm-payrolls report. Up more than 50 points before the ADP report, futures for the Dow Jones Industrial Average DJM11  were lately up 44 points to 12,269. Those for the Standard & Poor’s 500 index SPM11  rose 5.9 points to 1,322.4. Futures for the Nasdaq 100 index NDM11   gained 15.5 points to 2,338.  • MarketWatch Topics: Middle East • | | • | | • U.S.: |  TOOLS • Latin American and Canadian indexes • European indexes | Asian indexes  MORE ON THE MARKETS • Global Economic Calendar • | | Earnings Watch • | U.S. Economic Calendar Overnight, Japan’s Nikkei Stock Average (NI225) rallied 2.6% as exporters surged on a drop in the yen and news of recovering production after the recent earthquake and tsunami. In Europe, stocks were mostly higher, led by miners, car makers and utilities. “The markets have taken a bit of a step today,” said Ben Critchley, sales trader at IG Index. He said momentum in Asian markets seems to be building after initial losses in the wake of the Japanese crisis. “Markets seem strong, considering what’s going on in the world, and certainly, as far as the U.S. goes, we saw declining consumer sentiment and house prices... that has worried the market before, but it seems to have been pushed to one side,” he said. Soccer Game Lifts Japan's Spirits On Tuesday, Wall Street closed higher, paced by gains for energy and telecom stocks. The Dow Jones Industrial Average DJIA, +1.07%  rose 81 points, or 0.7%, to close at 12,279. Among companies in the news, Family Dollar Stores Inc. FDO, +7.10%  reported a second-quarter profit of 98 cents a share. On average, analysts surveyed by FactSet Research expected a quarterly profit of 97 cents a share. Shares of Valeant Pharmaceuticals International Inc. VRX, +2.91%  rose in premarket trade. Late Tuesday, the company said it will bid $73 a share for biopharmaceutical group Cephalon Inc. CEPH  in an offer valued at almost $5.7 billion. Read about Valeant’s bid for Cephalon. Also in premarket trading, shares of drug maker Achillion Pharmaceuticals Inc. ACHN, +0.00% rose after the company announced positive results for a clinical trial of a treatment for chronic hepatitis C. Crude oil for May delivery fell 28 cents to $104.51 a barrel in electronic trade on the New York Mercantile Exchange. Against the Japanese yen, the U.S. dollar USDJPY, +0.08%   rose to ¥83.05, after hitting a more than three-week high. The dollar got a boost Tuesday from speculation that the U.S. Federal Reserve won’t extend its quantitative-easing program past June. Dallas Fed President Richard Fisher said he would vote against any further monetary easing by the central bank after the current program ends. Gains for the dollar continued through Asian and into European trading. More from MarketWatch Delta flight scare is a reminder never to put electronics in checked baggage BlackRock fund manager sees this as the market’s ‘sweet spot’ My husband sold his grandmother’s house and paid off our mortgage — now his family is threatening to sue Related Topics Futures Commodities Markets Commodity Futures Trading Commission","Mar 30, 2011 8:45 a.m. ET",1,U.S. stock futures trim gains after ADP,https://www.marketwatch.com/story/us-stock-futures-rise-adp-jobs-report-on-tap-2011-03-30
ACHN,"NEW YORK (MarketWatch) -- Shares of Achillion Pharmaceuticals Inc. ACHN, +0.00% were indicated higher in early trading Wednesday after the drug company reported positive results for its experimental treatment of chronic hepatitis C. Top-line results of a phase 2a clinical trial of ACH-1625, given once daily in combination with Pegasys to patients with hepatitis C, showed ""rapid response"" among 75% to 81% of those patients with a ""promising safety and tolerability profile,"" the New Haven, Conn., company said. ACH-1625 is a HCV protease inhibitor, which means it blocks the replication of the hepatitis C virus.","Mar 30, 2011 7:37 a.m. ET",1,Achillion reports positive results for HCV drug,https://www.marketwatch.com/story/achillion-reports-positive-results-for-hcv-drug-2011-03-30
ACHN,"NEW YORK (MarketWatch) -- Shares of the following companies were making noteworthy moves in the U.S. stock market on Wednesday: Advancers Achillion Pharmaceuticals Inc. ACHN, +0.00% rose 14% after the drug-development company reported upbeat preliminary data from a trial of its hepatitis C treatment. Cache Inc. CACH, +200.00% shares rose 11% after the women's apparel retailer reported a quarterly loss, but offered optimistic words on the second quarter. Cameron International Corp. CAM, -1.67% rose 6.4%. Eastman Kodak Co. EK shares were ahead 9.6% after S&P Equity Research upgraded the photography company to hold from sell. Fluor Corp. FLR, +2.45% shares gained 5.8% after the largest publicly traded U.S. engineering firm said new contracts could exceed $8.8 billion in the second quarter. JDS Uniphase Corp. JDSU shares were up 6.6%. Leap Wireless International Inc. LEAP shares rose 9.8% and MetroPCS Communications Inc. PCS shares were up 6% after Deutsche Bank offered upbeat comments on both low-cost wireless carriers. Massey Energy Co. MEE, +1.42% shares were up 5.7%. Micron Technology Inc. MU, +1.26% shares gained 5.8%. Netlist Inc. NLST, -4.74% shares climbed 23% after the technology provider to the communications industry reported net losses narrowed to $3 million in the first quarter. Hackett Group Inc. HCKT, -2.78% shares climbed 20% after the business and technology consulting firm late Tuesday reported income tripled in the first quarter. Sybase Inc. SY, +2.53% shares rose 35%. XL Capital Ltd. XL, -0.16% shares rose 8.8%. Analysts at KBW on Wednesday noted a change in how S&P classifies non-U.S. domiciled companies should mean that XL, which is re-domiciling to Ireland, will stay in the S&P 500 Index SPX, +1.38% Decliners Electronic Arts Inc. ERTS shares were off 5.8% after the video-game publisher late Tuesday reported results and offered a forecast that disappointed. SunPower Corp. SPWRA shares were down 7.3% after the supplier of solar modules late Tuesday reported quarterly results below Wall Street expectations. More from MarketWatch Samsung Galaxy S9: Putting the Camera to the Test More Coverage Three reasons the stock market’s fundamentals look solid Delta flight scare is a reminder never to put electronics in checked baggage What America’s gun fanatics won’t tell you Related Topics U.S. Stocks Markets Investing","May 12, 2010 5:03 p.m. ET",1,Wednesday's biggest gainers and decliners,https://www.marketwatch.com/story/wednesdays-biggest-gainers-and-decliners-2010-05-12
