code,content,date,listening,title,url
OCSI,"Bloomberg NEW YORK (MarketWatch) – Fifth Street Asset Management said Wednesday it is postponing its initial public offering, citing continued volatility and difficult conditions in the equity markets. The credit-focused asset manager with nearly $6 billion under management did not offer any possible timing for another attempt at a listing. “While we received demand from potential investors, market conditions are not optimal for an IPO at this time,” Chief Executive Leonard M. Tannenbaum said in a statement. The recent wild swings in the market, fueled by global growth concerns, tensions in Ukraine and the Middle East and Ebola fears, has many companies thinking twice about going public. Seven other companies have pulled their IPOs this month, according to data from Dealogic. Fifth Street Asset Management was planning to offer 8 million shares of common stock at a price range of $24 to $26 a share. The Greenwich, Connecticut-based company was supposed to list on the Nasdaq under the symbol FSAM. Two other asset managers that completed IPOs this year are currently trading below their issue price. Shares of Ares Management LP ARES, +0.23%  , which went public in May, were last trading at $16.80, 11.6% below their issue price of $19 a share. Shares of Medley Management Inc. MDLY, -0.88%  , which went public in September, were trading at $16.72, 7.2% below their issue price of $18. Tannenbaum, a former equity analyst at Merrill Lynch, founded the Fifth Street entities in 1998. Fifth Street Asset Management has two publicly-traded business development companies, Fifth Street Finance Corp. US:FSC   and Fifth Street Floating Rate Corp. US:FSFR  . BDCs invest in the debt of smaller companies and are sometimes compared to venture capital fund. as they serve growth-stage businesses that may otherwise find it difficult to access capital. Morgan Stanley, J.P. Morgan, Goldman Sachs, RBC Capital Markets and Credit Suisse were the mandated underwriters on the IPO. More from MarketWatch Samsung Galaxy S9: Putting the Camera to the Test More Coverage Why every investor should be terrified by the slide in Home Depot stock What America’s gun fanatics won’t tell you Jobless claims drop 4,000 to 226,000","Oct 22, 2014 1:44 p.m. ET",2,Fifth Street Asset Management pulls IPO,https://www.marketwatch.com/story/fifth-street-asset-management-pulls-ipo-2014-10-22
OCSI,"(EDGAR Online via COMTEX) -- Item 2. Management's Discussion and Analysis of Financial Condition and Results of Operations The following discussion should be read in connection with our Consolidated Financial Statements and the notes thereto included elsewhere in this quarterly report on Form 10-Q. Some of the statements in this quarterly report on Form 10-Q constitute forward-looking statements because they relate to future events or our future performance or financial condition. The forward-looking statements contained in this quarterly report on Form 10-Q may include statements as to: our future operating results and distribution projections; the ability of Oaktree Capital Management, L.P., or Oaktree or our Investment Adviser, to reposition our portfolio and to implement our Investment Adviser's future plans with respect to our business; our business prospects and the prospects of our portfolio companies; the impact of the investments that we expect to make; the ability of our portfolio companies to achieve their objectives; our expected financings and investments; the adequacy of our cash resources and working capital; the timing of cash flows, if any, from the operations of our portfolio companies; and the cost or potential outcome of any litigation to which we may be a party. In addition, words such as ""anticipate,"" ""believe,"" ""expect,"" ""seek,"" ""plan,"" ""should,"" ""estimate,"" ""project"" and ""intend"" indicate forward-looking statements, although not all forward-looking statements include these words. The forward-looking statements contained in this quarterly report on Form 10-Q involve risks and uncertainties. Our actual results could differ materially from those implied or expressed in the forward-looking statements for any reason, including the factors set forth in ""Item 1A. Risk Factors"" in our annual report on Form 10-K for the year ended September 30, 2017 and elsewhere in this quarterly report on Form 10-Q. changes in the economy, financial markets and political environment; risks associated with possible disruption in our operations or the economy generally due to terrorism or natural disasters; future changes in laws or regulations (including the interpretation of these laws and regulations by regulatory authorities) and conditions in our operating areas, particularly with respect to business development companies or regulated investment companies, or RICs; and other considerations that may be disclosed from time to time in our publicly disseminated documents and filings. We have based the forward-looking statements included in this quarterly report on Form 10-Q on information available to us on the date of this quarterly report, and we assume no obligation to update any such forward-looking statements. Although we undertake no obligation to revise or update any forward-looking statements, whether as a result of new information, future events or otherwise, you are advised to consult any additional disclosures that we may make directly to you or through reports that we in the future may file with the Securities and Exchange Commission, or the SEC, including annual reports on Form 10-K, quarterly reports on Form 10-Q and current reports on Form 8-K. companies across a variety of industries that typically possess business models we expect to be resilient in the future with underlying fundamentals that will provide strength in future downturns. We intend to deploy capital across credit and economic cycles with a focus on long-term results, which we believe will enable us to build lasting partnerships with financial sponsors and management teams. Under normal market conditions, through January 18, 2018, at least 80% of the value of our net assets plus borrowings for investment purposes will be invested in floating rate senior loans, which include both first and second lien secured debt financings. Effective January 19, 2018, the Company is no longer subject to this policy. We invest in unsecured loans, including subordinated loans, issued by private middle-market companies and, to a lesser extent, senior and subordinated loans issued by public companies and equity investments. Our Investment Adviser intends to reposition our portfolio in the near-term in order to (1) rotate out of a small number of investments that it views as challenged, (2) focus on increasing the size of our core private investments and New Investment Advisory Agreement with Oaktree Upon the closing of the transactions, or the Transaction, contemplated by the Asset Purchase Agreement, or the Purchase Agreement, by and among Oaktree, our Former Adviser and, for certain limited purposes, Fifth Street Asset Management Inc., or FSAM, the indirect, partial owner of our Former Adviser, and Fifth Street Holdings L.P., the direct, partial owner of our Former Adviser, on October 17, 2017, Oaktree became the investment adviser to each of Oaktree Specialty Lending Corporation, or OCSL, and us, and Oaktree paid gross cash consideration of $320 million to our Former Adviser. The closing of the Transaction resulted in an assignment for purposes of the 1940 Act of our investment advisory agreement with FSM, or the Former Investment Advisory Agreement, and, as a result, its immediate termination. The material terms of the services to be provided under the New Investment Advisory Agreement, other than the fee structure, are substantially the same as the Former Investment Advisory Agreement, except that services are provided by Oaktree. See ""Note 11. Related Party Transactions-New Investment Advisory Agreement"" and ""-Administrative Services"" in the notes to the accompanying Consolidated Financial Statements. Directors must not be interested persons of Oaktree or our Former Adviser. Second, an ""unfair burden"" must not be imposed on us as a result of the closing of the Transaction or any express or implied terms, conditions or understandings applicable thereto during the two-year period after the closing of the Transaction. Hierarchical levels, defined by ASC 820 and directly related to the amount of subjectivity associated with the inputs to fair valuation of these assets and liabilities, are as follow: Level 1 - Unadjusted, quoted prices in active markets for identical assets or liabilities as of the measurement date. Level 2 - Observable inputs other than Level 1 prices, such as quoted prices for similar assets or liabilities; quoted prices in markets that are not active; or other inputs that are observable or can be corroborated by observable market data at the measurement date for substantially the full term of the assets or liabilities. Level 3 - Unobservable inputs that reflect management's best estimate of what market participants would use in pricing the asset or liability at the measurement date. Consideration is given to the risk inherent in the valuation technique and the risk inherent in the inputs to the model. If inputs used to measure fair value fall into different levels of the fair value hierarchy, an investment's level is based on the lowest level of input that is significant to the fair value measurement. Our assessment of the significance of a particular input to the fair value measurement in its entirety requires judgment and considers factors specific to the investment. This includes investment securities that are valued using ""bid"" and ""ask"" prices obtained from independent third party pricing services or directly from brokers. These investments may be classified as Level 3 because the quoted prices may be indicative in nature for securities that are in an inactive market, may be for similar securities or may require adjustments for investment-specific factors or restrictions. If the quotation provided by the pricing service is based on only one or two market sources, we perform additional procedures to corroborate such information, which may include the market yield technique discussed below and a quantitative and qualitative assessment of the credit quality and market trends affecting the portfolio company. Preliminary valuations are then reviewed and discussed with management of our Investment Adviser; The Investment Adviser compares and contrasts its preliminary valuations to the valuations of the independent valuation firms and prepares a valuation report for the Audit Committee; The Audit Committee reviews the preliminary valuations with our Investment Adviser, and our Investment Adviser responds and supplements the preliminary valuations to reflect any discussions between our Investment Adviser and the Audit Committee; The Audit Committee makes a recommendation to our full Board of Directors regarding the fair value of the investments in our portfolio; and Our Board of Directors discusses valuations and determines the fair value of each investment in our portfolio. The fair value of our investments as of December 31, 2017 and September 30, 2017 was determined in good faith by our Board of Directors. Our Board of Directors has and will continue to engage independent valuation firms to provide assistance regarding the determination of the fair value of a portion of our portfolio securities for which market quotations are not readily available or are readily available but deemed not reflective of the fair value of the investment each quarter, and the Board of Directors may reasonably rely on that assistance. As of December 31, 2017, 77.7% of our portfolio at fair value was valued either based on market quotations, the transactions precedent approach or by independent valuation firms. The percentage of our portfolio valued by independent valuation firms may vary from period to period based on the availability of market quotations for our portfolio investments during the respective periods. However, our Board of Directors is responsible for the ultimate valuation of the portfolio investments at fair value as determined in good faith pursuant to our valuation policy and a consistently applied valuation process. Feb 09, 2018 (c) 1995-2018 Cybernet Data Systems, Inc. All Rights Reserved","Feb 9, 2018 6:17 a.m. ET",N/A,10-Q: OAKTREE STRATEGIC INCOME CORP,https://www.marketwatch.com/story/10-q-oaktree-strategic-income-corp-2018-02-09
OCSI,"(EDGAR Online via COMTEX) -- Item 7. Management's Discussion and Analysis of Financial Condition and Results of Operations The following discussion and analysis should be read in conjunction with the Consolidated Financial Statements and the notes thereto included elsewhere in this annual report on Form 10-K. Some of the statements in this annual report on Form 10-K constitute forward-looking statements because they relate to future events or our future performance or financial condition. The forward-looking statements contained in this annual report on Form 10-K may include statements as to: our future operating results and distribution projections; the ability of our Investment Adviser to reposition our portfolio and to implement our Investment Adviser's future plans with respect to our business; our business prospects and the prospects of our portfolio companies; the impact of the investments that we expect to make; the ability of our portfolio companies to achieve their objectives; our expected financings and investments; the adequacy of our cash resources and working capital; the timing of cash flows, if any, from the operations of our portfolio companies; and the cost or potential outcome of any litigation to which we may be a party. In addition, words such as ""anticipate,"" ""believe,"" ""expect,"" ""seek,"" ""plan,"" ""should,"" ""estimate,"" ""project"" and ""intend"" indicate forward-looking statements, although not all forward-looking statements include these words. The forward-looking statements contained in this annual report on Form 10-K involve risks and uncertainties. Our actual results could differ materially from those implied or expressed in the forward-looking statements for any reason, including the factors set forth in ""Item 1A. Risk Factors"" and elsewhere in this annual report on Form 10-K. changes in the economy, financial markets and political environment; risks associated with possible disruption in our operations or the economy generally due to terrorism or natural disasters; future changes in laws or regulations (including the interpretation of these laws and regulations by regulatory authorities) and conditions in our operating areas, particularly with respect to business development companies or RICs; and other considerations that may be disclosed from time to time in our publicly disseminated documents and filings. We have based the forward-looking statements included in this annual report on Form 10-K on information available to us on the date of this annual report, and we assume no obligation to update any such forward-looking statements. Although we undertake no obligation to revise or update any forward-looking statements, whether as a result of new information, future events or otherwise, you are advised to consult any additional disclosures that we may make directly to you or through reports that we in the future may file with the SEC, including annual reports on Form 10-K, quarterly reports on Form 10-Q and current reports on Form 8-K. in floating rate senior loans, which include both first and second lien secured debt financings. We may also invest in unsecured loans, including subordinated loans, issued by private middle-market companies and, to a lesser extent, senior and subordinated loans issued by public companies and equity investments. Following entry into the New Investment Advisory Agreement, our Investment Adviser intends to reposition our portfolio in the near-term in order to (1) rotate out of a small number of investments that it views as challenged, (2) focus on increasing the size of our core private investments and (3) supplement the portfolio with broadly syndicated and select privately placed loans. We expect that our Investment Adviser will focus on middle-market companies, which we define as companies with enterprise values of between $100 and $750 million. Going forward, we expect our portfolio to include primarily first lien floating rate senior secured financings. We generally invest in securities that are rated below investment grade by rating agencies or that would be rated below investment grade if they were rated. Below investment grade securities, which are often referred to as ""high yield"" and ""junk,"" have predominantly speculative characteristics with respect to the issuer's capacity to pay interest and repay principal. Business Environment and Developments New Investment Advisory Agreement with Oaktree Upon the closing of the Transaction on October 17, 2017, Oaktree became the investment adviser to each of OCSL and us, and Oaktree paid gross cash consideration of $320 million to our Former Adviser. The closing of the Transaction resulted in an assignment for purposes of the 1940 Act of the Former Investment Advisory Agreement and, as a result, its immediate termination. The material terms of the services to be provided under the New Investment Advisory Agreement, other than the fee structure, are substantially the same as the Former Investment Advisory Agreement, except that services are provided by Oaktree. See ""Business-The Investment Adviser"" and ""-New Investment Advisory Agreement."" Hierarchical levels, defined by ASC 820 and directly related to the amount of subjectivity associated with the inputs to fair valuation of these assets and liabilities, are as follow: Level 1 - Unadjusted, quoted prices in active markets for identical assets or liabilities at the measurement date. Level 2 - Observable inputs other than Level 1 prices, such as quoted prices for similar assets or liabilities; quoted prices in markets that are not active; or other inputs that are observable or can be corroborated by observable market data at the measurement date for substantially the full term of the assets or liabilities. Level 3 - Unobservable inputs that reflect management's best estimate of what market participants would use in pricing the asset or liability at the measurement date. Consideration is given to the risk inherent in the valuation technique and the risk inherent in the inputs to the model. If inputs used to measure fair value fall into different levels of the fair value hierarchy, an investment's level is based on the lowest level of input that is significant to the fair value measurement. Our assessment of the significance of a particular input to the fair value measurement in its entirety requires judgment and considers factors specific to the investment. This includes investment securities that are valued using ""bid"" and ""ask"" prices obtained from independent third party pricing services or directly from brokers. These investments may be classified as Level 3 because the quoted prices may be indicative in nature for securities that are in an inactive market, may be for similar securities or may require adjustments for investment-specific factors or restrictions. We estimate the fair value of privately held warrants using a Black Scholes pricing model, which includes an analysis of various factors and subjective assumptions including, the current stock price (by using an EV analysis as described above), the expected period until exercise, expected volatility of the underlying stock price, expected dividends and the risk-free rate. Changes in the subjective input assumptions can materially affect the fair value estimates. Our Board of Directors undertakes a multi-step valuation process each quarter in connection with determining the fair value of our investments: Preliminary valuations are then reviewed and discussed with management of our Investment Adviser; The Investment Adviser compares and contrasts its preliminary valuations to the valuations of the independent valuation firms and prepares a valuation report for the Audit Committee of our Board of Directors; The Audit Committee of our Board of Directors reviews the preliminary valuations with our Investment Adviser, and our Investment Adviser responds and supplements the preliminary valuations to reflect any discussions between our Investment Adviser and the Audit Committee; The Audit Committee of our Board of Directors makes a recommendation to our Board of Directors regarding the fair value of the investments in our portfolio; and Our Board of Directors discusses valuations and determines the fair value of each investment in our portfolio. The fair value of our investments at September 30, 2017 and September 30, 2016 was determined in good faith by our Board of Directors. Our Board of Directors has authorized the engagement of independent valuation firms to provide valuation assistance. We will continue to engage independent valuation firms to provide assistance regarding the determination of the fair value of a portion of our portfolio securities for which market quotations are not readily available or are readily available but deemed not reflective of the fair value of the investment each quarter, and the Board of Directors may reasonably rely on that assistance. The percentage of our portfolio valued by independent valuation firms may vary from period to period based on the availability of market quotations for our portfolio investments during the respective periods. Typically, a higher percentage of our portfolio is valued by independent valuation firms in our fiscal fourth quarter due to additional year-end procedures. However, our Board of Directors is responsible for the ultimate valuation of the portfolio investments at fair value as determined in good faith pursuant to our valuation policy and a consistently applied valuation process. The percentages of our portfolio, at fair value, valued by independent valuation firms as of the end of each period during the current and two preceding fiscal years were as follows: As of December 31, 2014 54.1 % As of March 31, 2015 (1) 32.1 % As of June 30, 2015 23.8 % As of September 30, 2015 (2) 76.5 % As of December 31, 2015 29.3 % As of March 31, 2016 25.0 % As of June 30, 2016 32.0 % As of September 30, 2016 (2) 73.5 % As of December 31, 2016 29.6 % As of March 31, 2017 30.1 % As of June 30, 2017 29.4 %  As of September 30, 2017 and September 30, 2016, approximately 92.1% and 92.2%, respectively, of our total assets represented investments in portfolio companies valued at prices equal to fair value. Portfolio Composition Dec 11, 2017 (c) 1995-2017 Cybernet Data Systems, Inc. All Rights Reserved From MarketWatch Why It Feels Like Facebook Is Listening Through Your Mic More Coverage Why every investor should be terrified by the slide in Home Depot stock Delta flight scare is a reminder never to put electronics in checked baggage Home sellers now use spycams to gather intel on prospective buyers","Dec 11, 2017 6:06 a.m. ET",N/A,10-K: OAKTREE STRATEGIC INCOME CORP,https://www.marketwatch.com/story/10-k-oaktree-strategic-income-corp-2017-12-11
