code,content,date,listening,title,url
ABAX,"BOSTON (MarketWatch) — It’s beginning to look as if it might be time to make a big bet on small-company growth stocks. Yes, the economy is starting to show signs of improvement and, as most investors know, that’s usually a good time to consider overweighting one’s portfolio with stocks likely to benefit the most from an expansion. To be sure, small-company growth stocks are already on the rise. In fact, small company growth stocks are already fifth-best performing fund category among domestic stocks funds this year, rising nearly 12% through Feb. 3, according to Morningstar. INVESTING COMMENTARY IN TRADING DECK Back to 1987 for stocks? Our Trading Deck has been home to a spirited debate over whether we're in for a crash. • L.A. Little: Don't worry | Michael Gayed: Worry • The warning signs of a 1987-style crash • Hulbert: Stocks as overvalued as at 2007 high But analysts say it’s not too late to take advantage of what could be a long-term investment trend. “The macroeconomic trends are going the right way, and generally higher beta stocks, small-company growth stocks, do well when macro-economic conditions improve,” said Janet Yang, a CFA charterholder and analyst with Morningstar. Plus, if you are a reversion-to-the mean investor, this could be a good time to be in small company growth stocks whether or not the economy is expanding. But which growth stocks or funds? According to Yang, there are at least two that carry Morningstar’s gold rating worth considering: The Morgan Stanley Focus Growth fund AMOAX which is a “high-conviction” version of its large-cap sibling, the Morgan Stanley Institutional Growth fund MSEQX, +1.71%  , and the Brown Capital Management Small Company Institutional fund BCSSX, +1.59%  . The Morgan Stanley Focus Growth fund, which is managed by a team led by Dennis Lynch, tends to invest in established brand-name companies with a competitive advantage as well as firms that offer hard-to-replicate products and services, Yang said. For example, many of the top 10 holdings in the $1 billion in assets fund were household names such as Amazon.com AMZN, +1.11% Apple AAPL, +0.78% Google GOOG, +2.71% Mead Johnson Nutrition Co. MJN and Monsanto Co. MON, -0.05%  But the fund also holds some non-household names as well, including Baidu Inc. BIDU, +0.04% Motorola Solutions Inc. MSI, +1.29%  Brookfield Asset Management Inc. BAM, +0.59%  , Intuitive Surgical Inc. ISRG, +2.59%   and Edenred EDNMF, +1.09%  And last but not least, the fund was holding some non-publicly traded securities, including Facebook, Inc. Class B. So far this year, the fund is up more than 11% — about four percentage points better than Russell 1000 Growth index, which tracks large-cap growth stocks, and on par with the Russell 2000 Growth index, the small-cap growth index. A word of caution: Investing in this fund isn’t for everyone. Investing in this fund could be a bit like riding a roller coaster: In 2008, the fund fell 53% and then rose 73% in 2009. Meanwhile, managers of the Brown Capital Management Small Company Growth fund BCSIX, +1.60% which is up more than 12% year-to-date, tend to invest in high quality vs. high-flyer stocks. Plus, the fund’s management team, which is led by Keith Lee, tends to take a long-term view of the stocks they hold, as evidenced by the fund’s low turnover ratio. The category’s average is about 85% while this fund’s turnover ratio is just 7%. According to Yang, the portfolio management team looks for firms with annual revenues of $250 million or less. And that mandate largely points the managers toward micro-cap stocks, according to her report on the fund. To wit: CARBO Ceramics Inc. CRR, -0.28%  Abaxis Inc. ABAX, +2.93% Diodes Inc. DIOD, +0.00%  Balchem Corp. BCPC, +0.57% Gen-Probe Inc. GPRO, -1.03% Blackbaud Inc. BLKB, +3.16% Tyler Technologies Inc. TYL, +2.27% FEI Co. FEIC  and Cognex Corp. CGNX, +2.40% were among the fund’s top 10 holdings as of Dec. 31, 2011. Meanwhile, Kevin W. Gamble, a CFA charterholder who manages a small-cap equity portfolio for the Retirement Systems of Alabama, says it would be wise to exercise “some caution” toward the small-cap growth group, especially after a four-month rally in the equity market. “That being said, the mergers and acquisitions backdrop has never been better for selected small-cap growth stocks in the technology space in particular, as many large-cap technology companies continue to struggle with a lack of organic growth, can borrow easily at historically low levels of interest, have excess cash on their balance sheets and are currently building upon this excess cash every quarter,” said Gamble, who is also immediate past president of the CFA Society of Alabama. “Many are hesitant to admit they are mature companies and thus don’t want to pay out a higher level of dividend yield, so the logical conclusion is that mergers and acquisitions will pick up in a big way as we move through 2012.” According to Gamble many potential targets include Taleo Corp. TLEO  , Sourcefire Inc. FIRE, +4.76% Fortinet Inc. FTNT, +2.49%  SolarWinds Inc. SWI, +0.24% Quest Software Inc. QSFT TIBCO Software Inc. TIBX MicroStrategy Inc. MSTR, +1.01% Qlik Technologies Inc. QLIK  , Constant Contact Inc. CTCT and Informatica Corp. INFA, -1.85%  . “We see a basket of these small-cap technology acquisition targets as having a positive risk/reward from current levels given the potential reward to shareholders from a pickup in acquisition activity,” Gamble said. Others agree that it’s too soon to bet big on small caps, but they do note that there are pockets of opportunity. For the American auto industry, we are seeing increased unit volumes which would benefit the OEMs, but on the small-cap side should also help the suppliers,” said Jeff Tryka, a CFA charterholder and director of financial communications with Lambert, Edwards & Associates. One company being American Axle AXL, +2.63%   “Similarly, with increased new model introductions and renewed focus on quality, small companies such as Perceptron Inc. PRCP, +2.82% stand to benefit from line changes and new production technology,” he said. In banking, Tryka said there are many small cap community banks, such as Mercantile Bank Corp. MBWM, -2.49%  that have spent several years working to remake their businesses with renewed focus on community lending that would stand to benefit from a revitalization of consumers in a growing recovery. Tryka also said retail apparel and footwear companies such as Wolverine Worldwide Inc. WWW, +0.10%  may benefit from improving demand as consumers turn more bullish and begin to open their wallets. Of course, there are those who have an entirely different view of whether to invest in small-cap growth stocks now. “We are encouraged by clear improvement in the U.S. economy and by small business lending growth, which we believe will benefit small cap growth stocks,” said Matthew Harrison, a CFA charterholder, certified investment management analyst, and chief investment officer of RMH Investment Management in Tucson. “However, we believe structural headwinds to economic growth remain, including no longer declining interest rates, higher tax rates and demographic headwinds — or, in other words, deleveraging and addressing the U.S. budget.” In addition, Harrison expressed concern about possible exogenous event risk, specifically, in Israel and Iran. “Weighing these factors, we are not adding to small-cap growth stocks at this stage and find more comfort in blue chip U.S., large-cap developed international and emerging market equities — all of which, we see as relatively attractive today.” That may be true. But it still might be worth going from underweight to overweight on small cap stocks — if the economy is truly expanding and if as Gamble said, M&As are on the horizon. Robert Powell is editor of Retirement Weekly, published by MarketWatch. Learn more about Retirement Weekly here.Follow his tweets here. More from MarketWatch How to Run a Better Meeting: Advice From Extremely Successful People More Coverage My husband sold his grandmother’s house and paid off our mortgage — now his family is threatening to sue Damn the torpedoes — what could take the S&P 500 to 3,000 This emerging-market ETF continues to blow away the competition SMARTASSET.COM","Feb 8, 2012 12:01 a.m. ET",1,Ready to bet on small-company growth stocks?,https://www.marketwatch.com/story/ready-to-bet-on-small-company-growth-stocks-2012-02-08
ABAX,"NEW YORK (MarketWatch) -- Shares of the following companies made notable moves in the U.S. stock market Friday: Advancers Abaxis Inc. ABAX, +2.93% shares jumped 9.6%. The Union City, Calif., producer of portable blood-analysis systems reported second-quarter net income fell to 16 cents a share from 17 cents. Revenue rose 18% to $35 million. Alcatel-Lucent SA ALU, +1.21% U.S. shares were up 14.6% after the French telecommunications-equipment maker affirmed its 2010 operating-margin target. Conversely, Tellabs Inc. TLAB shares declined 5.7% after J.P. Morgan Chase & Co. said a deal between Alcatel-Lucent and AT&T Inc. T, +0.25% could have a ""material impact"" on Tellabs. MARKETS | • The Tell: Market news and analysis • | Canada section • Columns: Stocks | Oil | Gold | Bonds | Dollar  TOOLS AND DATA | • My Portfolio: Know where your funds are? • Real-time currency exchange rates • After-hours stock screener Alliance Healthcare Services Inc. AIQ, +242.47% shares rose more than 17%. The provider of medical imaging services reported quarterly results in line with expectations late Wednesday. Shares of AIQ have decreased 34% in the last 90 days, said Wells Fargo analysts in a note Friday, attributing the loss to investor beliefs that investment management firm Oaktree Capital Management, which owns just less than half of Alliance, will not purchase the remaining stake it does not own. Amerigroup Corp. AGP rose 8.5% after it said premarket Friday that second-quarter net profit rose to $67.2 million, or $1.31 a share, from $49.6 million, or 94 cents a share in the year-ago period. Analysts had been expecting earnings of 61 cents a share, according to data compiled by FactSet. Atlas Pipeline Holdings AHD, -1.33% shares gained 9.6%. Bunge Ltd. BG, +1.20% rose more than 7% after shares plunged following the company's announcement Thursday that second-quarter net income rose on flat sales. Chiquita Brands International Inc. CQB, +31.42% was up 11%. The food company said late Thursday that quarterly income rose to $95 million, or $2.06 a share, from $89 million, or $1.95 a share, a year ago. Adjusted earnings were $64 million, or $1.40 a share, compared to $95 million, or $2.08 a year ago. BB&T Capital analysts reiterated a buy rating, citing the company's cost-saving strategies and maintenance of margins despite lower volumes and increased marketing expenses. Community Health Systems Inc. CYH, -3.65% rose 7.7%. Shares fell in the last session after the company said late Wednesday rose to $70 million, or 74 cents a share, from $59 million, or 65 cents a share, a year ago. DDI Corp. DDIC shares gained 7% after the provider of electronics-design and production services lifted its forecast for full-year sales. Domtar Corp. UFS, +1.47% was up 9% after it said Friday quarterly earnings were $31 million, or 71 cents a share, compared to $58 million, or $1.34 a share a year ago. Duff & Phelps Corp. DUF rose 5%. Shares had fallen in the previous session after the financial services firm said premarket Thursday that earnings rose to $2.5 million, or 9 cents a share, from $1.7 million, or 9 cents a share, for the same period last year. Expedia Inc. EXPE, +3.85% shares climbed 7.6% after the online travel company reported a larger-than-expected quarterly profit late Thursday. Geron Corp. GERN, +0.47% shares moved up more than 17% after the biopharmaceutical developer said U.S. regulators cleared a phase 1 clinical trial of embryonic stem-cell therapy. Read Biotech Stocks for more on Geron, Merck. Keithley Instruments Inc. KEI, +5.91% rose 7.3% after the electronic instruments and systems company said after the bell Thursday that it swung to a quarterly profit. Net income was $5.6 million, or 34 cents a share, compared to a loss of $3.4 million, or 22 cents a share, a year ago. Lithia Motors Inc. LAD, +1.41% gained 11%. The automotive retailer said late Thursday that it swung to a quarterly loss compared to last year. Net loss was $1.7 million, from a profit of $3.6 million the same period a year ago. But adjusted earnings were 27 cents a share compared to 22 cents a share, which includes 4.9 million additional shares in 2010 compared to 2009. Macatawa Bank Corp. MCBC, -1.44% shares leapt almost 19%. The Holland, Mich., holding company, with $1.65 billion of assets, swung to net income of 10 cents a share from a loss of $1.82 a share in the year-earlier period. MARKETS | • The Tell: Market news and analysis • | Canada section • Columns: Stocks | Oil | Gold | Bonds | Dollar  TOOLS AND DATA | • My Portfolio: Know where your funds are? • Real-time currency exchange rates • After-hours stock screener McAfee Inc. MFE, +0.60% shares climbed 9.4% after the computer-security software maker reported a better second quarter than analysts expected late Thursday. Orexigen Therapeutics Inc. OREX, +1.90% shares gained 9.5% after the biopharmaceutical company reported positive results from a trial of its weight-loss drug. Power-One Inc. PWER shares climbed almost 25% after the company posted better-than-expected second-quarter results. Semiconductor Manufacturing International Corp. (SMI) rose 9.4%. Tenneco Inc. TEN, +2.91% shares rose more than 6%. Fitch lifted the issuer-default rating on the auto-parts producer and said its outlook is stable. Tennant Company TNC, -0.22% rose 7.5% after it said Thursday morning that earnings doubled to $6.2 million, or 32 cents a share, compared to $3 million, or 16 cents a share a year ago. Trident Microsystems Inc. TRID shares rose 21% after the producer of semiconductor systems narrowed its second-quarter net loss. Read more coverage on tech stocks. Decliners Acme Packet Inc. APKT shares gave up almost % after the maker of devices used to send video reported second-quarter net income reached 14 cents a share from 3 cents in the year-earlier period. Analysts surveyed by FactSet Research were expecting profit of 17 cents a share. AMN Healthcare Inc. AHS, -9.09% fell 7.2%. Shares had declined in the previous session after the healthcare workforce provider said late Wednesday that quarterly income fell to $137,000, or no cents a share, from $3.5 million, or 13 cents a share, a year ago. Belo Corp. BLC, +0.00% lost 7.4% after the television company said Friday that quarterly earnings rose to $19.5 million, or 19 cents a share, from $10.3 million, or 10 cents a share, a year ago. BioScrip Inc. BIOS, -2.77% shares dropped 32% after the provider of specialty pharmacy and home-care products estimated that 2010 revenue will come in at the lower end of its expected range. Coinstar Inc. CSTR, +0.00% shares lost 6.6% after the company offered a third-quarter forecast that missed projections. Conexant Systems Inc. CNXT, +2.41% shares fell 5.4% after the maker of chips used in smartphones forecast a fourth-quarter profit that missed expectations. First Solar Inc. FSLR, +2.39% shares fell 7.4% after the solar-panel maker reported lower second-quarter profit. Federal Signal Corp. FSS, +1.33% lost 13.5% after the company said its quarterly net loss fell to $400,000, or 1 cent a share, from a loss of $4.9 million, or 10 cents a share, the same period a year ago, while net sales were flat. Genworth Financial Inc. GNW, +1.07% shares fell 14% after published reports said the insurer was being subpoenaed by New York Attorney General Andrew Cuomo as part of a state probe into life-insurance fraud. Read Financial Stocks for more on Genworth. Goodyear Tire & Rubber Co. GT, +0.83% dropped 5.3%. Shares had dropped in the previous session after the tire maker said before the bell Thursday that it swung to a quarterly profit, with net income of $28 million, or 11 cents a share, compared to a loss of $221 million, or 92 cents a share, a year ago. Intermec Inc. IN, +6.11% fell 6% after the supply chain manager said late Thursday it narrowed its quarterly loss to $2.7 million, or 4 cents a share, from $6.5 million, or 11 cents a share, the same period a year ago. ITT Corp. ITT, +2.13% shares declined 5.6% after maker of night-vision goggles for the military trimmed its 2010 sales forecast. Kyocera Corp. KYO, +1.01% lost almost 6% after the Japanese ceramic company said it swung to a profit with quarterly earnings of $340 million, or $1.85 a share. Louisiana-Pacific Corp. LPX, +1.27% traded down 9% after the building material supplier said Friday that it swung to a profit of $22 million, or 16 cents a share. Last year the company had a net loss of $29 million, or 28 cents a share. Total sales for the quarter were up 67% to $447 million compared to a year ago. MEMC Electronic Materials Inc. WFR dropped more than 15% after the maker of wafers used in solar modules reported second-quarter profit below analysts' estimates. TeleNav Inc. TNAV, +3.85% shares slumped 39% after the supplier of mobile navigation services disclosed contract negotiations with its largest customer, Sprint Nextel Corp. S, +0.41% Read more on TeleNav. Thoratec Corp. THOR shares declined 13.5% after the maker of cardiac devices forecast 2010 revenue that came in short of expectations. Volcom Inc. VLCM shares fell 15.5% after the skateboard-clothing maker reported second-quarter results that missed analysts' estimates. More from MarketWatch How Russian Trolls Collected Americans' Personal Information More Coverage Don’t ever do this with your credit card BlackRock fund manager sees this as the market’s ‘sweet spot’ Home sellers now use spycams to gather intel on prospective buyers Related Topics U.S. Stocks Markets Investing","July 30, 2010 5:01 p.m. ET",1,Friday's biggest gaining and declining stocks,https://www.marketwatch.com/story/fridays-biggest-gaining-and-declining-stocks-2010-07-30
ABAX,"When the stock market emerges from a downturn, the small caps generally lead the way. But while the small stocks have done well for themselves in the past several months, Sam Dedio, the portfolio manager at the Artio U.S. Smallcap Fund, says they are still on the verge. ""We haven't jumped in with both feet across the nation yet,"" says Dedio. ""When that happens, that's when the full-blown recovery has been stamped."" 0:06:41","Oct 28, 2009 2:16 p.m. ET",1,Dedio: Small caps poised for take-off,https://www.marketwatch.com/story/dedio-small-caps-poised-for-take-off-2009-10-28
ABAX,"Free Preview For full access, Log in or Subscribe Now and get 4 weeks free! Wednesday's analysis CINCINNATI (MarketWatch) - Tuesday's sell-off wasn't completely spectacular, but it satisfied the customary bearish milestones. Perhaps most notably, the Dow industrials and the S&P 500 both notched their second-worst closes since the market crash driven by 22-to-1 negative market breadth. To continue reading, please subscribe. Already a Subscriber? Log in Subscribe Now AND GET 4 WEEKS FREE Actionable trading strategies Easy-to-follow guidance Weekly market navigational tool More from MarketWatch Why It Feels Like Facebook Is Listening Through Your Mic More Coverage Stephen Hawking’s final Reddit post is going viral over its ominous warning about robots My husband sold his grandmother’s house and paid off our mortgage — now his family is threatening to sue S&P 500 logs longest losing streak of the year as trade-war jitters weigh Related Topics Investing U.S. Stocks Mutual Funds Exchange Traded Funds Options Center Bonds","Feb 18, 2009 9:25 a.m. ET",N/A,"S&P, Dow notch second-worst close since market crash",https://www.marketwatch.com/story/sp-dow-notch-second-worst-close
ABAX,"SAN FRANCISCO (MarketWatch) -- Shares of MBIA Inc. fell Monday evening after the bond insurer said that it will eliminate quarterly dividends in a move to preserve capital, while shares of Nordstrom Inc. recovered from earlier losses. MBIA MBI, +0.11% shares were off 1.9% at $14.30 in recent action. The company said that it will stop paying quarterly dividends, which will save it about $174 million a year. ""MBIA will continue to take reasonable and prudent actions such as this dividend elimination in an effort to retain and strengthen our AAA ratings,"" said Chief Executive Jay Brown said in a statement. Regular-session shares of MBIA jumped 16% after Standard & Poor's affirmed its AAA rating on the company, saying it has assessed MBIA's plan to raise new capital from a group of banks. The rating remains on CreditWatch with negative implications. See full story. Late-traded shares of Ambac ABK, +0.00% were off 1.6% at $12.23. Chipmaker Xilinx Inc. XLNX, +1.25% meanwhile, said that it raised its quarterly dividend to 14 cents from 12 cents and that its board approved an additional $800 million for the share-repurchase plan. Shares eased back from earlier gains, down 0.5% to $22.12. Nordstrom JWN, +1.06% shares were up 0.2% at $37.04, reversing earlier losses after the low end of the department-store operator's yearly profit view came in below Wall Street's outlook. The company forecast 2008 earnings of $2.75 a share to $2.90 a share. Analysts polled by FactSet were looking for earnings of $2.81 a share. Citing a ""challenging"" consumer and retail environment, Nordstrom said that fourth-quarter sales fell 4.4% to $2.5 billion. Analysts had expected revenue of $2.55 billion. Profit was $212 million, or 92 cents a share, compared with $232 million or 89 cents a share a year earlier. Analysts were looking for 90 cents a share. Shares of Abaxis Inc. ABAX, +2.93% cracked Nasdaq's list of top volume movers as the medical-products company enters the S&P SmallCap 600 Index. They were down 0.1% at $30.36. Abaxis is replacing Alabama National Bancorp., which was acquired by RBC Centura Banks, a subsidiary of Royal Bank of Canada RY, +1.27% More from MarketWatch Samsung Galaxy S9: Putting the Camera to the Test More Coverage 2 sexy ways to get paid to save Home sellers now use spycams to gather intel on prospective buyers Delta flight scare is a reminder never to put electronics in checked baggage Related Topics U.S. Stocks Markets NY Stock Exchange NASDAQ","Feb 25, 2008 6:17 p.m. ET",1,MBIA shares lower after dividend plan; Xilinx slips,https://www.marketwatch.com/story/mbia-shares-lower-after-dividend-plan-xilinx-slips
ABAX,"SAN FRANCISCO (MarketWatch) -- Stock in Nordstrom Inc. slipped Monday evening after the low end of the department store operator's yearly profit view came in below Wall Street's outlook. Nordstrom JWN, +1.06% was down 0.8% at $36.70. The company forecast 2008 earnings of $2.75 a share to $2.90 a share. Analysts polled by FactSet were looking for earnings of $2.81 a share. The company, citing a ""challenging"" consumer and retail environment, said its fourth-quarter sales fell 4.4% to $2.5 billion. Analysts had expected revenue of $2.55 billion. Profit was $212 million, or 92 cents a share, compared with $232 million, or 89 cents a share, a year earlier. Analysts were looking for 90 cents a share. Shares of Abaxis Inc. ABAX, +2.93% cracked Nasdaq's list of top volume movers as the medical products company enters the Standard & Poor's SmallCap 600 Index. They were down 0.6% at $30.21. Abaxis is replacing Alabama National Bancorp., which was acquired by RBC Centura Banks, a subsidiary of Royal Bank of Canada RY, +1.27% More from MarketWatch How Russian Trolls Collected Americans' Personal Information More Coverage Damn the torpedoes — what could take the S&P 500 to 3,000 What America’s gun fanatics won’t tell you My husband sold his grandmother’s house and paid off our mortgage — now his family is threatening to sue Related Topics U.S. Stocks Markets NY Stock Exchange NASDAQ","Feb 25, 2008 4:42 p.m. ET",1,Nordstrom loses ground after outlook; Abaxis on the move,https://www.marketwatch.com/story/nordstrom-loses-ground-after-outlook-abaxis-on-the-move
