code,content,date,listening,title,url
OBSV,"AbbVie Inc. ABBV, -2.19% and Neurocrine Biosciences Inc. NBIX, -6.13% shares rose 1.7% and 1.1% respectively in premarket trade Wednesday after the companies announced that their drug met its primary endpoint in a phase 3 trial testing it in women with uterine fibroids. The therapy, elagolix, combined with low-dose hormone therapy reduced heavy menstrual bleeding in 68.5% of women, compared with 8.7% of women on the placebo. The phase 3 trial, ELARIS UF-I, is the first of two late-stage studies, and the Wednesday release was based on topline results from a six-month primary analysis. Uterine fibroids affect an estimated 7.5 million U.S. women, and consist of growths in the uterus that can cause heavy bleeding, pain and bladder problems. Other companies are also developing drugs in this area, includingMyovant MYOV, -5.67% Allergan AGN, -1.72% and the biotech ObsEva OBSV, -2.26% AbbVie and Neurocrine's elagolix is also being developed for endometriosis with associated pain, and is being reviewed by the Food and Drug Administration for that indication. AbbVie shares have surged 24.6% over the last three months, and Neurocrine shares have surged 14%, compared with a 4.5% rise in the S&P 500 SPX, -1.19%","Feb 21, 2018 8:34 a.m. ET",1,"AbbVie, Neurocrine shares rise after positive results for uterine fibroids drug",https://www.marketwatch.com/story/abbvie-neurocrine-shares-rise-after-positive-results-for-uterine-fibroids-drug-2018-02-21-8913419
OBSV,"If successful, a new drug from the biotech Myovant Sciences Ltd. could treat two women’s health disorders, as well as prostate cancer. The drug, Relugolix, works to reduce estrogen in women and testosterone in men. The hormones are factors in two painful conditions affecting women, uterine fibroids and endometriosis, and in prostate cancer. Treating those conditions with a hormone-blocking medication is not completely new — AbbVie Inc.’s ABBV, -2.16% Lupron Depot, for example, already does it. But that drug has to be injected, has safety issues and is not supposed to be used in the long term, said Leerink Partners analyst Jason Gerberry. The uterine fibroids and endometriosis markets are “both large, but there are no effective, well tolerated oral therapies” for them, he said. Myovant’s MYOV, -5.67%  drug, which is taken orally once a day, has a different mechanism than Lupron Depot, which the company said allows it to work faster and better than competitors. And when it comes to uterine fibroids and endometriosis, Relugolix also aims to curb side effects like hot flashes and bone loss by incorporating low-dose hormone replacement in the medication. (Lupron is taken with a separate add-back therapy.) In prostate cancer, the drug lacks that aspect and comes in a higher dose, working to suppress the testosterone that drives the disease. Related: Cancer vaccines, long considered failures, are hot again Relugolix is currently in late-stage clinical trials, with results expected in 2019. The drug had positive results in a late-stage clinical trial for uterine fibroids done by Takeda Pharmaceutical Co. Ltd. 4502, -1.52%  and released in October; Takeda is releasing results from another late-stage trial in pain by the end of the year. Myovant was formed last year by privately held Roivant Sciences Ltd. and Takeda, which licensed Relugolix to the biotech. Chief Executive Lynn Seely, a rare female CEO in biotech, told MarketWatch that her goal is to make the company a global leader in women’s health. An endocrinologist who worked in academia early in her career, Seely led the development of prostate cancer drug Xtandi at Medivation (the drug is now owned by Pfizer Inc. PFE, +0.30% ). When she took Myovant public, Seely recalled speaking “to rooms and rooms of male investors.” Uterine fibroids and endometriosis, which affect an estimated 7.5 million and 19 million U.S. women respectively, are “hugely common, but nobody is talking about them,” Seely told MarketWatch. In these disease areas, “the lack of development is shocking.” Myovant Myovant Chief Executive Lynn Seely said her goal is to make the company a global leader in women’s health. The two are different diseases, but both typically affect pre-menopausal women and are driven by estrogen, Seely said. In individuals with endometriosis, tissue that is supposed to grow inside the uterus grows elsewhere. When tissue sheds during the menstrual cycle, it is unable to exit the body, causing irritation and pain. Uterine fibroids are growths in the uterus that can cause pain, heavy bleeding and bladder problems. Myovant Myovant’s Relugolix works to reduce estrogen in women and testosterone in men. The hormones drive uterine fibroids and endometriosis in women and prostate cancer in men, the company said. Besides Lupron Depot, the only other medications for the diseases are oral contraceptives and pain medications, but none work particularly well as a long-term option. See: This is what happens when women can’t afford birth control and Trump’s new rule marks end of affordable birth control — this is how much the Obama-era rule saved American women That may be changing. On Tuesday, Allergan PLC AGN, -1.68%  said that the Food and Drug Administration is considering its drug for uterine fibroid-related bleeding, with an approval decision expected in the first half of 2018. AbbVie Inc. ABBV, -2.16%  submitted an application with the FDA last month for its drug with Neurocrine Biosciences Inc. NBIX, -6.14%  that is intended to manage endometriosis with associated pain. Read: AbbVie expects to bring endometriosis drug to FDA in 2017 And the biotech ObsEva OBSV, -2.26%  is also developing a treatment for uterine fibroids and endometriosis, though the medication may only be available at the end of 2021. Though ObsEva’s OBE2109 is behind competitors, Leerink’s Gerberry said he’s hopeful that the drug will distinguish itself. 3D-Printed Hair System Helps Cancer Survivor Move On “While the competitive pipeline of treatments in development for [uterine fibroids/endometriosis] is deep, we believe OBE2109 may possess the best in class profile,” he said earlier this year. But Seely said she’s confident in Relugolix, and that having options for women is “tremendous.” To her, success means “women have the option to take our pill instead of undergoing invasive procedures” and dealing with painful symptoms, she said. “The goal is she feels well enough to go about her daily business.” Myovant shares have surged 35.2% over the last three months, compared with a 5.2% rise in the S&P 500 SPX, -1.15% More from MarketWatch Don’t ever do this with your credit card S&P 500 logs longest losing streak of the year as trade-war jitters weigh Trump boasts about making up facts about trade deficit to Trudeau","Oct 16, 2017 7:39 a.m. ET",4,This drug may be able to treat both women’s health disorders and prostate cancer,https://www.marketwatch.com/story/this-drug-may-have-a-shot-at-both-womens-health-disorders-and-prostate-cancer-2017-10-11
OBSV,"NEW YORK, Mar 28, 2018 (GLOBE NEWSWIRE via COMTEX) -- In new independent research reports released early this morning, Fundamental Markets released its latest key findings for all current investors, traders, and shareholders of Fortress Transportation and Infrastructure Investors LLC FTAI, -0.19% Turquoise Hill Resources Ltd. TRQ, -2.44% FactSet Research Systems Inc. FDS, -1.63% Shaw Communications Inc. SJR, -0.35% El Pollo Loco Holdings, Inc. LOCO, +1.05% and ObsEva SA OBSV, -2.26% including updated fundamental summaries, consolidated fiscal reporting, and fully-qualified certified analyst research. Complimentary Access: Research Reports Full copies of recently published reports are available to readers at the links below. FTAI DOWNLOAD: http://Fundamental-Markets.com/register/?so=FTAI TRQ DOWNLOAD: http://Fundamental-Markets.com/register/?so=TRQ FDS DOWNLOAD: http://Fundamental-Markets.com/register/?so=FDS SJR DOWNLOAD: http://Fundamental-Markets.com/register/?so=SJR LOCO DOWNLOAD: http://Fundamental-Markets.com/register/?so=LOCO OBSV DOWNLOAD: http://Fundamental-Markets.com/register/?so=OBSV (You may have to copy and paste the link into your browser and hit the [ENTER] key) The new research reports from Fundamental Markets, available for free download at the links above, examine Fortress Transportation and Infrastructure Investors LLC FTAI, -0.19% Turquoise Hill Resources Ltd. TRQ, -2.44% FactSet Research Systems Inc. FDS, -1.63% Shaw Communications Inc. SJR, -0.35% El Pollo Loco Holdings, Inc. LOCO, +1.05% and ObsEva SA OBSV, -2.26% on a fundamental level and outlines the overall demand for their products and services in addition to an in-depth review of the business strategy, management discussion, and overall direction going forward. Several excerpts from the recently released reports are available to today's readers below. ----------------------------------------- Important Notice: the following excerpts are not designed to be standalone summaries and as such, important information may be missing from these samples. Please download the entire research report, free of charge, to ensure you are reading all relevant material information. All information in this release was accessed March 26th, 2018. Percentage calculations are performed after rounding. All amounts in millions (MM), except per share amounts. ----------------------------------------- FORTRESS TRANSPORTATION AND INFRASTRUCTURE INVESTORS LLC (FTAI) REPORT OVERVIEW Fortress Transportation and Infrastructure Investors' Recent Financial Performance For the three months ended December 31st, 2017 vs December 31st, 2016, Fortress Transportation and Infrastructure Investors reported revenue of $61.43MM vs $42.35MM (up 45.07%) and basic earnings per share $0.04 vs -$0.01. For the twelve months ended December 31st, 2017 vs December 31st, 2016, Fortress Transportation and Infrastructure Investors reported revenue of $217.66MM vs $148.72MM (up 46.35%) and basic earnings per share $0.00 vs -$0.26. Fortress Transportation and Infrastructure Investors is expected to report earnings on May 3rd, 2018. The report will be for the fiscal period ending March 31st, 2018. The reported EPS for the same quarter last year was $0.00. The estimated EPS forecast for the next fiscal year is $0.82 and is expected to report on February 27th, 2019. To read the full Fortress Transportation and Infrastructure Investors LLC (FTAI) report, download it here: http://Fundamental-Markets.com/register/?so=FTAI ----------------------------------------- TURQUOISE HILL RESOURCES LTD. (TRQ) REPORT OVERVIEW Turquoise Hill Resources' Recent Financial Performance For the three months ended December 31st, 2017 vs December 31st, 2016, Turquoise Hill Resources reported revenue of $251.70MM vs $224.54MM (up 12.10%) and basic earnings per share $0.03 vs $0.05 (down 40.00%). For the twelve months ended December 31st, 2017 vs December 31st, 2016, Turquoise Hill Resources reported revenue of $939.78MM vs $1,203.28MM (down 21.90%) and basic earnings per share $0.09 vs $0.10 (down 10.00%). Turquoise Hill Resources is expected to report earnings on May 21st, 2018. The report will be for the fiscal period ending March 31st, 2018. To read the full Turquoise Hill Resources Ltd. (TRQ) report, download it here: http://Fundamental-Markets.com/register/?so=TRQ ----------------------------------------- FACTSET RESEARCH SYSTEMS INC. (FDS) REPORT OVERVIEW FactSet Research's Recent Financial Performance For the three months ended November 30th, 2017 vs November 30th, 2016, FactSet Research reported revenue of $329.14MM vs $288.06MM (up 14.26%) and basic earnings per share $1.80 vs $1.67 (up 7.78%). For the twelve months ended August 31st, 2017 vs August 31st, 2016, FactSet Research reported revenue of $1,221.18MM vs $1,127.09MM (up 8.35%) and basic earnings per share $6.55 vs $8.29 (down 20.99%). The estimated EPS forecast for the next fiscal year is $9.20 and is expected to report on September 25th, 2018. To read the full FactSet Research Systems Inc. (FDS) report, download it here: http://Fundamental-Markets.com/register/?so=FDS ----------------------------------------- SHAW COMMUNICATIONS INC. (SJR) REPORT OVERVIEW Shaw Communications' Recent Financial Performance For the three months ended November 30th, 2017 vs November 30th, 2016, Shaw Communications reported revenue of $995.83MM vs $994.60MM (up 0.12%) and basic earnings per share $0.18 vs $0.14 (up 28.59%). For the twelve months ended August 31st, 2017 vs August 31st, 2016, Shaw Communications reported revenue of $3,698.12MM vs $3,684.49MM (up 0.37%) and basic earnings per share $1.30 vs $1.89 (down 31.21%). Shaw Communications is expected to report earnings on April 12th, 2018. The report will be for the fiscal period ending February 28th, 2018. The reported EPS for the same quarter last year was $0.23. The estimated EPS forecast for the next fiscal year is $1.08 and is expected to report on October 25th, 2018. To read the full Shaw Communications Inc. (SJR) report, download it here: http://Fundamental-Markets.com/register/?so=SJR ----------------------------------------- EL POLLO LOCO HOLDINGS, INC. (LOCO) REPORT OVERVIEW El Pollo Loco's Recent Financial Performance For the three months ended December 31st, 2017 vs December 31st, 2016, El Pollo Loco reported revenue of $95.20MM vs $92.48MM (up 2.94%) and basic earnings per share $0.00 vs $0.01. For the twelve months ended December 31st, 2017 vs December 31st, 2016, El Pollo Loco reported revenue of $401.70MM vs $380.12MM (up 5.68%) and basic earnings per share $0.22 vs $0.48 (down 54.17%). El Pollo Loco is expected to report earnings on May 3rd, 2018. The report will be for the fiscal period ending March 31st, 2018. The reported EPS for the same quarter last year was $0.16. The estimated EPS forecast for the next fiscal year is $0.72 and is expected to report on March 14th, 2019. To read the full El Pollo Loco Holdings, Inc. (LOCO) report, download it here: http://Fundamental-Markets.com/register/?so=LOCO ----------------------------------------- OBSEVA SA (OBSV) REPORT OVERVIEW ObsEva SA's Recent Financial Performance ObsEva SA is expected to report earnings on May 17th, 2018. The report will be for the fiscal period ending March 31st, 2018. The reported EPS for the same quarter last year was -$0.58. The estimated EPS forecast for the next fiscal year is -$1.99 and is expected to report on March 8th, 2019. To read the full ObsEva SA (OBSV) report, download it here: http://Fundamental-Markets.com/register/?so=OBSV ----------------------------------------- ABOUT FUNDAMENTAL MARKETS Fundamental Markets serves thousands of members and have provided research through some of the world's leading brokerages for over a decade-and continue to be one of the best information sources for investors and investment professionals worldwide. Fundamental Markets' roster boasts decades of financial experience and includes top financial writers, FINRA(R) BrokerCheck(R) certified professionals with current and valid CRD(R) number designations, as well as Chartered Financial Analyst(R) (CFA(R)) designation holders, to ensure up to date factual information for active readers on the topics they care about. REGISTERED MEMBER STATUS Fundamental Markets' oversight and audit staff are registered analysts, brokers, and/or financial advisers (""Registered Members"") working within Equity Research, Media, and Compliance departments. Fundamental Markets' roster includes qualified CFA(R) charterholders, licensed securities attorneys, and registered FINRA(R) members holding duly issued CRD(R) numbers. Current licensed status of several Registered Members at Fundamental Markets have been independently verified by an outside audit firm, including policy and audit records duly executed by Registered Members. Complaints, concerns, questions, or inquiries regarding this release should be directed to Fundamental Markets' Compliance department by Phone, at +1 667-401-0010, or by E-mail at compliance@Fundamental-Markets.com. LEGAL NOTICES Information contained herein is not an offer or solicitation to buy, hold, or sell any security. Fundamental Markets, Fundamental Markets members, and/or Fundamental Markets affiliates are not responsible for any gains or losses that result from the opinions expressed. Fundamental Markets makes no representations as to the completeness, accuracy, or timeliness of the material provided and all materials are subject to change without notice. Fundamental Markets has not been compensated for the publication of this press release by any of the above mentioned companies. Fundamental Markets is not a financial advisory firm, investment adviser, or broker-dealer, and does not undertake any activities that would require such registration. For our full disclaimer, disclosure, and terms of service please visit our website. Media Contact: Andrew Duffie, Media Department Office: +1 667-401-0010 E-mail: media@Fundamental-Markets.com � 2018 Fundamental Markets. All Rights Reserved. For republishing permissions, please contact a partner network manager at partnership@Fundamental-Markets.com. CFA(R) and Chartered Financial Analyst(R) are registered trademarks owned by CFA Institute. FINRA(R), BrokerCheck(R), and CRD(R) are registered trademarks owned by Financial Industry Regulatory Authority, Inc. Copyright (C) 2018 GlobeNewswire, Inc. All rights reserved. From MarketWatch Samsung Galaxy S9: Putting the Camera to the Test More Coverage My husband sold his grandmother’s house and paid off our mortgage — now his family is threatening to sue Delta flight scare is a reminder never to put electronics in checked baggage Home sellers now use spycams to gather intel on prospective buyers","Mar 28, 2018 7:55 a.m. ET",N/A,"Analysis: Positioning to Benefit within Fortress Transportation and Infrastructure Investors, Turquoise Hill Resources, FactSet Research, Shaw Communications, El Pollo Loco, and ObsEva SA -- Research Highlights Growth, Revenue, and Consolidated Results",https://www.marketwatch.com/story/analysis-positioning-to-benefit-within-fortress-transportation-and-infrastructure-investors-turquoise-hill-resources-factset-research-shaw-communications-el-pollo-loco-and-obseva-sa----research-highlights-growth-revenue-and-consolidated-results-2018-03-28
OBSV,"(GLOBE NEWSWIRE via COMTEX) -- ObsEva SA / ObsEva SA to Participate in the H.C. Wainwright Annual Global Life Sciences Conference April 8-10, 2018 . Processed and transmitted by Nasdaq Corporate Solutions. The issuer is solely responsible for the content of this announcement. Geneva, Switzerland and Boston, MA - March 26, 2018 - ObsEva SA OBSV, -2.26% a clinical-stage biopharmaceutical company focused on the development and commercialization of novel therapeutics for serious conditions that compromise a woman's reproductive health and pregnancy, today announced that company management will participate in the H.C. Wainwright Annual Global Life Sciences Conference from April 8-10, 2018 in Monaco. ObsEva's presentation will take place on Tuesday, April 10 at 10:40 AM Central European Time. A webcast will be available in the ""Investors"" section of ObsEva's website www.ObsEva.com. If you are an institutional investor, and would like to attend the Company's presentation, please click on the following link (www.hcwevents.com) to register for the conference. About ObsEva ObsEva is a clinical-stage biopharmaceutical company focused on the clinical development and commercialization of novel therapeutics for serious conditions that compromise a woman's reproductive health and pregnancy. Through strategic in-licensing and disciplined drug development, ObsEva has established a late-stage clinical pipeline with development programs focused on treating endometriosis, uterine fibroids, preterm labor and improving IVF outcomes. ObsEva is listed on The NASDAQ Global Select Market and is trading under the ticker symbol ""OBSV"". For more information, please visit www.ObsEva.com. ### Media Contact: Liz Bryan Spectrum Science lbryan@spectrumscience.com 202-955-6222 x2526 CEO Office Contact: Shauna Dillon Shauna.dillon@obseva.ch +41 22 552 1550 Investor Contact: Mario Corso Senior Director, Investor Relations mario.corso@obseva.com 857-972-9347 office 781-366-5726 mobile This announcement is distributed by Nasdaq Corporate Solutions on behalf of Nasdaq Corporate Solutions clients. The issuer of this announcement warrants that they are solely responsible for the content, accuracy and originality of the information contained therein. Source: ObsEva SA via Globenewswire Press release - http://hugin.info/157613/R/2178584/840830.pdf Copyright (C) 2018 GLOBE NEWSWIRE. All rights reserved. From MarketWatch Uber for Bikes Could Save Your Commute More Coverage S&P 500 logs longest losing streak of the year as trade-war jitters weigh My husband sold his grandmother’s house and paid off our mortgage — now his family is threatening to sue Jobless claims drop 4,000 to 226,000","Mar 26, 2018 7:00 a.m. ET",N/A,"ObsEva SA to Participate in the H.C. Wainwright Annual Global Life Sciences Conference April 8-10, 2018",https://www.marketwatch.com/story/obseva-sa-to-participate-in-the-hc-wainwright-annual-global-life-sciences-conference-april-8-10-2018-2018-03-26
