code,content,date,listening,title,url
OEC,"Orion Engineered Carbons S.A. OEC, -2.77% a leading worldwide supplier of specialty and high-performance Carbon Black, today announced that it will expand production capacity at its facility in Ravenna, Italy, with the construction of a new specialty Carbon Black line. The line will provide additional Specialty Carbon Blacks to supply the growing coatings, polymers, printing and specialty applications markets. “After extensive review and analysis of opportunities, in addition to the ongoing conversion of existing rubber capacity to specialty, we are adding a new line to take advantage of the strong demand for Specialty Carbon Blacks and extend our successful penetration of the specialty segment,” said Jack Clem, Orion’s Chief Executive Officer. “This investment continues Orion’s rapid realignment of our portfolio toward higher value added products.” The new line is expected to begin production in the fourth quarter 2019. For product related information, contact Tilo Lindner, Head of Global Marketing, Business Line Specialty Carbon Black, at tilo.lindner@orioncarbons.com. About Orion Engineered Carbons S.A. OEC, -2.77% Orion is a worldwide supplier of Carbon Black. We produce a broad range of Carbon Blacks that include high-performance Specialty Gas Blacks, Furnace Blacks, Lamp Blacks, Thermal Blacks and other Carbon Blacks that tint, colorize and enhance the performance of polymers, plastics, paints and coatings, inks and toners, textile fibers, adhesives and sealants, tires, and mechanical rubber goods such as automotive belts and hoses. Orion runs 14 global production sites and four Applied Technology Centers. The group has approximately 1,441 employees worldwide. For more information please visit our website www.orioncarbons.com. Forward Looking Statements This document contains certain forward-looking statements with respect to our financial condition, results of operations and business. These statements constitute forward-looking statements within the meaning of Section 21E of the Securities Exchange Act of 1934, as amended. Forward-looking statements are statements of future expectations that are based on management’s current expectations and assumptions and involve known and unknown risks and uncertainties that could cause actual results, performance or events to differ materially from those expressed or implied in these statements. Forward-looking statements include, among others, statements concerning the potential exposure to market risks, statements expressing management’s expectations, beliefs, estimates, forecasts, projections and assumptions and statements that are not limited to statements of historical or present facts or conditions. Some of these statements can be identified by terms and phrases such as “anticipate,” “believe,” “intend,” “estimate,” “expect,” “continue,” “could,” “should,” “may,” “plan,” “project,” “predict” and similar expressions. Factors that could cause our actual results to differ materially from those expressed or implied in such forward-looking statements include those factors detailed under the captions “Note Regarding Forward-Looking Statements” and “Risk Factors” in our Annual Report on Form 20-F for the year ended December 31, 2017 and in Note 9 to our audited consolidated financial statements regarding contingent liabilities, including litigation. You should not place undue reliance on forward-looking statements. Each forward-looking statement speaks only as of the date of the particular statement. New risk factors and uncertainties emerge from time to time and it is not possible for our management to predict all risk factors and uncertainties, nor can we assess the impact of all factors on our business or the extent to which any factor, or combination of factors, may cause actual results to differ materially from those contained in any forward-looking statements. We undertake no obligation to publicly update or revise any forward-looking statement as a result of new information, future events or other information, other than as required by applicable law. View source version on businesswire.com: https://www.businesswire.com/news/home/20180320006532/en/ SOURCE: Orion Engineered Carbons S.A. Orion Engineered Carbons S.A. Investor Relations Diana Downey, +1 832-589-2285 Investor-Relations@orioncarbons.com Copyright Business Wire 2018 From MarketWatch How to Get a Job: Advice From Extremely Successful People More Coverage Don’t ever do this with your credit card This emerging-market ETF continues to blow away the competition Why tax refunds have lost their sparkle","Mar 20, 2018 4:51 p.m. ET",N/A,"Orion Engineered Carbons to Add Specialty Carbon Black Production 
      Line in Italy",https://www.marketwatch.com/story/orion-engineered-carbons-to-add-specialty-carbon-black-production-line-in-italy-2018-03-20
OEC,"On February 23rd, 2018, Orion Engineered Carbons S.A. OEC, -3.04% (the “Company”), a worldwide supplier of specialty and high-performance Carbon Black, filed its annual report for the year ended December 31, 2017 (the “2017 Annual Report”). The 2017 Annual Report contains audited consolidated financial statements, operating and financial review and other disclosure. The 2017 Annual Report was filed with the U.S. Securities and Exchange Commission on Form 20-F and is available at www.sec.gov, in the “Investor Relations” section of www.orioncarbons.com and at the Company’s registered office at 6, Route de Trèves, L-2633 Senningerberg (Municipality of Niederanven), Grand Duchy of Luxembourg. A copy of the 2017 Annual Report may be obtained, free of charge, by contacting the Company’s Investor Relations at investor-relations@orioncarbons.com, by fax to +1-281-227-1557 or in writing by post to Orion Engineered Carbons S.A., 6, Route de Trèves, L-2633 Senningerberg (Municipality of Niederanven), Grand Duchy of Luxembourg. About Orion Engineered Carbons S.A. Orion is a worldwide supplier of Carbon Black. We produce a broad range of Carbon Blacks that include high-performance Specialty Gas Blacks, Furnace Blacks, Lamp Blacks, Thermal Blacks and other Carbon Blacks that tint, colorize and enhance the performance of polymers, plastics, paints and coatings, inks and toners, textile fibers, adhesives and sealants, tires, and mechanical rubber goods such as automotive belts and hoses. Orion runs 14 global production sites and four Applied Technology Centers. The group has approximately 1,441 employees worldwide. For more information please visit our website www.orioncarbons.com. View source version on businesswire.com: http://www.businesswire.com/news/home/20180305006091/en/ SOURCE: Orion Engineered Carbons S.A.""> <Property FormalName=""PrimaryTwitterHandle"" Value=""@OECarbons Orion Engineered Carbons S.A. Investor Relations Diana Downey, +1 832-589-2285 Investor-Relations@orioncarbons.com Copyright Business Wire 2018 From MarketWatch Samsung Galaxy S9: Putting the Camera to the Test More Coverage BlackRock fund manager sees this as the market’s ‘sweet spot’ Why every investor should be terrified by the slide in Home Depot stock Don’t ever do this with your credit card","Mar 5, 2018 4:30 p.m. ET",N/A,"Orion Announces Filing of Annual Report for the Year Ended December 
      31, 2017",https://www.marketwatch.com/story/orion-announces-filing-of-annual-report-for-the-year-ended-december-31-2017-2018-03-05
OEC,"NEW YORK, March 5, 2018 /PRNewswire/ -- WallStEquities.com strives to bring the best free research to the investment community. Today we are offering reports on MEOH, OLN, OEC, and PPG which can be accessed for free by signing up to www.wallstequities.com/registration. On Friday, March 02, 2018, the NASDAQ Composite and the S&P 500 edged 1.08% and 0.51% higher, respectively at the closing bell, while the Dow Jones Industrial Average stayed bearish, finishing marginally lower by 0.29%. US markets saw seven out of nine sectors finishing the day in green, one in red, and one in neutral territory. Taking into consideration last Friday's market sentiment, WallStEquities.com assessed the following Specialty Chemicals equities this morning: Methanex Corp. MEOH, -0.91% Olin Corp. OLN, -3.59% Orion Engineered Carbons S.A. OEC, -3.04% and PPG Industries Inc. PPG, -3.70% All you have to do is sign up today for this free limited time offer by clicking the link below. www.wallstequities.com/registration Methanex On Friday, shares in Vancouver, Canada headquartered Methanex Corp. recorded a trading volume of 589,606 shares. The stock ended at $54.00, declining 1.46% from the last trading session. The Company's shares have gained 7.78% in the last twelve months. The stock is trading above its 200-day moving average by 6.79%. Furthermore, shares of Methanex, which produces and supplies methanol in North America, Asia/Pacific, Europe, and South America, have a Relative Strength Index (RSI) of 33.04. Get the full research report on MEOH for free by clicking below at: www.wallstequities.com/registration/?symbol=MEOH Olin Clayton, Missouri headquartered Olin Corp.'s stock finished last Friday's session 1.14% lower at $31.32. A total volume of 2.44 million shares was traded, which was above their three months average volume of 2.02 million shares. The stock is trading below its 50-day moving average by 11.18%. Furthermore, shares of Olin, which manufactures and distributes chemical products in the US and internationally, have an RSI of 34.46. Today's complimentary research report on OLN is accessible at: www.wallstequities.com/registration/?symbol=OLN Orion Engineered Carbons At the close of trading on Friday, shares in Luxembourg headquartered Orion Engineered Carbons S.A. saw a rise of 1.28%, ending the day at $27.70. The stock recorded a trading volume of 624,822 shares. The Company's shares have advanced 12.60% in the previous three months and 30.35% over the last twelve months. The stock is trading above its 50-day and 200-day moving averages by 0.63% and 20.39%, respectively. Moreover, shares of the Company, which together with its subsidiaries, produces and sells carbon black products in Germany, the US, South Korea, Brazil, South Africa, the rest of Europe, and internationally, have an RSI of 47.33. Sign up for free on Wall St. Equities and claim the latest report on OEC at: www.wallstequities.com/registration/?symbol=OEC PPG Industries Pittsburgh, Pennsylvania headquartered PPG Industries Inc.'s shares ended the day 0.77% lower at $110.25 with a total trading volume of 1.36 million shares. The stock has gained 7.69% over the last twelve months. The Company's shares are trading below their 50-day moving average by 5.33%. Additionally, shares of PPG Industries, which manufactures and distributes paints, coatings, and specialty materials in the US and internationally, have an RSI of 34.94. See the free research coverage on PPG at: www.wallstequities.com/registration/?symbol=PPG Wall St. Equities : Wall St. Equities (WSE) produces regular sponsored and non-sponsored reports, articles, stock market blogs, and popular investment newsletters covering equities listed on NYSE and NASDAQ and micro-cap stocks. WSE has two distinct and independent departments. One department produces non-sponsored analyst certified content generally in the form of press releases, articles and reports covering equities listed on NYSE and NASDAQ and the other produces sponsored content (in most cases not reviewed by a registered analyst), which typically consists of compensated investment newsletters, articles and reports covering listed stocks and micro-caps. Such sponsored content is outside the scope of procedures detailed below.  WSE has not been compensated; directly or indirectly; for producing or publishing this document.  PRESS RELEASE PROCEDURES: The non-sponsored content contained herein has been prepared by a writer (the ""Author"") and is fact checked and reviewed by a third-party research service company (the ""Reviewer"") represented by a credentialed financial analyst [for further information on analyst credentials, please email info@wallstequities.com. Rohit Tuli, a CFA® charterholder (the ""Sponsor""), provides necessary guidance in preparing the document templates. The Reviewer has reviewed and revised the content, as necessary, based on publicly available information which is believed to be reliable. Content is researched, written and reviewed on a reasonable-effort basis. The Reviewer has not performed any independent investigations or forensic audits to validate the information herein. The Reviewer has only independently reviewed the information provided by the Author according to the procedures outlined by WSE. WSE is not entitled to veto or interfere in the application of such procedures by the third-party research service company to the articles, documents or reports, as the case may be. Unless otherwise noted, any content outside of this document has no association with the Author or the Reviewer in any way.   NO WARRANTY WSE, the Author, and the Reviewer are not responsible for any error which may be occasioned at the time of printing of this document or any error, mistake or shortcoming. No liability is accepted whatsoever for any direct, indirect or consequential loss arising from the use of this document. WSE, the Author, and the Reviewer expressly disclaim any fiduciary responsibility or liability for any consequences, financial or otherwise arising from any reliance placed on the information in this document. Additionally, WSE, the Author, and the Reviewer do not (1) guarantee the accuracy, timeliness, completeness or correct sequencing of the information, or (2) warrant any results from use of the information. The included information is subject to change without notice.  NOT AN OFFERING This document is not intended as an offering, recommendation, or a solicitation of an offer to buy or sell the securities mentioned or discussed, and is to be used for informational purposes only. Please read all associated disclosures and disclaimers in full before investing. Neither WSE nor any party affiliated with us is a registered investment adviser or broker-dealer with any agency or in any jurisdiction whatsoever. To download our report(s), read our disclosures, or for more information, visit https://wallstequities.com/legal-disclaimer/ CONTACT For any questions, inquiries, or comments reach out to us directly. If you're a company, we are covering and wish to no longer feature on our coverage list contact us via email and/or phone between 09:30 EDT to 16:00 EDT from Monday to Friday at: Email: info@wallstequities.com Phone number: +21-32-044-483 Office Address: 1 Scotts Road #24-10, Shaw Center Singapore 228 CFA® and Chartered Financial Analyst® are registered trademarks owned by CFA Institute.     View original content:http://www.prnewswire.com/news-releases/whats-happening-with-these-specialty-chemicals-stocks----methanex-olin-orion-engineered-carbons-and-ppg-industries-300607933.html SOURCE Wall St. Equities Copyright (C) 2018 PR Newswire. All rights reserved From MarketWatch How to Run a Better Meeting: Advice From Extremely Successful People More Coverage Damn the torpedoes — what could take the S&P 500 to 3,000 S&P 500 logs longest losing streak of the year as trade-war jitters weigh This emerging-market ETF continues to blow away the competition","Mar 5, 2018 7:00 a.m. ET",N/A,"What's Happening With These Specialty Chemicals Stocks? -- Methanex, Olin, Orion Engineered Carbons, and PPG Industries",https://www.marketwatch.com/story/whats-happening-with-these-specialty-chemicals-stocks----methanex-olin-orion-engineered-carbons-and-ppg-industries-2018-03-05
OEC,"LUXEMBOURG, Feb 28, 2018 (BUSINESS WIRE) -- Orion Engineered Carbons S.A. OEC, -3.23% a worldwide supplier of specialty and high-performance Carbon Black, today announced that Mr. Charles Herlinger, Chief Financial Officer will be participating in the upcoming Goldman Sachs Seventh Annual European Chemicals Conference on Thursday, March 15 [th] , 2018 at Goldman Sachs, River Court, 120 Fleet Street, LONDON, UK. About Orion Engineered Carbons S.A. Orion is a worldwide supplier of Carbon Black. We produce a broad range of Carbon Blacks that include high-performance Specialty Gas Blacks, Furnace Blacks, Lamp Blacks, Thermal Blacks and other Carbon Blacks that tint, colorize and enhance the performance of polymers, plastics, paints and coatings, inks and toners, textile fibers, adhesives and sealants, tires, and mechanical rubber goods such as automotive belts and hoses. Orion runs 14 global production sites and four Applied Technology Centers. The group has approximately 1,441 employees worldwide. For more information please visit our website www.orioncarbons.com. View source version on businesswire.com: http://www.businesswire.com/news/home/20180228006444/en/ SOURCE: Orion Engineered Carbons S.A.""> <Property FormalName=""PrimaryTwitterHandle"" Value=""@OECarbons Orion Engineered Carbons S.A. Investor Relations Diana Downey, +1 832-589-2285 Investor-Relations@orioncarbons.com Copyright Business Wire 2018 From MarketWatch What Picking Up an Apple Tells You About the Future of Robotics More Coverage Three reasons the stock market’s fundamentals look solid Jobless claims drop 4,000 to 226,000 Damn the torpedoes — what could take the S&P 500 to 3,000","Feb 28, 2018 4:30 p.m. ET",N/A,"Orion Engineered Carbons to Attend the Goldman Sachs Seventh Annual 
      European Chemicals Conference",https://www.marketwatch.com/story/orion-engineered-carbons-to-attend-the-goldman-sachs-seventh-annual-european-chemicals-conference-2018-02-28
OEC,"Feb 23, 2018 (ACCESSWIRE via COMTEX) -- NEW YORK, NY / ACCESSWIRE / February 23, 2018 / Orion Engineered Carbons SA OEC, -3.14% will be discussing their earnings results in their Q4 Earnings Call to be held on February 23, 2018, at 8:30 AM Eastern Time. To listen to the event live or access a replay of the call - visit https://www.investornetwork.com/company/1370. To receive updates for this company you can register by emailing info@investornetwork.com or by clicking get investment info from the company's profile. About Investor Network Investor Network (IN) is a financial content community, serving millions of unique investors market information, earnings, commentary and news on the what's trending. Dedicated to both the professional and the average traders, IN offers timely, trusted and relevant financial information for virtually every investor. IN is an Issuer Direct brand, to learn more or for the latest financial news and market information, visit www.investornetwork.com. Follow us on Twitter @investornetwork. SOURCE: Investor Network http://www.accesswire.com/img.ashx?id=490291 Copyright 2018 ACCESSWIRE From MarketWatch Can the Democrats Ride a Blue Wave to Midterm Election Wins? More Coverage Jobless claims drop 4,000 to 226,000 Bloodbath for cryptocurrencies as Bitcoin sheds 10%, now down 40% year-to-date Home sellers now use spycams to gather intel on prospective buyers","Feb 23, 2018 6:46 a.m. ET",N/A,Orion Engineered Carbons SA to Host Earnings Call,https://www.marketwatch.com/story/orion-engineered-carbons-sa-to-host-earnings-call-2018-02-23
