code,content,date,listening,title,url
ACIW,"ACI Worldwide ACIW, +0.81% a leading global provider of real-time electronic payment and banking solutions, today announced that the Electronic Transactions Association (ETA) has chosen Carolyn Homberger, group president, global sales at ACI, for its inaugural Forty Under 40 award. Highlighting influencers at the intersection of payments and technology, the honorees include individuals working across the evolving segments of the industry whose actions and leadership are driving the payments industry forward. As president of global sales at ACI, Carolyn heads an experienced team of hundreds of payments professionals driving the sustained, organic growth of ACI’s cloud-based and on-premise payment solutions. As a member of ACI’s Executive Leadership Team, she is a key decision-maker involved with business strategy, growth and the expansion of ACI’s portfolio of next-generation payment solutions. “It’s a true honor to be part of this prestigious group of Forty Under 40 leaders in the payments industry,” said Carolyn Homberger, president, global sales, ACI Worldwide. “I’m passionate about the advancement of digital payments and I’m pleased to be among other disrupters who play a role in elevating the industry’s future.” A strong advocate for the leadership and growth of women in the payments industry, Carolyn launched ACI’s own Women’s Initiative, which she continues to actively lead and advocate for today. “ETA’s first Forty Under 40 class is growing the industry at an unprecedented pace,” said Jason Oxman, CEO of ETA. “Each honoree possesses a unique skillset, allowing them to identify and shape key segments of the payments ecosystem. The caliber and impact of their work is exceptional and demonstrates their commitment to the industry.” To view the full Forty Under 40 list: http://www.electran.org/events/etatransact18/40-under-40/ About ACI Worldwide ACI Worldwide, the Universal Payments (UP) company, powers electronic payments for more than 5,100 organizations around the world. More than 1,000 of the largest financial institutions and intermediaries, as well as thousands of global merchants, rely on ACI to execute $14 trillion each day in payments and securities. In addition, myriad organizations utilize our electronic bill presentment and payment services. Through our comprehensive suite of software solutions delivered on customers’ premises or through ACI’s private cloud, we provide real-time, immediate payments capabilities and enable the industry’s most complete omni-channel payments experience. To learn more about ACI, please visit www.aciworldwide.com. You can also find us on Twitter @ACI_Worldwide. © Copyright ACI Worldwide, Inc. 2018. ACI, ACI Worldwide, ACI Payment Systems, the ACI logo, ACI Universal Payments, UP, the UP logo, ReD, PAY.ON and all ACI product names are trademarks or registered trademarks of ACI Worldwide, Inc., or one of its subsidiaries, in the United States, other countries or both. Other parties’ trademarks referenced are the property of their respective owners. Product roadmaps are for informational purposes only and may not be incorporated into a contract or agreement. The development release and timing of future product releases remains at ACI’s sole discretion. ACI is providing the following information in accordance with ACI's standard product communication policies. Any resulting features, functionality, and enhancements or timing of release of such features, functionality, and enhancements are at the sole discretion of ACI and may be modified without notice. All product roadmap or other similar information does not represent a commitment to deliver any material, code, or functionality, and should not be relied upon in making a purchasing decision. View source version on businesswire.com: https://www.businesswire.com/news/home/20180323005069/en/ SOURCE: ACI Worldwide""> <Property FormalName=""PrimaryTwitterHandle"" Value=""@ACI_Worldwide ACI Worldwide Dan Ring, 781-370-3600 dan.ring@aciworldwide.com or Nidhi Alberti, 781-370-3600 nidhi.alberti@aciworldwide.com Copyright Business Wire 2018 From MarketWatch How Russian Trolls Collected Americans' Personal Information More Coverage My husband sold his grandmother’s house and paid off our mortgage — now his family is threatening to sue Damn the torpedoes — what could take the S&P 500 to 3,000 S&P 500 logs longest losing streak of the year as trade-war jitters weigh","Mar 23, 2018 8:00 a.m. ET",N/A,"ACI Worldwide’s Carolyn Homberger Recognized as One of Forty Under 40 
      Game Changers in Digital Payments",https://www.marketwatch.com/story/aci-worldwides-carolyn-homberger-recognized-as-one-of-forty-under-40-game-changers-in-digital-payments-2018-03-23
ACIW,"ACI Worldwide ACIW, +0.81% a leading global provider of real-time electronic payment and banking solutions, today announced a key strategic partnership with Shanghai-based bank card company UnionPay International. UnionPay International is set to significantly grow its worldwide footprint by connecting to ACI’s extensive global network of payment endpoints. Additionally, ACI provides UnionPay International with a next-generation foundational platform through which a range of new products and services can be rapidly brought to market. This press release features multimedia. View the full release here: https://www.businesswire.com/news/home/20180322005578/en/ UnionPay International (UPI), a wholly-owned subsidiary of China UnionPay, focuses on the growth and support of UnionPay’s global business. UnionPay now serves the world’s largest cardholder base of more than 7 billion UnionPay cards issued worldwide, and is the preferred payment brand for outbound Chinese travelers. ACI’s extensive network of payment endpoints – in particular, card acquirers that are integrated with its Universal Payments solutions, will allow UnionPay to rapidly expand its footprint and increase card acceptance, in both in-store and card-not-present environments. ACI’s UP solutions also enable UnionPay International to innovate in the fast-growing mobile payments space. UnionPay, through its ACI implementation, is preparing to accelerate the roll-out of new payment services for online and mobile payments. ACI’s strong global presence, including its connections to more than 400 alternative payment methods and card acquirers, will facilitate the timely rollout of new tokenization-backed mobile solutions. “Since the start of this year, UnionPay has been focused on expanding our business by coming up with innovative ideas, collaborating with new organizations, and operating using new go-to-market strategies,” said Mr. Cai Jianbo, CEO, UnionPay International. “This partnership is of great significance as it promotes cooperation in the development of our overseas business. Organizations and merchants have transformed their systems and can now rely on ACI’s business and technical strength in the global financial sector to further accelerate the development of innovative products. We can respond faster to our customers’ needs and increase the efficiency of our business operations.” “We are proud to partner with an industry leader such as UnionPay to serve the payment preferences of its customers through ACI’s expansive reach, and loyal customer base of merchants and financial institutions. And with the extensive capabilities delivered by our UP solutions, we are uniquely qualified to support UnionPay’s diverse needs, long-term growth and global ambitions,” said Dan Frate, Group President, ACI On-Demand, ACI Worldwide. “UnionPay’s growth opportunity is considerable, with Chinese consumers now making more than 100 million trips outside of Greater China annually, and this number is expected to increase substantially.” About ACI Worldwide ACI Worldwide, the Universal Payments (UP) company, powers electronic payments for more than 5,100 organizations around the world. More than 1,000 of the largest financial institutions and intermediaries, as well as thousands of global merchants, rely on ACI to execute $14 trillion each day in payments and securities. In addition, myriad organizations utilize our electronic bill presentment and payment services. Through our comprehensive suite of software solutions delivered on customers’ premises or through ACI’s private cloud, we provide real-time, immediate payments capabilities and enable the industry’s most complete omni-channel payments experience. To learn more about ACI, please visit www.aciworldwide.com. You can also find us on Twitter @ACI_Worldwide. © Copyright ACI Worldwide, Inc. 2018. ACI, ACI Worldwide, ACI Payment Systems, the ACI logo, ACI Universal Payments, UP, the UP logo, ReD, PAY.ON and all ACI product names are trademarks or registered trademarks of ACI Worldwide, Inc., or one of its subsidiaries, in the United States, other countries or both. Other parties’ trademarks referenced are the property of their respective owners. Product roadmaps are for informational purposes only and may not be incorporated into a contract or agreement. The development release and timing of future product releases remains at ACI’s sole discretion. ACI is providing the following information in accordance with ACI's standard product communication policies. Any resulting features, functionality, and enhancements or timing of release of such features, functionality, and enhancements are at the sole discretion of ACI and may be modified without notice. All product roadmap or other similar information does not represent a commitment to deliver any material, code, or functionality, and should not be relied upon in making a purchasing decision. View source version on businesswire.com: https://www.businesswire.com/news/home/20180322005578/en/ SOURCE: ACI Worldwide""> <Property FormalName=""PrimaryTwitterHandle"" Value=""@ACI_Worldwide ACI Worldwide Dan Ring, +1 781-370-3600 dan.ring@aciworldwide.com or Christopher Taine, +49 (0) 89 45230 557 christopher.taine@aciworldwide.com Copyright Business Wire 2018 From MarketWatch Can the Democrats Ride a Blue Wave to Midterm Election Wins? More Coverage This emerging-market ETF continues to blow away the competition S&P 500 logs longest losing streak of the year as trade-war jitters weigh Stephen Hawking’s final Reddit post is going viral over its ominous warning about robots","Mar 22, 2018 9:00 a.m. ET",N/A,"UnionPay International Forges Major Strategic Alliance with ACI 
      Worldwide to Grow Global Footprint",https://www.marketwatch.com/story/unionpay-international-forges-major-strategic-alliance-with-aci-worldwide-to-grow-global-footprint-2018-03-22
ACIW,"ACI Worldwide ACIW, +0.81% a leading global provider of real-time electronic payment and banking solutions, today announced that Avid Acceptance, a leading Southwestern-based finance company, has chosen ACI’s UP Bill Payment Solution to drive customer satisfaction, cost savings and compliance. Looking to improve its debit card payment processing, Avid Acceptance sought to ensure its transactions were compliant, and that it could lower card processing costs, as well as easily offer a pay-by-text option. After evaluating several solutions in the market, Avid Acceptance selected ACI for its extensive bill payment, and improved Interactive Voice Response (IVR) functionality. “Our business success is predicated on putting people first, so providing our customers with the convenience they expect is paramount,” said Curtis Ash, chief financial officer, Avid Acceptance. “ACI’s technology not only allows us to meet the demands of the modern customer with less expensive and more compliant payments, but its comprehensive technology is an added advantage.” “We’re pleased to partner with Avid Acceptance as they continue to put a keen focus on bringing a quality auto finance experience to their customers,” said Steve Kramer, vice president, ACI Worldwide. “By expanding their current electronic bill presentment and payment options, Avid Acceptance is not only driving customer satisfaction, but maintaining its competitive edge in the industry.” Electronic Bill Presentment and Payment (EBPP) Services are part of ACI's UP Bill Payment solution. ACI's Universal Payments (UP) portfolio of solutions orchestrates all aspects of payments processing for any payment type, any channel, any currency and any network. About ACI Worldwide ACI Worldwide, the Universal Payments (UP) company, powers electronic payments for more than 5,100 organizations around the world. More than 1,000 of the largest financial institutions and intermediaries, as well as thousands of global merchants, rely on ACI to execute $14 trillion each day in payments and securities. In addition, myriad organizations utilize our electronic bill presentment and payment services. Through our comprehensive suite of software solutions delivered on customers’ premises or through ACI’s private cloud, we provide real-time, immediate payments capabilities and enable the industry’s most complete omni-channel payments experience. To learn more about ACI, please visit www.aciworldwide.com. You can also find us on Twitter @ACI_Worldwide. © Copyright ACI Worldwide, Inc. 2018. ACI, ACI Worldwide, ACI Payment Systems, the ACI logo, ACI Universal Payments, UP, the UP logo, ReD, PAY.ON and all ACI product names are trademarks or registered trademarks of ACI Worldwide, Inc., or one of its subsidiaries, in the United States, other countries or both. Other parties’ trademarks referenced are the property of their respective owners. Product roadmaps are for informational purposes only and may not be incorporated into a contract or agreement. The development release and timing of future product releases remains at ACI’s sole discretion. ACI is providing the following information in accordance with ACI's standard product communication policies. Any resulting features, functionality, and enhancements or timing of release of such features, functionality, and enhancements are at the sole discretion of ACI and may be modified without notice. All product roadmap or other similar information does not represent a commitment to deliver any material, code, or functionality, and should not be relied upon in making a purchasing decision. View source version on businesswire.com: https://www.businesswire.com/news/home/20180320005290/en/ SOURCE: ACI Worldwide""> <Property FormalName=""PrimaryTwitterHandle"" Value=""@aci_worldwide ACI Worldwide Dan Ring, 781-370-3600 dan.ring@aciworldwide.com or Nidhi Alberti, 781-370-3600 nidhi.alberti@aciworldwide.com Copyright Business Wire 2018 From MarketWatch Samsung Galaxy S9: Putting the Camera to the Test More Coverage Trump boasts about making up facts about trade deficit to Trudeau Why tax refunds have lost their sparkle Jobless claims drop 4,000 to 226,000","Mar 20, 2018 8:00 a.m. ET",N/A,ACI Worldwide to Lower Debit Card Costs for Avid Acceptance,https://www.marketwatch.com/story/aci-worldwide-to-lower-debit-card-costs-for-avid-acceptance-2018-03-20
ACIW,"ACI Worldwide ACIW, +0.81% a leading global provider of real-time electronic payment and banking solutions, today announced that it is extending its partnership with DBS to support the bank’s ongoing digital transformation, including offering Singapore’s first FAST Real-Time Payments gateway service to corporate and institutional customers. DBS is further building upon its longstanding relationship with ACI, through which the bank originally developed IDEAL – its leading digital banking portal for corporates. DBS’s continued digital transformation utilizes ACI’s UP Real-Time Payments solution as the backbone of its enterprise payments framework, allowing merchant, wholesale and SME customers to offer FAST payments services – including over the mobile channel and Singapore’s enhanced peer-to-peer funds transfer service, PayNow. With innovation in the region driven by the real-time and open imperative, faster payments and real-time cross-border payments are transforming the ASEAN fintech landscape. Malaysia, Thailand and Singapore are poised to be the first countries in the region to achieve interoperability between their central payment infrastructures, and DBS is well positioned – through its digital transformation strategy – to benefit from the opportunities that will arise as this ASEAN Payment Network takes shape. ACI’s UP Real-Time Payments solution gives banks complete control, choice and flexibility in routing their real-time payments, providing connectivity to immediate payments schemes and real-time gross settlement (RTGS) globally. “Successful digital payment transformation requires not only embracing the real-time paradigm, but also adopting an ‘open’ mindset in which Open APIs play an important part, as well as working with ecosystem partners to make banking services readily available and joyful,” said Ng Peng Khim, Head of Institutional Banking Group Technology, DBS Bank. “ACI’s solutions are instrumental in our current and future real-time payment initiatives.” “We are proud of our longstanding relationship with DBS, and look forward to continuing this collaboration as the bank continues to innovate and grow,” said Leslie Choo, vice president & GM, Asia, ACI Worldwide. “Singapore is rapidly becoming one of the world’s most vibrant fintech hubs, and it is exciting to be able to support DBS on its digital transformation journey, as it engages with fintechs and established financial institutions alike within this new payments ecosystem.” About ACI Worldwide ACI Worldwide, the Universal Payments (UP) company, powers electronic payments for more than 5,100 organizations around the world. More than 1,000 of the largest financial institutions and intermediaries, as well as thousands of global merchants, rely on ACI to execute $14 trillion each day in payments and securities. In addition, myriad organizations utilize our electronic bill presentment and payment services. Through our comprehensive suite of software solutions delivered on customers’ premises or through ACI’s private cloud, we provide real-time, immediate payments capabilities and enable the industry’s most complete omni-channel payments experience. To learn more about ACI, please visit www.aciworldwide.com. You can also find us on Twitter @ACI_Worldwide. © Copyright ACI Worldwide, Inc. 2018. ACI, ACI Worldwide, ACI Payment Systems, the ACI logo, ACI Universal Payments, UP, the UP logo, ReD, PAY.ON and all ACI product names are trademarks or registered trademarks of ACI Worldwide, Inc., or one of its subsidiaries, in the United States, other countries or both. Other parties’ trademarks referenced are the property of their respective owners. Product roadmaps are for informational purposes only and may not be incorporated into a contract or agreement. The development release and timing of future product releases remains at ACI’s sole discretion. ACI is providing the following information in accordance with ACI's standard product communication policies. Any resulting features, functionality, and enhancements or timing of release of such features, functionality, and enhancements are at the sole discretion of ACI and may be modified without notice. All product roadmap or other similar information does not represent a commitment to deliver any material, code, or functionality, and should not be relied upon in making a purchasing decision. View source version on businesswire.com: http://www.businesswire.com/news/home/20180313005137/en/ SOURCE: ACI Worldwide""> <Property FormalName=""PrimaryTwitterHandle"" Value=""@ACI_Worldwide ACI Worldwide Dan Ring, +1 781-370-3600 dan.ring@aciworldwide.com or Christopher Taine, +49 (0) 89 45230 557 christopher.taine@aciworldwide.com Copyright Business Wire 2018 From MarketWatch Uber for Bikes Could Save Your Commute More Coverage My husband sold his grandmother’s house and paid off our mortgage — now his family is threatening to sue Delta flight scare is a reminder never to put electronics in checked baggage What America’s gun fanatics won’t tell you","Mar 13, 2018 9:00 p.m. ET",N/A,DBS Drives Digital Transformation in Asia-Pacific with ACI Worldwide,https://www.marketwatch.com/story/dbs-drives-digital-transformation-in-asia-pacific-with-aci-worldwide-2018-03-13
