code,content,date,listening,title,url
AAXJ,"The Trump rally is over — run for the hills! No, wait — it’s getting its groove back. So which is it? Surely, a look at sectors will reveal all, clearing the air after this up-and-down month. Nope. “Normally, certain sectors lead in strong markets, and different ones lead in weaker markets,” notes Michael Kahn, Barron’s resident technician. “Right now, there’s little rhyme or reason to the leaders and laggards — and that keeps the level of uncertainty relatively high for stocks,” he says. Rather than join in the endless debate between the bulls and bears, you could just look for a Trump trade that still has room to run, even as others stumble. The Macro Man blog’s Abee Crombie may have delivered exactly that for our call of the day. “If you want to play the global reflation theme, you really should be looking at Asia ex Japan 899800, +0.01%  ,” the financial blogger says. “Earnings estimates have been on the rise in 2017. And don’t look now, but it’s been positive almost every day this year.” Sure, some pundits say the reflation trade might not have that much to do with our new president, while others say it’s at least “Trump inspired.” Regardless, Abee Crombie’s pick for betting on reflation is sporting a nice year-to-date gain. The big U.S.-listed ETF AAXJ, +1.80%  that tracks MSCI’s Asia ex-Japan stock index is up 16% in 2017, as of yesterday’s close. Talk about power swinging over to the Pacific. And the iShares Asia ex Japan ETF stands well below its all-time high, unlike the main U.S. stock indexes. That potentially makes it less scary for investors to plunk new money in it. (The ETF has $2.9 billion in investor cash at the moment, according to ETF.com data). The fund’s biggest holding is Samsung 005930, +0.37% SSNLF, -3.07%  , which has weathered all sorts of drama remarkably well. Key market gauges Futures for the S&P 500 US:ESM7   , Dow US:YMM7  and Nasdaq-100 US:NQM7  are flat to slightly lower this morning. That’s after the S&P SPX, +1.38% and Nasdaq Composite COMP, +1.64%  both closed modestly higher yesterday, while the Dow DJIA, +1.07% lost ground. The S&P is down 0.1% in March, as of yesterday’s close, and up 5.5% in the first quarter. It’s 1.5% below its March 1 record close. Across the Pacific, the Shanghai benchmark SHCOMP, +0.26%  suffered its biggest intraday drop this year, as one analyst said Asian markets are “confused.” See the Market Snapshot column for the latest action. The chart LPL The S&P 500 has gained 2% on average in April over the past 20 years, notes LPL Financial’s Ryan Detrick. “Whether it’s because of tax returns being used to buy equities, last-minute retirement fund contributions, or simply happier moods as the days get warmer, April tends to be one of the strongest months historically. In fact, over the past 20 years, no other month has had a higher average return,” he writes. But if you look back to 1928 or to 1950, April is only the third-strongest month, Detrick adds. The stat Getty Images Meet one of the bull market’s big stars... $528 billion — That is the record amount that investors borrowed against their brokerage accounts in February, according to a Wall Street Journal story citing NYSE data released yesterday. What to make of this record level of margin debt? Margin debt has a history of peaking right before financial collapses, but one strategist says “usage of margin seems unexceptional” so far. Also read: Why investors are paying attention to the Baltic Dry Index again The buzz Ouch! Lululemon LULU, +3.68%  is getting stretched way lower after its disappointing earnings late yesterday. The leggings seller should have been “bolder with the color assortment,” apparently. ConocoPhillips COP, +0.95%  is jumping after its unexpected move to sell its stake in an oil sands venture. Poor Warren Buffett. With Amazon’s AMZN, +1.11%  stock soaring lately, Jeff Bezos has topped the Oracle of Omaha to become the world’s second-richest person, according to Bloomberg’s calculations. Dun with the S&P: Dun & Bradstreet DNB, -0.71%  is getting kicked out of the S&P 500. Gartner IT, +0.69%  is taking its place. Bill Ackman has apologized for his $4 billion Valeant VRX, +2.91%  mistake. On the politics front, North Carolina has a deal to repeal its “bathroom law,” Ivanka Trump has become an official government worker after all, and a federal judge in Hawaii has indefinitely extended an order blocking President Trump’s revised travel ban. In addition, the president will meet with China’s Xi Jinping in a week. In Brexit news, EU officials are warning U.K. Prime Minister Theresa May not to blackmail them over security and Lloyd’s of London is embracing Brussels. Read: Here’s what happens now that the U.K. has triggered Article 50 The quote Getty Images It doesn’t look like a combative state. “The court will not crawl into a corner, pull the shutters closed, and pretend it has not seen what it has.” — Derrick Watson, the federal judge in Hawaii, in his decision last night. The ruling granted the Aloha State’s request for a longer-term halt of the Trump travel ban. The economy A fresh estimate for U.S. fourth-quarter GDP came in above expectations before the opening bell, but weekly jobless claims also were higher than forecasts. Check out: MarketWatch’s Economic Calendar And there are Federal Reserve speakers on tap for today’s session: Dallas Fed President Rob Kaplan, Cleveland’s Loretta Mester and San Francisco’s John Williams. Random reads Great, there’s a shark party going on in the Atlantic. Pedestrian deaths are spiking as more people are distracted by their phones. “American Psycho” author: Don’t have a Trump-driven mental collapse. “When they cut it open, Akbar was inside the snake.” How George W. Bush apparently described Trump’s inaugural address. All that nastiness online? It may get worse. The NTSB is investigating a Texas bus-truck crash that killed 13. Need to Know starts early and is updated until the opening bell, but sign up here to get it delivered once to your email box. Be sure to check the Need to Know item. The emailed version will be sent out at about 7:30 a.m. Eastern. Or Follow MarketWatch on Twitter or Facebook. And sign up here to get the Friday email highlighting 10 of the best MarketWatch articles of the week. More from MarketWatch Samsung Galaxy S9: Putting the Camera to the Test More Coverage This emerging-market ETF continues to blow away the competition Jobless claims drop 4,000 to 226,000 Bloodbath for cryptocurrencies as Bitcoin sheds 10%, now down 40% year-to-date Related Topics U.S. Stocks Markets NY Stock Exchange NASDAQ","Mar 30, 2017 9:28 a.m. ET",8,Here’s a Trump trade that still has room to run,https://www.marketwatch.com/story/heres-a-trump-trade-that-still-has-room-to-run-2017-03-30
AAXJ,"The stock market is an ongoing tale of greed and fear, overvaluation and undervaluation, and of styles and trends. And while I tend to focus my firm's work over a three-year period instead of shorter time frames, I find we can learn a lot by stepping back at the end of each quarter to take a snapshot of the market as that ongoing tale plays out. Below, I share with you an analysis I do with my research team each quarter, in which we analyze the broad market's returns, then focus on a variety of stock market segments we find to be either of long-term or current interest. The tables below show returns of these areas, as represented by ETFs, which make slicing and dicing the market more accessible for investment strategists, professional and amateur alike. This time around, I show you the performance for the first quarter of this year (through the market close of March 31) of 23 different market segment ETFs, grouped in a way that helps tell the story I see. I also show you the three-year trailing return and dividend yield, which are important factors in my own work. Ticker ETF Total return - YTD (daily) Total return - 3 years (daily) Dividend Yield (TTM) SPY, +1.28% SPDR S&P 500 ETF 1.6% 39.7% 2.1% DIA, +1.31%   SPDR Dow Jones Industrial Average ETF 2.3% 30.3% 2.4% QQQ, +1.83% PowerShares QQQ -1.9% 64.6% 1.1% Source: YCharts 2016 The S&P 500 staged a strong comeback in March to finish positive for the quarter, as did the Dow. But the Nasdaq, the clear market leader for years, finished in the red. Ticker ETF Total return - YTD (daily) Total return - 3 years (daily) Dividend Yield (TTM) URTH, +1.36% iShares MSCI World ETF 0.2% 22.4% 2.3% AAXJ, +1.80%   iShares MSCI All Country Asia ex Japan ETF 2.7% -1.5% 2.4% IEV, +0.84% iShares Euorope ETF -1.6% 8.3% 2.9% Source: YCharts 2016 The rest of the world was mixed, though emerging markets closed the quarter particularly strong. This is reflected in non-Japan Asia performance. Ticker ETF Total return - YTD (daily) Total return - 3 years (daily) Dividend Yield (TTM) RSP, +1.27% Guggenheim S&P 500 Equal Weight ETF 3.0% 38.1% 1.8% SPYV, +1.20% SPDR S&P 500 Value ETF 2.3% 30.8% 2.6% SPYG, +1.70% SPDR S&P 500 Growth ETF 0.6% 47.5% 1.6% Source: YCharts 2016 When we go inside the S&P 500, we see that value stocks outperformed growth stocks. As the three-year figures would imply, this has not been the case too often lately. Trend change? We’ll see. Ticker ETF Total return - YTD (daily) Total return - 3 years (daily) Dividend Yield (TTM) SPLV, +1.05% PowerShares S&P 500 Low Volatility 5.3% 39.9% 2.1% SPHB, +1.97% PowerShares S&P 500 High Beta -2.0% 23.9% 1.6% SPHQ, +1.29% PowerShares S&P 500 Quality 6.4% 49.1% 2.1% DVP, +1.56% Deep Value ETF 9.0% N/A 5.3% MOAT, +0.95% Market Vectors Morningstar Wide Moat 6.7% 37.4% 2.0% Source: YCharts 2016 Tilting a stock portfolio in different directions to try to gain an offensive or defensive performance advantage is a hot topic in professional investment circles. In the first quarter, it paid off for some more than others. Defensive and high-quality investing did very well, but higher-volatility (i.e. high-beta) stocks lost money. Contrarian (a.k.a. deep value) investing was a big winner, but volatile as ever. Finally, so-called “wide moat” businesses (those with perceived competitive advantages from size, scale, brand or other factors) had a strong quarter. Ticker ETF Total return - YTD (daily) Total return - 3 years (daily) Dividend Yield (TTM) XLU, +0.54% Utilities Select Sector SPDR ETF 14.8% 40.7% 3.2% VYM, +1.18% Vanguard High Dividend Yield ETF 4.4% 38.4% 3.1% DVY, +1.04% iShares Select Dividend ETF 9.3% 41.8% 3.2% SDY, +0.94% SPDR S&P Dividend ETF 9.5% 41.1% 2.5% HDV, +0.80% iShares Core High Dividend ETF 7.5% 33.0% 3.6% SDIV, +0.58% Global X SuperDividend ETF 3.6% 5.3% 7.2% Source: YCharts 2016 Income-oriented investing was perhaps the biggest winner in the first quarter. The utilities sector was maligned for much of last year as fears of higher interest rates and other false assumptions suppressed prices. But utilities stocks came roaring back over the past three months. This had a big, positive impact on the four largest dividend ETFs (VYM, DVY, SDY, HDV). But, as shown here, there can be wide differences in short-term performance in this market space, as many of those funds tend to “settle” for stocks whose yields are higher than average, but not by much. The one ETF shown here that invests in very high-yield stocks (while courting much higher risk) outperformed the broad market but underperformed higher-quality yield funds. This has been the case over the past few years. Ticker ETF Total return - YTD (daily) Total return - 3 years (daily) Dividend Yield (TTM) XLE, +2.11% Energy Select Sector SPDR ETF 3.4% -16.1% 3.2% AMLP, +1.30% Alerian MLP ETF -8.0% -24.6% 10.9% SOCL, +1.97% Global X Social Media Index ETF -7.2% 33.6% 0.0% Source: YCharts 2016 Energy stocks have been the party poopers for the stock market for a while. But in the first quarter, big-name energy companies did OK. Were they volatile as heck? Sure. Did they finish the quarter positive? Yes, quite. Have they bottomed? Let’s not get ahead of ourselves. After all, their relatives, the MLP sector, was once again tough sledding. And social-media stocks, which seem to have a love-hate relationship with investors, were a source of stress in the quarter. This is just a cursory review, from which additional research and strategic thinking can be done down to the company level. I think it can help you to gain a better sense of what we call your ""performance attribution"" — that is, which market factors influenced how you did. Naturally, this does not include the performance one can potentially generate from stock selection, but it does go at least ""knee deep"" by analyzing well beyond the headline index returns that investors pay way too much attention to. More from MarketWatch What Picking Up an Apple Tells You About the Future of Robotics More Coverage S&P 500 logs longest losing streak of the year as trade-war jitters weigh Bloodbath for cryptocurrencies as Bitcoin sheds 10%, now down 40% year-to-date What America’s gun fanatics won’t tell you","Apr 1, 2016 2:54 p.m. ET",1,Income-oriented investing is this year’s  biggest winner,https://www.marketwatch.com/story/income-oriented-investing-is-this-years-biggest-winner-2016-04-01
AAXJ,N/A,N/A,N/A,The Trading Deck,http://www.marketwatch.com/trading-deck
AAXJ,"ETF Daily Investors Thursday focused on a heavy dose of mixed economic data. With the long Memorial Day Holiday ahead, bulls were working on a ""stick save"" for the week. Overseas data also was mixed Thursday. China PMI Mfg Index rose but still sub-50 indicating weakness (49.7 vs. 48.3 expected and a prior 48.1); and Europe PMI Mfg Index declined (52.5 vs. 53.2 expected and a prior 53.4). U.S. data included jobless claims which fell (326,000 vs 310,000 expected and a prior 298,000); leading indicators fell (0.4% vs. 0.4% expected and a prior 0.8%). The Chicago Fed Activity Index fell (- 0.32 vs. a prior 0.34); existing home sales were better (4.65 million vs. 4.69 million expected and a prior 4.59 million). The PMI Manufacturing Index jumped (56.2 vs. 55.9 expected and a prior 55.4). In early trading bulls chose to focus on the positive PMI data and adroitly ignored what didn't please them. Leading market sectors higher included: Small Caps (IWM) IWM, +1.01%  , Banks KBE, +0.97%  , Materials XLB, +1.92%  , Small Cap Value VBR, +1.07%  , Tech QQEW, +1.36%  , Healthcare XLV, +0.76%  , Biotech IBB, +0.72%  , Homebuilders ITB, +1.28%  , Retail XRT, +0.98%  , Consumer Discretionary XLY, +1.40%  , Semiconductors SMH, +2.05%  , Solar TAN, +1.19%  , Emerging Markets VWO, +1.82%  , Australia EWA, +0.82%   Mexico EWW, +2.57%  , Canada EWC, +1.77%  , Turkey TUR, +3.79%  , Asia ex-Japan AAXJ, +1.80%  , Indonesia IDX, +1.89%  , Platinum PPLT, -0.56%  , Base Metals DBB, +0.00%   and Palladium PALL, -1.54%  . Leading market sectors lower included: Bonds TLT, +0.49%  , Japanese yen FXY, +0.58%  , Thailand THD, +0.34%  , Russia RSX, +2.66%  , natural gas producers FCG, +2.55%   and Singapore EWS, +2.42%  . The top 20 market movers by percentage change in volume whether rising or falling is available daily. Chart of the day iShares Russell 2000 Small Cap Index ETF (IWM) once again is shown on the weekly chart below. We've posted this market view a few times recently to demonstrate a possible bottom as the low (LO) indicator has accurately shown. Volume disappeared again on Thursday, challenging rally's credibility. Breadth per the WSJ was positive.  The NYMO is a market breadth indicator that is based on the difference between the number of advancing and declining issues on the NYSE. When readings are +60/-60 markets are extended short-term. The McClellan Summation Index is a long-term version of the McClellan Oscillator. It is a market breadth indicator, and interpretation is similar to that of the McClellan Oscillator, except that it is more suited to major trends. I believe readings of +1000/-1000 reveal markets as much extended. The VIX VIX, -12.68%  is a widely used measure of market risk and is often referred to as the ""investor fear gauge.” Our own interpretation is highlighted in the chart above. The VIX measures the level of put option activity over a 30-day period. Greater buying of put options (protection) causes the index to rise.  Friday should bring another light volume trading day as traders rather leave their posts early. Bond markets close early on Friday. Economic data is limited to important new home sales. Let's see what happens. Dave Fry is founder and publisher of ETF Digest and has covered U.S. and global ETFs since 2001. He is the author of ""Create Your own ETF Hedge Fund: A Do-It-Yourself Strategy for Private Wealth Management"" published by Wiley Finance and ""The Best ETFs: U.S. Equities, A Companion Guide to Building Your ETF Portfolio.” Follow ETF Digest on Twitter and become a fan on Facebook. More from MarketWatch How Russian Trolls Collected Americans' Personal Information More Coverage Three reasons the stock market’s fundamentals look solid Damn the torpedoes — what could take the S&P 500 to 3,000 Delta flight scare is a reminder never to put electronics in checked baggage Related Topics Exchange Traded Funds Markets Investing","May 22, 2014 10:02 p.m. ET",1,Bulls cherry pick data,https://www.marketwatch.com/story/bulls-cherry-pick-data-2014-05-22
AAXJ,"HONG KONG (MarketWatch) — Most Asian markets on Tuesday gained as fears about the euro zone subsided, with Japan recovering strongly due to a weaker yen and Australia falling following the latest Reserve Bank of Australia minutes. S&P: Brighter Outlook for China Property Market Regional stocks were the first to respond on Monday to news over the weekend that Cyprus planned to impose a tax on its depositors to lessen the cost of rescuing its financial system. Worries that the euro-zone crisis was flaring up again pushed the broad MSCI Asia ex-Japan index US:AAXJ  down 1.3% on Monday. But Asia appeared to have overreacted, as other regions posted more moderate declines. In Europe, the Stoxx 600 Index XX:SXXP   closed 0.2% lower on Monday, rebounding from a 1.2% intraday fall; while in the U.S., the Dow Jones Industrial Average US:DJIA   lost 0.4%. The U.S. dollar rose against the yen, US:USDJPY  recovering completely from Monday’s losses, and was at 95.38 late in Asia compared with 95.21 late Monday in New York. The euro US:EURUSD  was stable for most of the Asian session, though it dipped as the day progressed to $1.2922, compared with $1.2956 late Monday in New York. The single currency remained well above its lowest level since Dec. 10 at $1.288, touched during the previous session. Bank of Japan meeting The next event on the horizon for the yen is the Bank of Japan’s April policy meeting, where expectations are high that the central bank’s new leadership team will implement a more aggressive monetary policy. The U.S. dollar’s recovery against the yen translated into a rebound for Japanese stocks, with the Nikkei Stock Average JP:100000018  up 2% at 12,468.23. The market was hit particularly hard on Monday when it fell 2.7%, its biggest percentage decline in 10 months. “Monday’s reaction to the Cyprus situation wasn’t unexpected given stocks’ stellar performance over the past several weeks,” said Nicholas Smith, equity strategist at CLSA in Tokyo. Large constituents in the Nikkei that dipped in the previous session recovered on Tuesday. Exporters also recovered, supported by the weaker yen. Fast Retailing, US:FRCOY JP:9983  the company behind the Uniqlo chain of shops, added 2.8% and Canon US:CAJ JP:7751  rose 3.1%. Other markets that recovered on Tuesday include South Korea, where the Kospi KR:SEU   ended up 0.5% at 1,978.56; the Shanghai Composite CN:000001   in mainland China, which closed 0.8% higher at 2,257.43; and Singapore’s Strait Times Index, SG:STI  which finished up 0.4% at 3,269,13. Australian stocks started the day higher, but their recovery ground to a halt after minutes from the Reserve Bank of Australia’s March 5 policy meeting were published. Although the central bank said that a further cut in rates could be required, the minutes were taken as a sign that the central bank is unlikely to cut interest rates. The S&P ASX 200 AU:XJO   reversed a gain and ended in negative territory, down 0.6% at 4987.40. The other major market that failed to gain was Hong Kong, where the Hang Seng Index HK:HSI  lost 0.2% to 22,041.86. But a notable mover in Hong Kong was Samsonite International, US:SMSEY HK:1910  which jumped 4.6% after the market welcomed the luggage company’s latest set of earnings. More from MarketWatch This emerging-market ETF continues to blow away the competition BlackRock fund manager sees this as the market’s ‘sweet spot’ Don’t ever do this with your credit card Related Topics Asia Markets China Japan Australia Singapore Foreign Investment","Mar 19, 2013 7:28 a.m. ET",1,Most Asia shares up as Cyprus concerns ease,https://www.marketwatch.com/story/most-asia-shares-up-as-cyprus-concerns-ease-2013-03-19
