code,content,date,listening,title,url
OFC,"COLUMBIA, Md., Mar 01, 2018 (BUSINESS WIRE) -- Corporate Office Properties Trust (“COPT” or the “Company”) OFC, -1.16% executed a 60,000 square foot lease at 5801 University Research Court, a three-story, 71,000 square foot building under construction in the University of Maryland’s Discovery District. The Discovery District is a key piece of the university’s Greater College Park initiative, a $2 billion public-private investment to revitalize the Baltimore Avenue corridor and academic campus. The approximately 150-acre Discovery District will be an epicenter of academic, research, and economic development. Located at the intersection of the existing Green and future Purple Metro Lines, this mixed-use district will serve as a key gateway to the University of Maryland. The lease represents 84% of the building’s rentable square feet, and the start date is scheduled for July 2018. With this transaction, COPT’s active construction pipeline of 742,000 square feet in seven separate developments is now 91% leased. Company Information COPT is an office REIT that owns, manages, leases, develops and selectively acquires office and data center properties in locations that support the United States Government and its contractors, most of whom are engaged in national security, defense and information technology (“IT”) related activities servicing what it believes are growing, durable, priority missions (“Defense/IT Locations”). The Company also owns a portfolio of office properties located in select urban/urban-like submarkets in the Greater Washington, DC/Baltimore region with durable Class-A office fundamentals and characteristics (“Regional Office Properties”). As of December 31, 2017, the Company derived 88% of core portfolio annualized revenue from Defense/IT Locations and 12% from its Regional Office Properties. As of December 31, 2017 and including six buildings owned through an unconsolidated joint venture, COPT’s core portfolio of 156 office and data center shell properties encompassed 17.1 million square feet and was 95.1% leased. As of the same date, the Company also owned one wholesale data center with a critical load of 19.25 megawatts. Forward-Looking Information This press release may contain “forward-looking” statements, as defined in Section 27A of the Securities Act of 1933 and Section 21E of the Securities Exchange Act of 1934, that are based on the Company’s current expectations, estimates and projections about future events and financial trends affecting the Company. Forward-looking statements can be identified by the use of words such as “may,” “will,” “should,” “could,” “believe,” “anticipate,” “expect,” “estimate,” “plan” or other comparable terminology. Forward-looking statements are inherently subject to risks and uncertainties, many of which the Company cannot predict with accuracy and some of which the Company might not even anticipate. Accordingly, the Company can give no assurance that these expectations, estimates and projections will be achieved. Future events and actual results may differ materially from those discussed in the forward-looking statements. Important factors that may affect these expectations, estimates, and projections include, but are not limited to: general economic and business conditions, which will, among other things, affect office property and data center demand and rents, tenant creditworthiness, interest rates, financing availability and property values; adverse changes in the real estate markets including, among other things, increased competition with other companies; governmental actions and initiatives, including risks associated with the impact of a prolonged government shutdown or budgetary reductions or impasses, such as a reduction in rental revenues, non-renewal of leases, and/or a curtailment of demand for additional space by the Company's strategic customers; the Company’s ability to borrow on favorable terms; risks of real estate acquisition and development activities, including, among other things, risks that development projects may not be completed on schedule, that tenants may not take occupancy or pay rent or that development or operating costs may be greater than anticipated; risks of investing through joint venture structures, including risks that the Company’s joint venture partners may not fulfill their financial obligations as investors or may take actions that are inconsistent with the Company’s objectives; changes in the Company’s plans for properties or views of market economic conditions or failure to obtain development rights, either of which could result in recognition of significant impairment losses; the Company’s ability to satisfy and operate effectively under Federal income tax rules relating to real estate investment trusts and partnerships; possible adverse changes in tax laws; the Company's ability to achieve projected results; the dilutive effects of issuing additional common shares; and environmental requirements. The Company undertakes no obligation to update or supplement any forward-looking statements. For further information, please refer to the Company’s filings with the Securities and Exchange Commission, particularly the section entitled “Risk Factors” in Item 1A of the Company’s Annual Report on Form 10-K for the year ended December 31, 2017. View source version on businesswire.com: http://www.businesswire.com/news/home/20180301006316/en/ SOURCE: Corporate Office Properties Trust Corporate Office Properties Trust IR Contacts: Stephanie Krewson-Kelly, 443-285-5453 stephanie.kelly@copt.com or Michelle Layne, 443-285-5452 michelle.layne@copt.com Copyright Business Wire 2018 From MarketWatch How to Get a Job: Advice From Extremely Successful People More Coverage Why every investor should be terrified by the slide in Home Depot stock BlackRock fund manager sees this as the market’s ‘sweet spot’ Why tax refunds have lost their sparkle","Mar 1, 2018 4:16 p.m. ET",N/A,"COPT Leases 84% of 5801 University Research 
      Court Development",https://www.marketwatch.com/story/copt-leases-84-of-5801-university-research-court-development-2018-03-01
OFC,"COLUMBIA, Md., Mar 01, 2018 (BUSINESS WIRE) -- Corporate Office Properties Trust (“COPT” or the “Company”) OFC, -1.16% announced that its President & CEO, Stephen E. Budorick, will provide an overview of the Company and participate in a question and answer session at Citi’s 2018 Global Property CEO Conference. The presentation will be held on March 6, 2018 at 1:35 p.m. Eastern Time at The Diplomat Resort & Spa in Hollywood, Florida. A live audio webcast of the presentation and materials encompassing the information provided during the presentation and conference will be available in the ‘Investors’ section of the Company’s website, www.copt.com. The replay of the presentation will be available until 11:59 p.m. Eastern Time on March 20, 2018. Company Information COPT is an office REIT that owns, manages, leases, develops and selectively acquires office and data center properties in locations that support the United States Government and its contractors, most of whom are engaged in national security, defense and information technology (“IT”) related activities servicing what it believes are growing, durable, priority missions (“Defense/IT Locations”). The Company also owns a portfolio of office properties located in select urban/urban-like submarkets in the Greater Washington, DC/Baltimore region with durable Class-A office fundamentals and characteristics (“Regional Office Properties”). As of December 31, 2017, the Company derived 88% of core portfolio annualized revenue from Defense/IT Locations and 12% from its Regional Office Properties. As of December 31, 2017 and including six buildings owned through an unconsolidated joint venture, COPT’s core portfolio of 156 office and data center shell properties encompassed 17.1 million square feet and was 95.1% leased. As of the same date, the Company also owned one wholesale data center with a critical load of 19.25 megawatts. Forward-Looking Information This press release may contain “forward-looking” statements, as defined in Section 27A of the Securities Act of 1933 and Section 21E of the Securities Exchange Act of 1934, that are based on the Company’s current expectations, estimates and projections about future events and financial trends affecting the Company. Forward-looking statements can be identified by the use of words such as “may,” “will,” “should,” “could,” “believe,” “anticipate,” “expect,” “estimate,” “plan” or other comparable terminology. Forward-looking statements are inherently subject to risks and uncertainties, many of which the Company cannot predict with accuracy and some of which the Company might not even anticipate. Accordingly, the Company can give no assurance that these expectations, estimates and projections will be achieved. Future events and actual results may differ materially from those discussed in the forward-looking statements. Important factors that may affect these expectations, estimates, and projections include, but are not limited to: general economic and business conditions, which will, among other things, affect office property and data center demand and rents, tenant creditworthiness, interest rates, financing availability and property values; adverse changes in the real estate markets including, among other things, increased competition with other companies; governmental actions and initiatives, including risks associated with the impact of a prolonged government shutdown or budgetary reductions or impasses, such as a reduction in rental revenues, non-renewal of leases, and/or a curtailment of demand for additional space by the Company's strategic customers; the Company’s ability to borrow on favorable terms; risks of real estate acquisition and development activities, including, among other things, risks that development projects may not be completed on schedule, that tenants may not take occupancy or pay rent or that development or operating costs may be greater than anticipated; risks of investing through joint venture structures, including risks that the Company’s joint venture partners may not fulfill their financial obligations as investors or may take actions that are inconsistent with the Company’s objectives; changes in the Company’s plans for properties or views of market economic conditions or failure to obtain development rights, either of which could result in recognition of significant impairment losses; the Company’s ability to satisfy and operate effectively under Federal income tax rules relating to real estate investment trusts and partnerships; possible adverse changes in tax laws; the Company's ability to achieve projected results; the dilutive effects of issuing additional common shares; and environmental requirements. The Company undertakes no obligation to update or supplement any forward-looking statements. For further information, please refer to the Company’s filings with the Securities and Exchange Commission, particularly the section entitled “Risk Factors” in Item 1A of the Company’s Annual Report on Form 10-K for the year ended December 31, 2017. View source version on businesswire.com: http://www.businesswire.com/news/home/20180301005101/en/ SOURCE: Corporate Office Properties Trust Corporate Office Properties Trust IR Contacts: Stephanie Krewson-Kelly, 443-285-5453 stephanie.kelly@copt.com or Michelle Layne, 443-285-5452 michelle.layne@copt.com Copyright Business Wire 2018 From MarketWatch How Russian Trolls Collected Americans' Personal Information More Coverage Home sellers now use spycams to gather intel on prospective buyers Why tax refunds have lost their sparkle Trump boasts about making up facts about trade deficit to Trudeau","Mar 1, 2018 8:00 a.m. ET",N/A,"COPT to Present at Citi’s 2018 Global Property 
      CEO Conference",https://www.marketwatch.com/story/copt-to-present-at-citis-2018-global-property-ceo-conference-2018-03-01
OFC,"COLUMBIA, Md., Feb 22, 2018 (BUSINESS WIRE) -- Corporate Office Properties Trust (“COPT” or the “Company”) OFC, -1.05% announced today that its Board of Trustees declared the Company’s 81 [st] consecutive Common Share of beneficial interest quarterly dividend. The first quarter 2018 dividend of $0.275 per share represents an annualized amount of $1.10 per share, and is payable on April 16, 2018 to shareholders of record on March 30, 2018. Company Information COPT is an office REIT that owns, manages, leases, develops and selectively acquires office and data center properties in locations that support the United States Government and its contractors, most of whom are engaged in national security, defense and information technology (“IT”) related activities servicing what it believes are growing, durable, priority missions (“Defense/IT Locations”). The Company also owns a portfolio of office properties located in select urban/urban-like submarkets in the Greater Washington, DC/Baltimore region with durable Class-A office fundamentals and characteristics (“Regional Office Properties”). As of December 31, 2017, the Company derived 88% of core portfolio annualized revenue from Defense/IT Locations and 12% from its Regional Office Properties. As of December 31, 2017 and including six buildings owned through an unconsolidated joint venture, COPT’s core portfolio of 156 office and data center shell properties encompassed 17.1 million square feet and was 95.1% leased. As of the same date, the Company also owned one wholesale data center with a critical load of 19.25 megawatts. Forward-Looking Information This press release may contain “forward-looking” statements, as defined in Section 27A of the Securities Act of 1933 and Section 21E of the Securities Exchange Act of 1934, that are based on the Company’s current expectations, estimates and projections about future events and financial trends affecting the Company. Forward-looking statements can be identified by the use of words such as “may,” “will,” “should,” “could,” “believe,” “anticipate,” “expect,” “estimate,” “plan” or other comparable terminology. Forward-looking statements are inherently subject to risks and uncertainties, many of which the Company cannot predict with accuracy and some of which the Company might not even anticipate. Accordingly, the Company can give no assurance that these expectations, estimates and projections will be achieved. Future events and actual results may differ materially from those discussed in the forward-looking statements. Important factors that may affect these expectations, estimates, and projections include, but are not limited to: general economic and business conditions, which will, among other things, affect office property and data center demand and rents, tenant creditworthiness, interest rates, financing availability and property values; adverse changes in the real estate markets including, among other things, increased competition with other companies; governmental actions and initiatives, including risks associated with the impact of a prolonged government shutdown or budgetary reductions or impasses, such as a reduction in rental revenues, non-renewal of leases, and/or a curtailment of demand for additional space by the Company's strategic customers; the Company’s ability to borrow on favorable terms; risks of real estate acquisition and development activities, including, among other things, risks that development projects may not be completed on schedule, that tenants may not take occupancy or pay rent or that development or operating costs may be greater than anticipated; risks of investing through joint venture structures, including risks that the Company’s joint venture partners may not fulfill their financial obligations as investors or may take actions that are inconsistent with the Company’s objectives; changes in the Company’s plans for properties or views of market economic conditions or failure to obtain development rights, either of which could result in recognition of significant impairment losses; the Company’s ability to satisfy and operate effectively under Federal income tax rules relating to real estate investment trusts and partnerships; possible adverse changes in tax laws; the Company's ability to achieve projected results; the dilutive effects of issuing additional common shares; and environmental requirements. The Company undertakes no obligation to update or supplement any forward-looking statements. For further information, please refer to the Company’s filings with the Securities and Exchange Commission, particularly the section entitled “Risk Factors” in Item 1A of the Company’s Annual Report on Form 10-K for the year ended December 31, 2017. View source version on businesswire.com: http://www.businesswire.com/news/home/20180222006409/en/ SOURCE: Corporate Office Properties Trust Corporate Office Properties Trust IR Contacts: Stephanie Krewson-Kelly, 443-285-5453 stephanie.kelly@copt.com or Michelle Layne, 443-285-5452 michelle.layne@copt.com Copyright Business Wire 2018 From MarketWatch How to Run a Better Meeting: Advice From Extremely Successful People More Coverage Bloodbath for cryptocurrencies as Bitcoin sheds 10%, now down 40% year-to-date This emerging-market ETF continues to blow away the competition Delta flight scare is a reminder never to put electronics in checked baggage","Feb 22, 2018 4:16 p.m. ET",N/A,COPT Declares 81st Consecutive Common Dividend,https://www.marketwatch.com/story/copt-declares-81st-consecutive-common-dividend-2018-02-22
OFC,"Feb 09, 2018 (ACCESSWIRE via COMTEX) -- NEW YORK, NY / ACCESSWIRE / February 9, 2018 / Corporate Office Properties Trust OFC, -1.08% will be discussing their earnings results in their Q4 Earnings Call to be held on February 9, 2018 at 12:00 PM Eastern Time. To listen to the event live or access a replay of the call - visit https://www.investornetwork.com/company/1371 To receive updates for this company you can register by emailing info@investornetwork.com or by clicking get investment info from the company's profile. About Investor Network Investor Network (IN) is a financial content community, serving millions of unique investors market information, earnings, commentary and news on the what's trending. Dedicated to both the professional and the average traders, IN offers timely, trusted and relevant financial information for virtually every investor. IN is an Issuer Direct brand, to learn more or for the latest financial news and market information, visit www.investornetwork.com. Follow us on Twitter @investornetwork. SOURCE: Investor Network http://www.accesswire.com/img.ashx?id=488417 Copyright 2018 ACCESSWIRE From MarketWatch What Picking Up an Apple Tells You About the Future of Robotics More Coverage Delta flight scare is a reminder never to put electronics in checked baggage 2 sexy ways to get paid to save Damn the torpedoes — what could take the S&P 500 to 3,000","Feb 9, 2018 8:53 a.m. ET",N/A,Corporate Office Properties Trust to Host Earnings Call,https://www.marketwatch.com/story/corporate-office-properties-trust-to-host-earnings-call-2018-02-09
