code,content,date,listening,title,url
ACHN,"Achillion Pharmaceuticals Inc. ACHN, +0.00% shares fell in the extended session Tuesday after the drug developer reported promising early data on one of its kidney-disease treatments but said a large stakeholder was selling shares in a secondary offering. Achillion shares fell 9.2% to $3.35 after hours. Achillion said Johnson & Johnson Inc.'s JNJ, +0.55% venture capital arm, Johnson & Johnson Innovation-JJDC Inc., will sell 18.4 million shares of Achillion in a public offering and that Achillion would not receive proceeds. Achillion has 136.9 million shares outstanding. Separately, the company said early data from its mid-stage clinical trial for ACH-4471 showed the drug reduced protein in the urine by more than 50% in patients with C3 glomerulopathy, a rare disease where protein deposits build up in the kidneys.","Nov 14, 2017 4:34 p.m. ET",1,Achillion shares drop as J&J to sell large stake,https://www.marketwatch.com/story/achillion-shares-drop-as-jj-to-sell-large-stake-2017-11-14
ACHN,"Shares of Achillion Pharmaceuticals Inc. ACHN, +0.00% surged in the extended session Tuesday after the drug developer met expectations for second-quarter results and said early results of a blood disorder treatment look promising. Achillion shares rallied 33% to $5.35 after hours. The company said four patients so far enrolled in a mid-stage clinical study of ACH-4471, meant to treat paroxysmal nocturnal hemoglobinuria, were responding well to the drug. Paroxysmal nocturnal hemoglobinuria is a rare, acquired condition where the body's immune system destroys red blood cells in error. Achillion also reported a second-quarter loss of $22.5 million, or 16 cents a share, compared with a loss of $18.5 million, or 14 cents a share, in the year-ago period. Analysts surveyed by FactSet had forecast a loss of 16 cents a share.","Aug 8, 2017 5:38 p.m. ET",2,Achillion shares rally as blood disorder treatment shows promise,https://www.marketwatch.com/story/achillion-shares-rally-as-blood-disorder-treatment-shows-promise-2017-08-08
ACHN,"Everyone likes free offers. With the biotechnology stock sector so badly pummeled, that’s exactly what you find there now. The shares of many biotech companies have fallen so far, their market values are below their net cash. Buy the stock, and the price you paid is more than offset by company cash. In that way, you get the business for “free.” Amazingly, 50 to 70 biotech companies now trade for less than net cash, depending on how you measure “net cash.” In technical terms, they have a negative enterprise value (EV), which is market value minus cash plus debt. Fotolia.com Gene editing is a new way to treat diseases. Those have to be bargains, right? Well, not so fast. You can flip this logic around and conclude the stock market assigns zero value to these businesses because, well, that’s what they deserve. “When a company is down to its cash, something hasn’t gone right,” says John McCamant of the Medical Technology Stock Letter. “You can buy one at cash, and it can go to half cash. It’s definitely tricky,” says Mike Tung, a medical doctor and biotech-sector investor at Turner Medical Sciences Long/Short Fund US:TMSEX which has a great track record. It beats competitors by 8% a year annualized over the past three years, according to Morningstar. ‘The one thing that is going to make a big difference is when big pharmaceutical companies come out and make significant acquisitions.’ Paul Yook, BioShare Biotechnology Product Fund In other words, as much as it’s tempting to be contrarian, a lot of times the market has it right. Still, not all biotech companies trading at or below cash are absolute dogs. I’ll reveal five of the larger ones with the biggest cash positions below for you to check out on your own — if you promise to keep in mind the risks. Better to go with “almost free” but well-funded A big risk for small biotech companies trading below cash is that the “funding window” has virtually closed. While there have been several biotech initial public offerings (IPOs) in the past few days, IPOs and follow-on stock offerings have dried up. And we don’t know when that will change, points out Brad Loncar, a biotech aficionado and founder of Loncar Cancer Immunotherapy CNCR, +1.54% an exchange traded fund (ETF). Since those companies still have expenses, or cash burn, they might run out of money before they can get more. “Even the healthy biotech companies have to raise cash frequently. It is like oxygen,” he says. Rather than fish among tiny, and thus very risky, biotech companies trading below cash levels, better to look for more established, quality companies that have lots of cash. Even if they aren’t “free.” Read: Only biotech companies have braved IPO market this year Tung, at Turner Medical Sciences Long/Short Fund, likes the following criteria. He favors biotech companies that look cheap because they trade for 1.5 to two times cash levels, as long as they have several years worth of cash and promising pipelines. Examples? Tung cites Prothena PRTA, +0.52% a company with a late-stage therapy for an ailment that causes organ damage called amyloidosis. It also has a partnership with big pharmaceutical Roche RHHBY, -0.61% Another is Retrophin RTRX, +2.57% a drug-development company once led by controversial “pharma bro” Martin Shkreli. Tung also cites Achillion Pharmaceuticals ACHN, +0.00% a hepatitis C drug company that has a partnership with heavyweight Johnson & Johnson JNJ, +0.55% McCamant, at the Medical Technology Stock Letter, cites Sangamo Biosciences SGMO, -3.68% which is developing gene-editing therapies. It has validating partnerships with Shire SHPG, +3.36% and Biogen BIIB, +0.74% among others. Loncar cites cancer-immunotherapy and gene-therapy companies Juno Therapeutics US:JUNO and bluebird bio BLUE, -0.81% as promising biotech companies that are well-funded via partnerships, or because they raised capital when the biotech sector was much stronger. About those “free” biotech companies ... But what about the freebies — the biotech stocks trading below net cash? The concept of “free” (if very risky) biotech companies can be alluring. Not all of them have to be dogs. The business could go right. There are certainly plenty to choose from. Using data provided by S&P Global Market Intelligence, I found 48 biotech companies trading below enterprise value, defined simply as market value plus debt minus cash. Using a more nuanced definition that includes balance-sheet items that resemble cash and debt, like holdings in other companies and preferred stock, Paul Yook of the BioShare Biotechnology Product Fund BBP, +1.07% found 67 of them for me. Genzyme Goes Eco-Friendly With R&D Facility Many of these are ridiculously small, too small to consider. But here are three of the larger ones, just to cite some examples. I’m not suggesting them as “buys.” There’s QLT US:QLTI a $130 million market-value company with a negative enterprise value, or net cash surplus, of around $17 million. Then there’s Arbutus Biopharma ABUS, -0.99% which recently had a $158 million market value and a negative enterprise value of $37 million. The most extreme example is Avalanche Biotechnologies US:AAVL a $117 million market-value company that has a negative enterprise value as high as $160 million, depending on how you measure it. Though he’s not suggesting them as buys since that’s not his job, Yook tells me that two cash-rich biotechs with potentially promising technology include Flex Pharma FLKS, -2.53% doing very early stage research on a therapy for muscle cramping and spasms; and Trillium Therapeutics TRIL, +0.70% in cancer-therapy research. Microcap biotech companies like those are extremely risky, and you need to tread lightly. So kick the tires yourself. Don’t put too much money in them. Buy perhaps several of them to diversify. And understand you still might lose everything. During the biotech heyday, “a lot of biotech companies went public that should not have gone public,” says Tung. “A lot of these companies will ultimately fail.” In short, these are not “widow and orphan” stocks, because the risks are so high. Even biotech companies with seemingly limited downside risk because they already trade below cash can tumble hard. Avalanche Biotechnologies is a good example. It might have looked “safe” at around $6 at the end of January because its market value was well below its $269 million in cash. But then it promptly fell 30% to trade in the low-$4 range on outsized volume after announcing a merger. What might lift the clouds over biotech? Of course, none of those stocks will work unless the extremely negative sentiment toward biotech eases. Worries about price controls might persist until the elections are over. But at least three catalysts could break the negativity along the way, say biotech analysts. 1. “The one thing that is going to make a big difference is when big pharmaceutical companies come out and make significant acquisitions,” says Yook. “It’s a matter of when, not if, the mergers-and-acquisitions activity picks up. That will be a very important catalyst.” Will this happen? Who knows. But several biotech giants like Merck MRK, -1.13% say they’re already shopping. 2. Positive study results can hit at any moment. And they will flow for sure at important sector conferences like the American Society of Clinical Oncology (ASCO) meeting in early June. 3. At some point, investors might just wake up and realize a lot of biotech stocks look cheap. “The sector continues to be very productive in terms of new research, new medicines and sales,” says Yook. “The revenue growth is dramatic.” He says the 35 companies in his BioShares Biotechnology Products ETF, a collection of biotech companies with products on the market, may post 26% median sales growth this year. Yet, a lot of biotech stocks are cheap, despite the growth potential. Celgene CELG, +0.90% and Gilead Sciences GILD, +0.82% trade for price-to-earnings-to-growth (PEG) ratios of around 0.75. A PEG ratio below 1-1.5 (depending on the growth rate) suggests a stock is cheap, according to this yardstick developed by investing icon Peter Lynch. The big four — Celgene, Gilead, Amgen AMGN, +0.01% and Biogen — recently traded for only 11 times 2016 earnings, around all-time lows, says Yook. I’ll add that, at some point, we’ll see an end to the worries that have investors in “risk off” mode, an attitude that’s a huge negative for biotech stocks. Assuming, of course, that the U.S. is not going into a recession. That’s my guess. Companies are hiring and consumers aren’t overly burdened with debt, suggesting continued growth without a recession is the most likely scenario. At the time of publication, Michael Brush had no positions in any stocks mentioned in this column. During the past five years, Brush has suggested CELG, GILD, AMGN, BIIB, ACHN and SGMO in his stock newsletter Brush Up on Stocks. Brush is a Manhattan-based financial writer who has covered business for the New York Times and The Economist group, and he attended Columbia Business School in the Knight-Bagehot program. More from MarketWatch Why every investor should be terrified by the slide in Home Depot stock Damn the torpedoes — what could take the S&P 500 to 3,000 Bloodbath for cryptocurrencies as Bitcoin sheds 10%, now down 40% year-to-date","Feb 16, 2016 9:18 a.m. ET",2,Dozens of biotech companies are ‘free’ for investors’ taking,https://www.marketwatch.com/story/dozens-of-biotech-companies-are-free-for-investors-taking-2016-02-16
ACHN,"The markets had a big day on Tuesday, and most stocks we follow did well. Here are four with promise for continued momentum. Achillion Pharmaceuticals Achillion Pharmaceuticals Inc.Nov 17Dec 17Jan 18Feb 18Mar 18Source: MarketWatch US:ACHN $2.5 $3.0 $3.5 $4.0 $4.5 Achillion Pharmaceuticals Inc. ACHN, +0.00% which completed about a year-long decline in October, has since risen from about 6.50 to nearly 10.50. The stock has been consolidating for more than a month, successfully testing the 50-day moving average and rising channel bottom. On Tuesday it gained 37 cents to 10.42, or 3.68%, on 1.4 million shares. It's right up against resistance and looks like it wants to explode, with a shot at taking out the 11-11.10 range near term. Through that level, it could head up toward 12.75 potentially. Check out Harry’s video analysis of this stock on the last page. PREV PAGE 1 2 3 4 NEXT PAGE","Dec 31, 2015 11:58 a.m. ET",2,4 stocks to watch,https://www.marketwatch.com/story/4-stocks-to-watch-2015-12-31
ACHN,N/A,N/A,N/A,The Trading Deck,http://www.marketwatch.com/trading-deck
ACHN,"In this topsy-turvy market, we're going to look four stocks, two long and two short opportunities. Achillion Pharmaceuticals TimeAchillion Pharmaceuticals Inc.May 17Jul 17Sep 17Nov 17Jan 18Mar 18 US:ACHN $3 $4 $5 On the long side, Achillion Pharmaceuticals Inc. ACHN, +0.00%  ran up 91 cents, or 7.38%, to 13.24 on 5.2 million shares Tuesday. That was an increase in volume, but it needs to be more than that. The stock did snap back from an intraday low of 12.33. If it can break out of its bullish falling wedge, it should see 17.00. Beyond that, look for it to reach up to the low-to-mid 20.00s. Check out Harry’s video analysis of this stock on the last page. PREV PAGE 1 2 3 4 NEXT PAGE","Dec 3, 2014 3:41 p.m. ET",1,4 stocks to watch,https://www.marketwatch.com/story/4-stocks-to-watch-2014-12-03
ACHN,"With the Nasdaq up 10% off its lows this month, traders should be very careful up here. However, the trend is your friend, and the trend is still good, so here are six more momentum charts to watch. Achillion Pharmaceuticals TimeAchillion Pharmaceuticals Inc.May 17Jul 17Sep 17Nov 17Jan 18Mar 18 US:ACHN $3 $4 $5 Achillion Pharmaceuticals Inc. ACHN, +0.00%  popped out of its pattern on Tuesday, got up to 12.62, but it closed rather poorly, up only 17 cents to 11.94 on heavy volume of 6.6 million shares. It could be a sign of distribution, but it's still holding its moving averages, and it has broken back out and closed right on resistance at the 11.94-12.00 range. So let's just see if there's a follow-through, and if there is, look for a retest of the 13.80 range, and then 15.00. Check out Harry’s video analysis of this stock on the last page. PREV PAGE 1 2 3 4 5 6 NEXT PAGE","Oct 29, 2014 2:35 p.m. ET",1,6 stocks to watch,https://www.marketwatch.com/story/6-stocks-to-watch-2014-10-29
ACHN,"Here are six biotech stocks with strong recent momentum that should continue higher. Achillion Pharmaceuticals TimeAchillion Pharmaceuticals Inc.May 17Jul 17Sep 17Nov 17Jan 18Mar 18 US:ACHN $3 $4 $5 Achillion Pharmaceuticals Inc. ACHN, +0.00%  recently popped out of a wedge and pulled back for a couple of days on low volume, holding above the moving averages. On Tuesday, the stock followed through nicely, up 44 cents to 11.43. The key is going to be to take out 11.90 with volume, then 13.00, and if it gets through that, there's a lot of potential going forward to complete a fifth wave all the way up into the high teens. Check out Harry’s video analysis of this stock on the last page. PREV PAGE 1 2 3 4 5 6 NEXT PAGE","Oct 22, 2014 3:10 p.m. ET",1,6 stocks to watch,https://www.marketwatch.com/story/6-stocks-to-watch-2014-10-22
ACHN,"Strong upside reversals on Wednesday bode well for some of the stocks we follow. Here are six to watch. Achillion Pharmaceuticals TimeAchillion Pharmaceuticals Inc.May 17Jul 17Sep 17Nov 17Jan 18Mar 18 US:ACHN $3 $4 $5 Achillion Pharmaceuticals Inc. ACHN, +0.00%  gained 97 cents, or nearly 10%, to 10.73 on Wednesday, on volume of 8.2 million, the best in weeks. The month-long declining tops line appears to have been taken out, as the stock stuck its head out above resistance. ACHN is now right at the 10- and 21-day moving averages. If it can follow through here, next targets are 11.40 and 12.20. Check out Harry’s video analysis of this stock on the last page. PREV PAGE 1 2 3 4 5 6 NEXT PAGE","Oct 9, 2014 3:35 p.m. ET",1,6 stocks to watch,https://www.marketwatch.com/story/6-stocks-to-watch-2014-10-09
ACHN,"Getty Images The Nasdaq Composite Index is coming close to recovering from its epic loss when the dot-com bubble burst in 2000. The Nasdaq Composite Index has outperformed the record-setting S&P 500 Index of the largest U.S. stocks this year. And it’s climbing back to its record high set in March 2000, when the dot-com bubble burst. The tech-heavy Nasdaq had fallen so far at the start of the new millennium that it was difficult to imagine it would ever make up lost ground. But as MarketWatch’s Howard Gold discusses today, the Nasdaq Composite COMP, +1.64%  is close to completing an extraordinary recovery. The index comprises about 2,500 stocks, much fewer than there were in the late 1990s, and has become less beholden to the tech industry. Such shares now make up 44% of the total, down from 57% at the end of 2009. Sorry to say that Apple AAPL, +0.78%  isn’t among the best bets this year, even though a tour de force product rollout impressed investors. Here are the Nasdaq stocks with the best total returns this year: Best-performing Nasdaq stocks of 2014 COMPANY TICKER CLOSING PRICE - Sept. 9 TOTAL RETURN YTD TOTAL RETURN - 3 YEARS TOTAL RETURN - 5 YEARS BioFuel Energy Corp. BIOF $10.83 533% 95% -28% SinoCoking Coal & Coke Chemical Industries Inc. SCOK $7.09 511% 79% -36% InterMune Inc. ITMN $73.50 399% 182% 372% Pacific Ethanol Inc. PEIX $22.86 349% 296% -59% Cellular Biomedicine Group Inc. CBMG $22.27 337% 197% 960% Intercept Pharmaceuticals Inc. ICPT $283.09 315% N/A N/A RadNet Inc. RDNT $6.81 308% 148% 226% Achillion Pharmaceuticals Inc. ACHN $12.38 273% 113% 731% Identiv Inc. INVE $19.66 241% 13% -23% Plug Power Inc. PLUG $5.27 240% 208% -26% Total returns assume dividends are reinvested. Source: FactSet As you can see, this year’s best-performing Nasdaq stocks haven’t necessarily been top performers over longer periods. The Nos.1 and 2 this year — BioFuel Energy Corp. US:BIOF  of Denver and the tongue-twisting SinoCoking Coal & Coke Industries Inc. US:SCOK  of Henan Province, China — are five-year losers. BioFuel Energy saw most of its gains earlier this year, including a 132% jump March 30, after the company received a proposal from David Einhorn’s Greenlight Capital and James R. Brickman for a transaction through which BioFuel would acquire JBGL Capital LP and “certain subsidiaries” of JBGL Builder Finance LLC. Greenlight Capital also disclosed it had built up a 35.4% stake in BioFuel. BioFuel agreed to the deal June 10 for a price of $275 million. When adding up the current BioFuel stakes held by Greenlight and Brickman, plus the issuance of new shares to those parties as well as other interests held in BioFuel subsidiaries, Greenlight will end up with a 49.9% stake in BioFuel’s shares, while Brickman will own 8.4%. To further emphasize the high volatility of some Nasdaq stocks, shares of SinoCoking Coal & Coke Industries rose 143% on Tuesday, after the company said it was preparing to begin converting 21 million tons of coal into synthetic gas, which would generate a gross profit of $45 million in 2015. The third-best Nasdaq performer this year is InterMune Inc. US:ITMN  of Brisbane, Calif., a biotech firm that saw its share price rise 171% on Feb, 25, after saying results for a phase III study of its pirfenidone medication showed a significant reduction over a 52-week period for patients with idiopathic pulmonary fibrosis. Pirfenidone is the only treatment for idiopathic pulmonary fibrosis approved anywhere in the world, according to InterMune, and it’s marketed in the European Union and in Canada under the Esbriet brand. On Aug. 24, InterMune agreed to be acquired by Roche Holding AG RHHBY, -0.61%  of Basel, Switzerland, for $74 a share in cash, or roughly $8.3 billion. This sent InterMune’s shares up 35% the following day. Ranking fourth is Pacific Ethanol Inc. PEIX, +6.19%  of Sacramento, Calif., which has risen steadily since May, after pulling back from a peak of $18 in early April. The stock rose 65% on Feb. 27, after the company reported a fourth-quarter gross profit of $21.6 million, compared to a loss of $4.7 million a year earlier. More recently, second-quarter gross profit came in at $33.6 million, rising from $7 million a year earlier. Cellular Biomedicine Group Inc. CBMG, -3.84%  of Palo Alto, Calif., is next. The shares shot up 176% during June, when they began trading on the Nasdaq market. Other positive developments during June included positive results from a six-month phase I/IIa clinical trial of the company’s Rejoin treatment for osteoarthritis of the knee, and a $10 million common-share offering to private investors. More recently, the shares have dropped following Cellular Biomedicine Group’s announcement July 31 that the exit from its legacy consulting business would cost the company $840,000. It agreed Aug. 4 to acquire Agreen Biotech Co. Ltd. China for $3.28 million in cash and stock. Intercept Pharmaceuticals Inc. ICPT, +2.28%  of New York has seen its shares soar 315% this year. The main action was Jan. 9, when the shares nearly tripled after the company said it had stopped a trial of its obeticholic acid (OCA) treatment for nonalcoholic steatohepatitis, because an interim analysis showed “that the primary endpoint of the trial [had] been met.” Shares of RadNet Inc. RDNT, +3.97%  of Los Angeles have tripled this year. The stock gained 21% Aug. 8 after the outpatient diagnostic imaging services provider raised its guidance for 2014 revenue to a range of $705 million to $735 million from a previous forecast of $700 million to $730 million. RadNet also said its second-quarter earnings before interest, taxes, amortization and depreciation (EBITDA) was up 11% from a year earlier to $33.4 million. Achillion Pharmaceuticals Inc. ACHN, +0.00%  of New Haven, Conn., is up 273% this year, with the shares climbing steadily since the middle of August. The stock surged 171% during June. Two catalysts were the lifting of the Food and Drug Administration’s hold on Achillion’s trials of its Sovaprevir medication for treating hepatitis C, and speculation that the company could be a takeout target, after Idenix Pharmaceuticals Inc., a rival hepatitis C developer, agreed to be acquired by Merck & Co. MRK, -1.13% Identiv Inc. INVE, +1.63%  of Fremont, Calif., makes secure identification systems for physical and computer access control. A flurry of new-product launches led to a 23% increase in second-quarter revenue to $22.3 million, while gross profit rose 5% to $8.9 million, with the profit margin declining “primarily due to product mix.” The company is still running at a loss, as it focuses on expansion. On Wednesday, Identiv proposed a public offering of common shares, but didn’t say how much money it was trying to raise. The shares were down 10% in aftermarket trading. Rounding out the list of the 10 best-performing Nasdaq stocks this year is Plug Power Inc. PLUG, -1.05%  of Latham, N.Y., which makes fuel cells that can replace batteries in fork lifts and material-handling vehicles. The stock has pulled back from a high of $10.31 on March 10. The stock had risen 62% over two days, along with the stocks of fuel-cell competitors, before sinking 42% on March 11 and giving up more than it had gained the previous two sessions. Speculation appeared to run rampant, after Plug Power said Feb. 26 it had received a large order for 1,738 GenDrive fuel-cell units from Wal-Mart Stores Inc. WMT, +1.37% along with a lucrative six-year service contract. Plug Power’s second-quarter revenue totaled $17.3 million, more than doubling from $7.5 million a year earlier. The company’s operating loss rose slightly to $6.6 million. On the next page, find out about Nasdaq bargain stocks. Related Topics Markets U.S. Stocks Mutual Funds Exchange Traded Funds PREV PAGE 1 2 NEXT PAGE","Sept 11, 2014 5:38 p.m. ET",10,10 Nasdaq stocks with returns of at least 240% in 2014,https://www.marketwatch.com/story/10-nasdaq-stocks-with-returns-of-at-least-240-in-2014-2014-09-11
ACHN,"A lot of charts we follow continue to act well, and here are five more to watch. Achillion Pharmaceuticals Inc. ACHN, +0.00%  has been moving well or consolidating bullishly each day. In the last three weeks, it has popped, coiled, popped again, and formed a little mini-wedge. On Tuesday, it popped out of that wedge, up 70 cents, or 6%, to 12.27 on 10.4 million shares, the best volume in three sessions. If it gets through this zone, look for 14. Check out Harry’s video analysis of this stock on the last page. PREV PAGE 1 2 3 4 5 NEXT PAGE","Sept 3, 2014 1:38 p.m. ET",1,5 stocks to watch,https://www.marketwatch.com/story/5-stocks-to-watch-2014-09-03
ACHN,"Here are six stocks whose charts are showing signs of price acceleration. Achillion Pharmaceuticals Inc. ACHN, +0.00%  has really performed well for us. It broke out mid month, flagged, and has moved up through resistance in the last two sessions. On Tuesday, it gained 97 cents, or 9%, to 11.75 on 20 million shares, the third consecutive day of increasing volume. The stock has formed a short-term channel that could test 12.50-13.00 as early as Wednesday. Check out Harry’s video analysis of this stock on the last page. PREV PAGE 1 2 3 4 5 6 NEXT PAGE","Aug 27, 2014 1:47 p.m. ET",2,Six stocks to watch,https://www.marketwatch.com/story/six-stocks-to-watch-2014-08-27
