code,content,date,listening,title,url
ACIW,"NEW YORK (MarketWatch) — Shares of the following companies were among those making sizable moves in Tuesday’s U.S. stock market: Advancers Baidu Inc.’s BIDU, +0.04%  U.S.-listed shares gained 5% after the Chinese search engine projected third-quarter sales above Wall Street’s forecasts. Obama on Economic Effects of Debt Crisis, Taxes Broadcom Corp.’s BRCM  shares advanced 9.5% after the supplier of chips for Apple Inc.’s AAPL, +0.78%  wireless devices projected third-quarter sales that exceeded estimates. Lexmark International Inc.’s LXK, +0.00%   shares rallied 18% after the printer maker reported second-quarter earnings that beat market forecasts. RadioShack Corp.’s RSH, -0.07%   shares rallied 20% to $15.65 after the consumer-electronics retailer said it would begin offering products and services from Verizon Wireless, which is owned by Verizon Communications VZ, -0.37% and Vodafone Group VOD, +0.54%   in mid-September. S1 Corp.’s SONE, +7.07%  shares jumped after payment-software provider ACI Worldwide Inc. ACIW, +0.81%  offered to acquire the provider of financial-services software for about $540 million in cash and stock. Shares of ACI Worldwide advanced 3.8%. Supervalu Inc.’s SVU, -1.42%  shares climbed 8% after the grocery-store operator reported first-quarter earnings that topped estimates. Tellabs Inc.’s TLAB   shares rose 11% after the provider of telecommunications-services equipment reported second-quarter results. Weatherford International Ltd.’s WFT, +0.88%  U.S.-listed shares gained 11% after the Swiss oil-field services provider reported a higher-than-anticipated second-quarter profit. Decliners AK Steel Holding Corp.’s AKS, +5.84%  shares shed 16% after it reported second-quarter profit below expectations. Other steel producers also dropped, with United States Steel Corp. X, +4.92%  down 8.7%. Illinois Tool Works Inc.’s ITW, +1.82%   shares were off 8.8% after the industrial materials-maker reported second-quarter net income and sales under market expectations. Netflix Inc.’s NFLX, +3.35%  shares fell 7.8% a day after the film-rental service projected third-quarter sales and profit would come in below market expectations. Paccar Inc.’s PCAR, +2.59%   shares declined 11% after the truck manufacturer reported a doubling in second-quarter profit, which still fell short of expectations. STMicroelectronics NV’s STM, +0.63%  U.S.-listed shares declined 8.7% after the semiconductor maker late Monday reported second-quarter profit below market expectations. Waters Corp.’s WAT, +0.04%   shares lapsed 8.2% after the maker of scientific instruments reported a second-quarter profit that missed estimates. More from MarketWatch Why tax refunds have lost their sparkle Stephen Hawking’s final Reddit post is going viral over its ominous warning about robots Why every investor should be terrified by the slide in Home Depot stock Related Topics U.S. Stocks Markets Investing","July 26, 2011 2:24 p.m. ET",1,Tuesday’s biggest gaining and declining stocks,https://www.marketwatch.com/story/tuesdays-biggest-gaining-declining-stocks-2011-07-26
ACIW,"NEW YORK (MarketWatch) — U.S. stock futures rose slightly Tuesday as markets geared up for a busy day of earnings from blue chips like 3M Co. as well as Ford Motor Co. and a clutch of economic data, while keeping eyes trained on the debt-ceiling talks in Washington. Futures on the Dow Jones Industrial Average DJ1U  gained 2 points to 12,552, while those on the Standard & Poor’s 500 index SP1U  added 2.1 points to 1,335.60. Futures on the Nasdaq 100 index ND1U  rose 2.75 points to 2,426.25. U.S. Debt-Ceiling Standoff Continues The dollar remained lower against most major rivals, as investors eyed the gridlock in talks to raise the U.S. debt ceiling. The dollar index DXY, -0.09% which tracks the greenback’s performance against a basket of six other currencies fell to 73.652. Read more on broad-based retreat for the dollar. Late Monday, President Barack Obama praised a plan proposed by Senate Democrats and called for a compromise on cutting the federal deficit and raising the debt ceiling in the next few days. Meanwhile, House Speaker John Boehner said Congress should back a rival plan proposed by Republicans. Just days are left before the U.S. could begin defaulting on its debt obligations if a deal to raise the debt ceiling isn’t reached. “Markets seem to be expressing all of their fear through the [dollar], and still don’t know what to do about Treasurys with the U.S. 10-year yield bobbing around the 3.0% level for the last few days,” said Richard Kelly, head of European rates and foreign-exchange research at TD Securities. Obama’s White House address “didn’t do much to clarify the outlook, and markets will be headline-watching again today for developments in the U.S.,” he said in a note. The Dow Jones Industrial Average DJIA, +1.07%  fell 88.36 points, or 0.7%, to close at 12,592.80 on Monday, after touching a low of 12,536.19 earlier in the session. Economic data could act as somewhat of a distraction. The Case-Shiller index tracking home prices for May showed a 1% increase for May from April. It tracks changes in prices across 20 metropolitan areas. At 10 a.m. Eastern, new home sales for June and the Conference Board’s survey on U.S. consumers’ confidence for July will be released. The earnings calendar was busy Tuesday, with Amazon.com Inc. AMZN, +1.11%  standing out among those expected after the closing bell. 3M’s shares lapsed 2.7% after the provider of industrial supplies and Dow component MMM, +1.38%   reported slowing demand for films for LCD televisions. Ford F, +2.03%  posted second-quarter net income of $2.4 billion a year, versus $2.6 billion in the year-ago period, with earnings per share at 59 cents against 61 cents. Quarterly revenue rose 13% to $35.5 billion. Broadcom Corp. BRCM  gained in pre-market trading after forecast-beating earnings and a revenue forecast that was also ahead of expectations, in results out late Monday. U.S.-listed shares of Baidu.com BIDU, +0.04%  rose in pre-market trading after the company said Monday that second-quarter earnings jumped 95% against the prior-year period and revenue rose 78%. It also predicted a 75.1% to 79.5% year-on-year rise in revenue for the third quarter. However, shares of Netflix Inc. NFLX, +3.35%  fell after the company late Monday warned that the new customer growth will fall year-over-year owing to a recent 60% hike in prices, along with reporting second-quarter profit growth of 55%. U.S.-listed shares of STMicroelectronics NV STM, +0.63%  (STM) dropped after a weak outlook released along earnings late Monday disappointed analysts. Shares of Texas Instruments Inc. TXN, +1.94%  could be in focus after the company reported a second-quarter drop in profit late Monday, owing to “lukewarm” demand from back-to-school and holiday shoppers. Away from earnings, shares of S1 Corp. SONE, +7.07%  jumped over 12%. ACI Worldwide Inc. ACIW, +0.81%  offered to buy all outstanding company stock for $9.50 a share in a cash-and-equity deal valued at around $540 million. European stocks traded lower, driven south as shares of BP PLC BP, +2.37%  (BP.) and UBS AG UBS, +0.40%  (UBSN) both fell on earnings disappointment, pressuring the Stoxx Europe 600 index (SXXP). Asia stocks mostly rose overnight, though shares in Mumbai fell sharply after the Reserve Bank of India raised its lending rates by half a point, more than double what economists expected. In commodities lately, gold futures for August delivery GC1Q   fell 60 cents to $1,611.60 an ounce, while crude oil for September delivery CL1U   rose 55 cents to $99.75 a barrel. More from MarketWatch Home sellers now use spycams to gather intel on prospective buyers Why every investor should be terrified by the slide in Home Depot stock Delta flight scare is a reminder never to put electronics in checked baggage Related Topics Futures Commodities Markets Commodity Futures Trading Commission","July 26, 2011 9:22 a.m. ET",1,"U.S. stock futures rise; debt talks, data in focus",https://www.marketwatch.com/story/us-stock-futures-flat-debt-talks-data-in-focus-2011-07-26
ACIW,"FRANKFURT (MarketWatch) -- ACI Worldwide Inc. ACIW, +0.81% on Tuesday offered to purchase all outstanding shares of S1 Corp. SONE, +7.07% a provider of banking-transaction software, for $9.50 a share in a cash-and-stock transaction valued at around $540 million. ACI, a provider of payment software, said it believes its offer is superior to a deal announced last month that would combine S1 with Fundtech Ltd. fndt A representative of S1 couldn't immediately be reached for comment. ACI said its proposal represents a 33% premium to S1's market price on Monday. ""We are confident S1 shareholders will share our strong belief that ACI's premium proposal is superior to and provides S1 shareholders with significantly greater value than the pending transaction with Fundtech,"" said ACI Worldwide Chief Executive Philip G. Heasley.","July 26, 2011 7:38 a.m. ET",1,ACI Worldwide seeks to buy S1 in $540 million deal,https://www.marketwatch.com/story/aci-worldwide-seeks-to-buy-s1-in-540-million-deal-2011-07-26
ACIW,"(Updates to add analyst comments and a new stock quote.) NEW YORK (DOW JONES) -- Fundtech Ltd. FNDT confirmed the software company is in preliminary talks with suitors that have expressed interest in a possible merger or acquisition, although it said no agreement has been reached. Shares of Fundtech were recently up 16% to $20.10 amid a broad market rally. In response to media reports, Fundtech--which licenses software products to banks--said one of the deals being discussed was a merger with a U.S.-based company. Additionally, Fundtech was recently approached by a multinational firm expressing interest in an acquisition. D.A. Davidson analyst John Kraft said he wasn't surprised Fundtech was an acquisition target, saying the company offers ""a pretty narrow niche with a great customer base and a great reputation within the product suite."" Kraft said growing volume of banking payments is causing big banks to reevaluate legacy systems and seek out vendors that can help them better process those payments. He said more banks were looking for expert help rather than looking in house for solutions. According to Kraft, possible suitors were most likely direct competitors. He named Bottomline Technologies Inc. EPAY, +2.40% as the most likely, as the provider of payment, invoice and document automation software has been acquisitive recently and has a chunk of cash on its balance sheet. Another possible suitor is ACI Worldwide Inc. ACIW, +0.81% according to Kraft. Representatives from Bottomline and ACI weren't immediately available to comment. Shares of Bottomline were up 3.5% to $22.76, while ACI's stock rose 3% to $29.83. In a prepared statement, Fundtech said it doesn't intend to make any additional comments regarding the talks until a formal agreement is reached or it is otherwise required to issue a statement. Last month, Fundtech reported its first-quarter profit surged 71% on across-the-board revenue increases from software, maintenance and services. During the quarter, the company closed on 110 new deals and added four new bank customers. Fundtech's customers include Bank of America Corp. (BAC), Barclays PLC (BCS, BARC.LN) and HSBC Holdings PLC (HBC, HSBA.LN), according to Kraft. More from MarketWatch Why It Feels Like Facebook Is Listening Through Your Mic More Coverage 2 sexy ways to get paid to save S&P 500 logs longest losing streak of the year as trade-war jitters weigh What America’s gun fanatics won’t tell you","June 14, 2011 3:34 p.m. ET",1,Fundtech confirms talks with merger suitors,https://www.marketwatch.com/story/fundtech-confirms-talks-with-merger-suitors-2011-06-14
ACIW,"NEW YORK (MarketWatch) -- Shares of the following companies were among those that made noteworthy moves in the U.S. stock market on Thursday: Advancers ACI Worldwide Inc. ACIW, +0.81% shares gained 9.9% after the electronic-transaction software maker posted quarterly results that topped estimates. MARKETS | • The Tell: Market news and analysis • | Canada section • Columns: Stocks | Oil | Gold | Bonds | Dollar  TOOLS AND DATA | • My Portfolio: Know where your funds are? • Real-time currency exchange rates • After-hours stock screener Coca-Cola Enterprises Inc. CCE, +0.56% shares advanced nearly 33% after Coca-Cola Co. KO, +0.25% said it plans to acquire the North American operations of the bottler. Shares of Coca-Cola fell 3.7%. Dr Pepper Snapple Group Inc. DPS, +0.02% shares gained just over 11% after the beverage company reported fourth-quarter financial results. Express Scripts Inc. ESRX, -0.93% shares were ahead 8.5% after the pharmacy benefits manager reported better-than-anticipated results for the fourth quarter. Faro Technologies Inc. FARO, +1.83% shares jumped more than 15% after Needham & Co. Inc. raised its rating on the software maker from hold to buy. Iron Mountain Inc. IRM, +0.46% shares climbed 7.1% after the data storage firm reported fourth-quarter results and announced a $150 million stock buyback program. Mylan Inc. MYL, +1.65% shares gained 6.6% after the drug company reported sales of generic drugs climbed in the fourth quarter. Polypore International Inc. PPO shares advanced 9.4% after the manufacturer of medical-device filters reported earnings that topped estimates. Smith Micro Software Inc. SMSI, +7.36% shares rose more than 18% after the software maker for mobile devices reported adjusted quarterly earnings ahead of estimates. True Religion Apparel Inc. TRLG share gains topped 18% after the jeans retailer reported a fourth-quarter profit that exceeded Wall Street's estimates. Decliners American Dairy Inc. ADY, -0.77% shares declined more than 11% after the Chinese maker of infant formula had its share-price estimate cut at Roth Capital Partners. Anadys Pharmaceuticals Inc. ANDS shares fell almost 13% after the development-stage drug company reported disappointing test results on its hepatitis C treatment. Blockbuster Inc. BBI, +4.00% shares tumbled more than 17% as analysts questioned the ability of the video- rental chain to pay off its debts. Gibraltar Industries Inc. ROCK, +0.15% shares dropped almost 19% after the metal parts producer reported a loss for the fourth quarter while analysts expected a gain. GameStop Corp. GME, -10.81% shares fell 7.2% after the video-game retailer said its CFO quit after six months for a job at Wal-Mart Stores Inc. WMT, +1.37% Holly Corp. HOC, +0.00% shares were down 7.8% after the petroleum refiner reported a 40.6 million loss in the fourth quarter. Palm Inc. PALM, -2.60% shares fell more than 19% after the smartphone manufacturer said it would generate third-quarter revenue under expectations. Read detailed account of Palm's lower-than-projected sales. PC Mall Inc. MALL, +1.10% shares slipped 8.3% after the online computer and electronics retailer reported disappointing preliminary results for the fourth quarter. Revlon Inc. REV, +0.98% shares fell 6.7% after the cosmetics maker reported quarterly sales under what analysts had estimated. More from MarketWatch What Picking Up an Apple Tells You About the Future of Robotics More Coverage Bloodbath for cryptocurrencies as Bitcoin sheds 10%, now down 40% year-to-date Trump boasts about making up facts about trade deficit to Trudeau Three reasons the stock market’s fundamentals look solid Related Topics U.S. Stocks Markets Investing","Feb 25, 2010 5:17 p.m. ET",1,Thursday's biggest gaining and declining stocks,https://www.marketwatch.com/story/thursdays-biggest-gaining-and-declining-stocks-2010-02-25
ACIW,"Free Preview For full access, Log in or Subscribe Now and get 4 weeks free! Monday's analysis CINCINNATI (MarketWatch) - For weeks now, the Dow industrials and the S&P 500 have repeatedly hit multi-year lows. Meanwhile, the Nasdaq has been a minor ""bright"" spot, avoiding new yearly lows of its own. To continue reading, please subscribe. Already a Subscriber? Log in Subscribe Now AND GET 4 WEEKS FREE Actionable trading strategies Easy-to-follow guidance Weekly market navigational tool More from MarketWatch Why It Feels Like Facebook Is Listening Through Your Mic More Coverage My husband sold his grandmother’s house and paid off our mortgage — now his family is threatening to sue Why tax refunds have lost their sparkle S&P 500 logs longest losing streak of the year as trade-war jitters weigh","Mar 9, 2009 9:55 a.m. ET",N/A,Nasdaq positioned to test major support,https://www.marketwatch.com/story/nasdaq-positioned-test-major-support-mondays
ACIW,"SAN FRANCISCO (MarketWatch) -- Among the companies whose shares are likely to see active trading Monday are Adobe Systems, H&R Block and CSK Auto. Adobe Systems Inc. ADBE, +1.67% is forecast to report earnings of 48 cents a share in the fourth quarter, according to analysts polled by Thomson Financial. H&R Block Inc. HRB, +1.03% is expected to report a loss of 37 cents in its fiscal second quarter. CSK Auto Corp. CAO, +1.72% is projected to post earnings of 9 cents a share in the third quarter. ACI Worldwide Inc. ACIW, +0.81% is estimated to report earnings of 33 cents a share in the fourth quarter. After Friday's closing bell, Google Inc. GOOG, +2.71% said it debuted a new service that takes aim at online encyclopedia Wikipedia. Google is calling the service ""knols,"" and made the announcement on one of the company's corporate blogs. Udi Manber, a vice president of engineering at Google, said the term knol stands for a unit of knowledge, and that the service is currently being privately tested. Watch List LM Ericsson Telephone Company ERIC, +0.63% XM Satellite Radio Holdings XMSR Ross Stores Inc. ROST, +2.39% Patterson-UTI Energy, Inc. PTEN, +1.86% and Sepracor Inc. SEPR will be removed from the Nasdaq-100 Index as part of its annual re-ranking, effective Monday, Dec. 24, the Nasdaq Stock Market said late Friday. Replacing those stocks will be Hologic, Inc. HOLX, -0.08% Focus Media Holding Ltd. FMCN Hansen Natural Corp. HANS Steel Dynamics, Inc. STLD, +3.56% and Stericycle, Inc. SRCL, -0.37% Callaway Golf Co. ELY, +0.62% and TaylorMade Golf Co. have agreed to settle a patent license dispute. Under the agreement, each company will get specified rights to make products under patents owned by the other, covering such products as drivers, irons and golf balls. Callaway said specific details of the agreement are confidential. Cameron International Corp.'s CAM, -1.67% President and Chief Operating Officer Jack Moore will replace Sheldon Erikson as chief executive. Erikson will maintain his role as chairman. The flow-equipment provider named Charles Sledge, currently vice president and corporate controller, to be financial chief. Both appointments will become effective April 1, the company said. Franklin Resources Inc. BEN, +1.67% raised its quarterly dividend to 20 cents a share, up 33.3% from the previous quarter, the company said. The dividend is payable on Jan. 11 to stockholders of record on Dec. 28. Intel Corp. INTC, +5.00% will stop promoting its ""Viiv"" brand of Internet video programming that connects to living room televisions, The Wall Street Journal said on its Web site. The newspaper said the company announced plans to use a modified version of the brand on chips in entertainment-oriented computers that use dual-processor chips. Nanogen Inc. NGEN Vice President and Chief Financial Officer Robert Saltmarsh will retire at the end of February and will be succeeded by Nick Venuto, who is currently executive director of finance. Nortel Networks Corp. NT filed a lawsuit against Vonage VG, +1.43% alleging that Vonage violated nine patents related to Internet phone services, the Wall Street Journal reported on its Web site late Friday, citing a Nortel spokesman. The spokesman told the newspaper that the lawsuit countered claims made by Vonage that Nortel had violated three of its patents. Nymex Holdings Inc. NMX, +8.20% the parent company of the New York Mercantile Exchange Inc., will raise per contract fees for NYMEX and COMEX futures and options products. Nymex said NYMEX futures and options fees will rise 10 cents for members and 5 cents for cross-division trades. Nymex non-member customer rates will remain unchanged, the company said. COMEX futures and options fees on the trading floor will increase 20 cents per side for members, 15 cents per side for cross division trades, and 10 cents per side for customers, the company said. SLM Corp. SLM, +1.91% said Chairman Albert Lord will take on the added title and responsibilities of chief executive officer. C.E. Andrews, the previous CEO, will become president, SLM said. More from MarketWatch Uber for Bikes Could Save Your Commute More Coverage S&P 500 logs longest losing streak of the year as trade-war jitters weigh Jobless claims drop 4,000 to 226,000 My husband sold his grandmother’s house and paid off our mortgage — now his family is threatening to sue Related Topics U.S. Stocks Markets Investing","Dec 15, 2007 2:36 p.m. ET",1,In focus for Monday,https://www.marketwatch.com/story/in-focus-for-monday
