code,content,date,listening,title,url
ACER,"Equity offerings from a number of companies priced late Wednesday or early Thursday. Opexa Therapeutics Inc.'s OPXA, -9.36% offering of 1.1 million units priced at a 2% premium to Wednesday's close. Units fell 4.5% in recent trading to $2.81, below the $3 per-unit offer price. Each unit consists of one share of common stock and a warrant to purchase one-half share of common stock. Opexa, which is developing Tcelna, a novel T-cell therapy for multiple sclerosis, had about 23 million shares outstanding as of Nov. 14. Separately, BreitBurn Energy Partners LP BBEP said its 13-million-unit offering priced at a 5.9% discount to Wednesday's close. The partnership will have more than 97.7 million units outstanding after the offering. Units slipped 3.9% to $19.82 in recent trading, below the offer price of $19.86 per unit. Hudson Pacific Properties Inc. HPP, +0.03% said its offer of eight million shares--increased from 7.5 million--priced at a 2.8% discount to Wednesday's close. Shares edged down 14 cents to $21.97 in recent trading but remained above the offer price of $21.50 per share. Before the offering, the company had about 47.5 million shares outstanding. Hudson said it will use the proceeds to fund development or redevelopment activities, fund potential acquisition opportunities, repay borrowings outstanding under its unsecured revolving credit facility and for general corporate purposes. Subscribe to WSJ: http://online.wsj.com?mod=djnwires More from MarketWatch How to Run a Better Meeting: Advice From Extremely Successful People More Coverage What America’s gun fanatics won’t tell you Three reasons the stock market’s fundamentals look solid Why every investor should be terrified by the slide in Home Depot stock","Feb 7, 2013 12:06 p.m. ET",1,"Opexa, BreitBurn, Hudson Pacific price offerings",https://www.marketwatch.com/story/opexa-breitburn-hudson-pacific-price-offerings-2013-02-07
ACER,"Opexa Therapeutics Inc. OPXA, -9.36% granted an exclusive license option to Germany-based Merck KGaA's (MKGAY, MRK.XE) biopharmaceutical division for the development and commercialization of Opexa's lead product candidate, Tcelna, for multiple sclerosis in a deal potentially valued at $225 million. The drug developer's shares more than quadrupled to $5.40 in premarket trading. Under the deal, Opexa will receive an upfront payment of $5 million, a licensing fee of either $25 million or $15 million after the licensing option is exercised, and potential milestone payments of as much as $195 million. Tcelna, which is in Phase IIb trials in patients with secondary progressive MS, has received fast-track designation from the U.S. Food and Drug Administration. German Merck gains global development and commercial rights to Tcelna for MS, excluding Japan. Subscribe to WSJ: http://online.wsj.com?mod=djnwires More from MarketWatch What Picking Up an Apple Tells You About the Future of Robotics More Coverage Stephen Hawking’s final Reddit post is going viral over its ominous warning about robots BlackRock fund manager sees this as the market’s ‘sweet spot’ Why every investor should be terrified by the slide in Home Depot stock","Feb 5, 2013 9:37 a.m. ET",1,Opexa Therapeutics grants drug license to Merck,https://www.marketwatch.com/story/opexa-therapeutics-grants-drug-license-to-merck-2013-02-05
ACER,"NEW YORK (MarketWatch) — Stocks moving significantly in trading Wednesday included Family Dollar Stores, Mattson Technology, Opexa Therapeutics and Vonage Holdings. Advancers American International Group Inc. AIG, -0.18%  shares gained 4.2% after the insurer said in a letter released by regulators late Tuesday that it had been offered as much as $3 billion for its unit in Taiwan. Autodesk Inc. ADSK, +0.83%   shares climbed 7% after Goldman Sachs hiked its rating on the software company to buy from neutral. Ceradyne Inc. CRDN   shares climbed 6.3% after ThinkEquity LLC upgraded the maker of military body armor from equal weight to overweight. Diamond Offshore Drilling Inc. DO, +2.95%  shares rose 5.3%. Glu Mobile Inc. GLUU, +1.89%  shares advanced almost 21%. The game publisher for smartphones and tablets said it is working with Nvidia Corp. NVDA, +4.63%  to develop games that highlight the Android operating system and the Tegra 2 mobile superchip. Shares of Nvidia rose 7.7%. CES: How a 92-Inch 3-D TV Measures Up Opexa Therapeutics Inc. OPXA, -9.36%  shares soared almost 54%. The cell-therapy company said it is preparing a Phase III clinical study of Tovaxin to treat multiple sclerosis. Priceline.com Inc. PCLN   shares gained 5.9%. Qiao Xing Universal Resources Inc.’s XING  U.S.-listed shares gained 16% after the Chinese miner said it completed its purchase of a 34.5% stake in a Mongolian mine. Sonic Corp. SONC, -0.04%  shares rose 12% after the drive-in restaurant chain late Tuesday reported a jump in first-quarter profit. Sprint Nextel Corp. S, +0.41%   shares rose almost 4%. Vonage Holding Corp. VG, +1.43%   shares added more than 14% after the online phone carrier reported net line additions in its fourth quarter. Decliners Family Dollar Stores Inc. FDO, +7.10%  shares fell 8.8%. The discount retailer reported first-quarter results and offered a forecast that fell short of analysts’ expectations. Other discount retailers also fell, with Dollar Tree Inc. DLTR, +1.05%   off 4.6%. Read more about Family Dollar’s results, forecast. Mattson Technology Corp. MTSN   shares tumbled 11%. The chip-equipment maker cut its forecast for its fourth-quarter loss, revenue and gross margin, citing a delay in tool shipments. Tasty Baking Co. TSTY   shares dropped 37%. The company said that due to lower-than-expected cost savings from a new plant plus the recent bankruptcy filing by Great Atlantic & Pacific Tea Co., liquidity at Tasty Baking is “extremely tight.” The company is in talks with its banks and creditors about its finances, and it has retained Janney Montgomery Scott to help it assess strategic options. Trident Microsystems Inc. TRID  shares slumped 14.7%. The developer of integrated circuits for digital-media applications estimated a wider-than-expected fourth-quarter adjusted loss. More from MarketWatch Jobless claims drop 4,000 to 226,000 Damn the torpedoes — what could take the S&P 500 to 3,000 Delta flight scare is a reminder never to put electronics in checked baggage Related Topics U.S. Stocks Markets Investing","Jan 5, 2011 4:27 p.m. ET",1,Wednesday’s biggest gaining and declining stocks,https://www.marketwatch.com/story/wednesdays-biggest-gaining-and-declining-stocks-2011-01-05
ACER,"BOSTON (MarketWatch) — GlaxoSmithKline PLC was the biggest decliner among the large-cap pharmaceutical stocks Tuesday in the wake of a scathing report by “60 Minutes” on the U.K. drug giant’s quality control practices. Shares of Glaxo GSK, -0.79%   were down 3%. On Sunday, “60 Minutes” ran a piece focusing on allegedly severe quality control deficiencies at one of the company’s Puerto Rican manufacturing plants in the early 2000s. In October, Glaxo paid $750 million to settle a federal lawsuit related to its handling of the matter. Markets Hub: Strong Jobs Report Shares of Opexa Therapeutics Inc. OPXA, -9.36%   rocketed 60% to $2.49. Opexa said that after meeting with U.S. regulators, it believes it is ready to advance its multiple sclerosis therapy Tovaxin into Phase III clinical trials. The therapy uses a patient’s own T-cells to help reduce the risk of relapse in patients with MS, an auto-immune disease that attacks the brain and spinal cord. Opexa added that it is in talks with potential partners about securing adequate funding for the further development of Tovaxin. Shares of Cardiovascular Biotherapeutics CVBT   shot up 15%. On Tuesday, the biotech group announced positive Phase II clinical data for CVBT-141B, its treatment for wounds associated with diabetes. The drug sector’s two main indexes, meanwhile, were split. The NYSE Arca Pharmaceutical Index DRG, +0.38%   declined 0.5% to 308.67, while the Arca Biotechnology Index BTK, +0.15%   advanced 0.8% to 1,308.36. More from MarketWatch Don’t ever do this with your credit card This emerging-market ETF continues to blow away the competition BlackRock fund manager sees this as the market’s ‘sweet spot’ Related Topics Biotechnology U.S. Stocks Markets Health Care","Jan 5, 2011 12:14 p.m. ET",1,"Glaxo, Opexa in drug sector spotlight",https://www.marketwatch.com/story/glaxo-opexa-in-drug-sector-spotlight-2011-01-05
ACER,"NEW YORK (MarketWatch) -- Shares of Opexa Therapeutics soared 65% Wednesday after the biotechnology firm said that it has had two ""successful"" meetings with Food and Drug Administration officials over development of a drug used to treat multiple sclerosis. The company said that ""based on positive feedback from the FDA, Opexa believes it is now positioned from a regulatory perspective to advance with a pivotal Phase 3 clinical study of Tovaxin"" and that it is ""in the process of completing necessary preparations to be able to initiate such a study."" Shares of Opexa OPXA, -9.36% rose $1 to $2.56 in morning action.","Jan 5, 2011 10:56 a.m. ET",1,Opexa soars on talks with FDA over MS drug,https://www.marketwatch.com/story/opexa-soars-on-talks-with-fda-over-ms-drug-2011-01-05
ACER,"BOSTON (MarketWatch) -- The drug sector's two leading indices inched into negative territory Tuesday while shares of Avanir Pharmaceuticals broke from the pack, gaining on news that analysts at Canaccord Adams had initiated coverage of the stock with a buy rating. The NYSE Arca Pharmaceutical Index $DRG and the NYSE Arca Biotechnology Index $BTK were both down nominally in afternoon trading. MARKETS | • The Tell: Market news and analysis • | Canada section • Columns: Stocks | Oil | Gold | Bonds | Dollar  TOOLS AND DATA | • My Portfolio: Know where your funds are? • Real-time currency exchange rates • After-hours stock screener Avanir AVNR shares were up 3% at $2.56 after reaching $2.71 earlier in the session. Avanir also announced that it plans to present Phase III data on its drug Zenvia at the annual meeting of the American Academy of Neurology to be held in Toronto later this week. The first presentation will take place on the afternoon of April 13. Shares of Opexa Therapeutics OPXA, -9.36% also rose on news that it was presenting at the neurology meeting. Opexa plans to present Phase II data on its multiple sclerosis drug Tovaxin on April 14. Shares of Opexa jumped 10% to $2.42. Keryx Biopharmaceuticals KERX, +1.49% shares slid 5% to $3.19. On Monday, Keryx shares rallied 20% after it said that its new colorectal cancer therapy perifosine, which just received ""fast-track"" status from the U.S. Food and Drug Administration, could be out on the market by mid-2012. Keryx licensed the North American rights to perifosine from Aeterna Zentaris AEZS, -2.67% whose shares also soared Monday. Shares of Aeterna were down 5% at 91 cents. More from MarketWatch Samsung Galaxy S9: Putting the Camera to the Test More Coverage Don’t ever do this with your credit card Delta flight scare is a reminder never to put electronics in checked baggage S&P 500 logs longest losing streak of the year as trade-war jitters weigh Related Topics Biotechnology U.S. Stocks Markets Health Care","Apr 6, 2010 3:16 p.m. ET",1,"Avanir, Opexa gain ahead of presentations",https://www.marketwatch.com/story/avanir-opexa-gain-ahead-of-presentations-2010-04-06
